日期,热搜标题,热度,标签,新冠（0/1）,回应,Label-level-1,Label-level-2,Label-level-3
2020年03月02日23点数据,化了全妆如何擦眼泪,639654,软新闻-休闲,,,,,
2020年07月14日23点数据,中储粮公布储备粮食问题调查结果,218134,社会热点-社会热点,,,,,
2020年01月24日23点数据,新冠肺炎进入第二波流行上升期,1445805,社会热点-趋势,,,,,
2020年01月06日11点数据,北方同学给南方同学堆雪人,213836,软新闻-休闲,,,,,
2020年10月14日11点数据,中国再次当选联合国人权理事会成员,82215,国际新闻-国际新闻（与中国相关，非美国）,,,,,
2020年06月19日23点数据,宋茜蚂蚁腰,696552,软新闻-娱乐圈,,,,,
2020年04月21日11点数据,乌克兰出动军队扑救切尔诺贝利大火,160426,国际新闻-国际新闻（与中国无关）,,,,,
2020年02月26日11点数据,湖北新增401例新冠肺炎,1343841,社会热点-趋势,,,,,
2020年12月25日11点数据,英国欧盟达成贸易协议,316426,国际新闻-国际新闻（与中国无关）,,,,,
2020年01月19日11点数据,3D还原女子开车穿越故宫全程,225668,社会热点-社会热点,,,,,
2020年07月22日11点数据,初中生练习后仰跳投不慎坠楼,1329969,社会热点-社会热点,,,,,
2020年03月19日11点数据,澳航约2万人短期失业,282183,社会热点-趋势,,,,,
2019年12月27日11点数据,微信微博聊天记录可作为证据,1769466,社会热点-社会热点,,,,,
2020年11月02日23点数据,胡先煦天津师范大学,469958,软新闻-娱乐圈,,,,,
2020年09月17日23点数据,特朗普与美疾控中心再现分歧,907759,国际新闻-国际新闻（与中国无关）,,,,,
2020年07月24日23点数据,洗面奶千万别抹发际线,509802,软新闻-休闲,,,,,
2020年01月07日11点数据,老人用绳吊7岁孙子下楼救猫,2298735,软新闻-社会怪事,,,,,
2020年07月27日23点数据,重庆机场开设男性安检专用通道,333555,社会政策-本地政策,,,,,
2020年10月24日23点数据,张译演技,342758,软新闻-娱乐圈,,,,,
2020年10月04日23点数据,LGD战胜FNC,616529,软新闻-娱乐圈,,,,,
2020年09月01日11点数据,南京地铁二号线,304814,社会热点-社会热点,,,,,
2020年12月07日11点数据,RM,1736408,社会热点-社会热点,,,,,
2020年01月14日11点数据,猫咪勇敢击退三只恶狼,228163,软新闻-休闲,,,,,
2020年03月07日23点数据,适合代入小说的长相,737389,软新闻-休闲,,,,,
2020年03月04日11点数据,凤凰娱乐,206567,软新闻-娱乐圈,,,,,
2020年02月21日11点数据,日本暂不强制取消大型活动,1081056,国际新闻-国际新闻（与中国无关）,,,,,
2020年04月17日11点数据,虞书欣表白孔雪儿,153262,软新闻-娱乐圈,,,,,
2020年09月15日23点数据,中国是世界上最安全的国家之一,579226,社会热点-社会热点,,,,,
2020年12月06日23点数据,贾玲回应刘德华喊她演夫人,1997520,软新闻-娱乐圈,,回应,,,
2020年09月30日11点数据,为何低俗婚闹屡禁不止,153033,社会热点-趋势,,,,,
2019年12月21日23点数据,快乐大本营,656718,软新闻-娱乐圈,,,,,
2020年02月15日11点数据,湖北一半以上确诊病例都用中医药治疗,3018179,社会热点-趋势,1,,,,
2020年08月02日11点数据,山东新增菲律宾输入确诊病例3例,241148,社会热点-趋势,1,,,,
2020年03月27日11点数据,泰国父亲为儿子剪防疫发型,1228948,国际新闻-国际新闻（与中国无关）,1,,,,
2020年07月10日23点数据,容婳流产,727014,软新闻-娱乐圈,,,,,
2020年09月20日11点数据,94岁哥哥与88岁妹妹吵架离家出走,232766,软新闻-社会怪事,,,,,
2020年06月26日23点数据,金晨好美,552586,软新闻-娱乐圈,,,,,
2020年09月28日11点数据,阿塞拜疆多个地区进入战时状态,115877,国际新闻-国际新闻（与中国无关）,,,,,
2020年05月21日11点数据,每一帧都是屏保的大美中国,306154,软新闻-休闲,,,,,
2020年06月18日23点数据,宁静 生怕那个姐姐不爱我了,371187,软新闻-娱乐圈,,,,,
2020年12月04日23点数据,满洲里公布一新冠确诊患者乘公交轨迹,1204412,社会热点-趋势,,,,,
2020年07月28日23点数据,薇娅直播,407912,软新闻-娱乐圈,,,,,
2020年01月20日23点数据,央视春晚第四次联排,123395,软新闻-娱乐圈,,,,,
2020年11月13日23点数据,1分钟说房产,1475972,软新闻-休闲,,,,,
2020年02月21日23点数据,湖北已经核减病例必须全部加回,289102,社会热点-趋势,1,,,,
2020年10月12日11点数据,易烊千玺 有流量这个标签不用撕掉,571351,软新闻-娱乐圈,,,,,
2020年05月14日11点数据,白宫使用的检测装置经常出现错诊,152009,国际新闻-国际新闻（与中国无关）,,,,,
2020年10月19日23点数据,二十多岁的真正状态,311754,软新闻-休闲,,,,,
2020年01月14日23点数据,阿云嘎 不能跟战战一起坐飞机了,112565,软新闻-娱乐圈,,,,,
2020年07月01日23点数据,CNN女记者直播节目中被抢劫,334122,国际新闻-国际新闻（与中国无关）,,,,,
2020年03月23日11点数据,中国向柬埔寨派遣医疗专家组,744340,国际新闻-国际新闻（与中国相关，非美国）,,,,,
2020年06月02日11点数据,美抗议活动或致新一轮新冠疫情高峰,183894,国际新闻-国际新闻（与中国无关）,1,,,,
2020年01月05日23点数据,花重金买的却闲置的东西,205089,软新闻-休闲,,,,,
2020年03月07日11点数据,SpaceX国际空间站双飞10日游,133990,社会热点-社会热点,,,,,
2020年12月03日11点数据,COSMO盛典,154861,软新闻-娱乐圈,,,,,
2020年08月18日11点数据,鹿晗演技,136454,软新闻-娱乐圈,,,,,
2019年12月31日11点数据,德国柏林市中心发生枪击案,88302,国际新闻-国际新闻（与中国无关）,,,,,
2020年04月04日11点数据,愿山河无恙,1628123,软新闻-休闲,,,,,
2020年12月21日23点数据,邓伦手机字号像老人机,867042,软新闻-娱乐圈,,,,,
2020年08月31日23点数据,北京彩虹,694998,软新闻-休闲,,,,,
2020年06月17日23点数据,日本仙台上空出现白色不明球体,469522,国际新闻-国际新闻（与中国无关）,,,,,
2020年08月29日11点数据,邓伦又当伴郎了,4896068,软新闻-娱乐圈,,,,,
2020年09月02日11点数据,TCL大股东误操作卖出500万股,51766,社会热点-经济,,,,,
2020年02月06日23点数据,国家邮政局呼吁让快递员进小区,807251,社会热点-社会热点,,,,,
2020年10月20日11点数据,北京新增1例境外输入确诊,789096,社会热点-趋势,,,,,
2020年10月15日11点数据,英国利物浦二次封城前夜群众狂欢,101533,国际新闻-国际新闻（与中国无关）,,,,,
2020年05月23日11点数据,美国新冠肺炎确诊病例超159万,516317,国际新闻-国际新闻（与中国无关）,1,,,,
2020年03月29日23点数据,罗永浩回应做主播赚钱还债,296642,软新闻-娱乐圈,,回应,,,
2020年06月15日11点数据,钟南山李兰娟张文宏禁毒宣传片,1872100,政绩类-模范,,,,,
2020年06月22日11点数据,丁禹兮撩郑乃馨头纱,97875,软新闻-娱乐圈,,,,,
2020年08月11日11点数据,美政府考虑阻止部分美国人入境,358922,国际新闻-国际新闻（与中国无关）,,,,,
2020年09月20日23点数据,布布 Nikki,245425,软新闻-娱乐圈,,,,,
2020年07月17日23点数据,湖北恩施城区大面积被淹,216949,社会新闻-灾难,,,,,
2020年07月27日23点数据,刘诗诗背影照,223463,软新闻-娱乐圈,,,,,
2020年04月12日11点数据,惊雷原唱回应杨坤,1195594,软新闻-娱乐圈,,回应,,,
2020年10月20日23点数据,坚果手机发布会,710519,软新闻-休闲,,,,,
2020年06月13日11点数据,教育部要求严格国际学生申请资格,3856874,社会政策-政府政策,,,,,
2020年09月13日23点数据,用口罩做的小裙子,341022,软新闻-休闲,,,,,
2020年05月30日11点数据,数十个美国城市爆发示威,1075951,国际新闻-国际新闻（与中国无关）,,,,,
2020年11月20日23点数据,华彩少年选手简历,181745,软新闻-娱乐圈,,,,,
2020年07月29日11点数据,关晓彤配音三十而已,1646228,软新闻-娱乐圈,,,,,
2020年04月20日23点数据,迪士尼本周起停止支付10万余员工薪水,352564,社会热点-经济,,,,,
2020年02月03日23点数据,宝石gem回应野狼disco涉侵权,204420,软新闻-娱乐圈,,回应,,,
2020年02月09日11点数据,陶红,161926,软新闻-娱乐圈,,,,,
2020年02月26日23点数据,荆门市委书记市长被予以诫勉,286705,政绩类-模范,,,,,
2020年07月24日11点数据,国务院要求实行传染病报告首诊负责制,344659,社会政策-政府政策,,,,,
2020年08月30日11点数据,十五年前的华语乐坛,278451,软新闻-休闲,,,,,
2019年12月15日11点数据,东契奇崴脚,130426,软新闻-娱乐圈,,,,,
2020年08月25日23点数据,北京人艺回应宋丹丹退休,971098,软新闻-娱乐圈,,回应,,,
2020年04月18日23点数据,袁咏仪在线辟谣,1423727,软新闻-娱乐圈,,,,,
2020年10月12日23点数据,北京医保门急诊支付限额升至4500元,511348,社会热点-趋势,,,,,
2019年11月16日23点数据,芭莎合影没人敢站C位,4725335,软新闻-娱乐圈,,,,,
2019年12月17日23点数据,林更新方否认新恋情,1861540,软新闻-娱乐圈,,,,,
2020年10月21日11点数据,吴佩慈否认纪晓波被追债,190012,软新闻-娱乐圈,,,,,
2020年10月31日11点数据,2020年只剩2个月,167530,软新闻-休闲,,,,,
2020年04月09日23点数据,山东理工大学回应学生虐猫,872469,社会热点-丑闻,,回应,,,
2019年12月16日23点数据,鹤唳华亭,411306,软新闻-娱乐圈,,,,,
2020年11月24日23点数据,河南一家6口被杀案凶手仍未落网,294195,社会热点-社会热点,,,,,
2020年04月08日11点数据,杨超越 仙女的脚不会臭,386352,软新闻-娱乐圈,,,,,
2020年04月06日23点数据,春熙路持刀男子有精神疾病史,672209,社会热点-社会热点,,,,,
2020年10月06日23点数据,法网2020,106647,软新闻-娱乐圈,,,,,
2020年06月22日23点数据,加拿大所谓司法独立完全是双重标准,2047860,国际新闻-国际新闻（与中国无关）,,,,,
2020年01月17日11点数据,土耳其总统宣布向利比亚派兵,136319,国际新闻-国际新闻（与中国无关）,,,,,
2020年01月06日11点数据,小寒,342806,软新闻-休闲,,,,,
2020年08月02日23点数据,7岁女童商场偷拿玩具亲妈报警,185156,软新闻-休闲,,,,,
2020年10月16日11点数据,中国驻意大利使馆发布紧急提示,414351,国际新闻-国际新闻（与中国无关）,,,,,
2020年04月11日11点数据,特朗普签令惩罚拒绝本国公民离美国家,317051,国际新闻-国际新闻（与中国无关）,,,,,
2020年02月27日23点数据,味道奇怪但好吃的食物,320324,软新闻-休闲,,,,,
2020年09月25日11点数据,哈尔滨复阳无症状感染者轨迹公布,910490,社会热点-趋势,,,,,
2020年09月22日11点数据,学校消防安全公开课,2000199,社会热点-社会热点,,,,,
2020年01月29日23点数据,李文亮,393274,政绩类-模范,,,,,
2020年07月13日23点数据,美国男子故意参加新冠聚会染病丧命,792852,国际新闻-国际新闻（与中国无关）,,,,,
2020年09月23日11点数据,黄渤打张艺兴像训孩子,146143,软新闻-娱乐圈,,,,,
2020年04月28日11点数据,不想混这个圈了,3281301,软新闻-娱乐圈,,,,,
2020年04月27日11点数据,学生错峰排队上厕所像进考场,307736,软新闻-休闲,,,,,
2020年01月22日11点数据,广东打击哄抬口罩价格行为,1478634,社会政策-本地政策,,,,,
2019年11月26日11点数据,胡浩天好帅,372561,软新闻-娱乐圈,,,,,
2020年03月16日23点数据,汤姆汉克斯,669279,软新闻-娱乐圈,,,,,
2020年08月20日11点数据,成毅破碎感,304478,软新闻-娱乐圈,,,,,
2019年12月14日11点数据,初二学生英语达大学六级水平,1874520,软新闻-社会怪事,,,,,
2019年11月19日23点数据,黄之锋申请更改保释条件被拒,1314743,软新闻-社会事件,,,,,
2020年11月15日23点数据,抖音推荐,706546,软新闻-娱乐圈,,,,,
2020年07月16日11点数据,公司回应经期被罚吃辣条事件,268927,社会热点-丑闻,,回应,,,
2020年05月16日11点数据,31省区市新增13例无症状感染者,156136,社会热点-趋势,,,,,
2020年05月28日23点数据,荔枝的正确打开方式,440122,软新闻-休闲,,,,,
2020年08月12日11点数据,哈尔滨市区共享单车坟场,140964,社会热点-社会热点,,,,,
2020年02月22日11点数据,糖炒圣女果,307677,软新闻-休闲,,,,,
2020年08月13日23点数据,马布里毒奶,437278,软新闻-娱乐圈,,,,,
2020年04月06日11点数据,3个月用粉笔画32米清明上河图,168944,社会热点-社会热点,,,,,
2020年08月15日23点数据,张艺兴选人策略,258120,软新闻-娱乐圈,,,,,
2020年08月09日11点数据,全美共发现超33.8万名儿童感染新冠,456753,国际新闻-国际新闻（与中国无关）,,,,,
2020年08月19日11点数据,哈利波特1全球票房破10亿美元,365746,软新闻-娱乐圈,,,,,
2020年07月30日11点数据,EXO投票,407498,软新闻-娱乐圈,,,,,
2020年06月08日23点数据,周杰伦新歌前奏,303980,软新闻-娱乐圈,,,,,
2020年08月04日11点数据,香港特区暂停港新移交逃犯协定,206906,国际新闻-香港问题,,,,,
2020年02月10日11点数据,全国累计确诊40171例新冠肺炎,4065363,社会热点-趋势,,,,,
2020年02月08日11点数据,澳大利亚山火后遗症,199205,国际新闻-国际新闻（与中国无关）,,,,,
2020年05月13日23点数据,徽柔出嫁,1078623,软新闻-娱乐圈,,,,,
2020年06月04日23点数据,当刑警路遇戴口罩逃犯,170610,社会热点-社会热点,,,,,
2020年05月24日11点数据,说白了你敢吗,3737166,软新闻-休闲,,,,,
2020年06月21日23点数据,私生饭围堵小区邻居苦不堪言,864247,软新闻-娱乐圈,,,,,
2020年07月20日11点数据,江南百景图,286979,软新闻-休闲,,,,,
2020年01月31日11点数据,安徽新增37例新型肺炎,316678,社会热点-趋势,,,,,
2020年04月12日23点数据,木里火灾系11岁男孩点燃松针引发,392791,社会热点-社会热点,,,,,
2020年02月06日23点数据,天天向上,1005368,软新闻-娱乐圈,,,,,
2020年09月26日23点数据,乌克兰军机坠毁前致命瞬间,147816,国际新闻-国际新闻（与中国无关）,,,,,
2020年05月09日11点数据,张萌 女团太惨了,351168,软新闻-娱乐圈,,,,,
2020年03月17日11点数据,明日方舟更新,243295,软新闻-娱乐圈,,,,,
2020年11月15日23点数据,武汉大学教授16年无偿献血200次,651057,政绩类-模范,,,,,
2020年07月29日11点数据,爱奇艺尖叫之夜取消,106725,软新闻-娱乐圈,,,,,
2020年10月08日23点数据,谢霆锋给了曹杨两颗星,431651,软新闻-娱乐圈,,,,,
2020年04月30日23点数据,学霸宅家作息表,251120,软新闻-休闲,,,,,
2020年07月01日23点数据,教室看书老爷爷收到网友寄的书,244165,软新闻-休闲,,,,,
2020年05月26日23点数据,外交部回应安倍称新冠从中国扩散,1466607,国际新闻-国际新闻（与中国相关，非美国）,,回应,,,
2020年07月06日11点数据,上海暴雨,641774,软新闻-休闲,,,,,
2020年09月08日23点数据,外交部驳斥美称中国操纵湄公河水资源,1175566,国际新闻-中美关系,,,,,
2020年11月21日23点数据,浙江绍兴鉴湖景园核酸检测5210人阴性,273657,社会热点-趋势,,,,,
2020年07月02日23点数据,朱朝阳古装,257424,软新闻-娱乐圈,,,,,
2020年02月03日11点数据,湖北慈善总会公示捐赠物资,188075,社会热点-社会热点,,,,,
2020年10月22日11点数据,印度村民喝污水度日,699284,国际新闻-国际新闻（与中国无关）,,,,,
2020年03月19日11点数据,世卫回应特朗普称新冠病毒为中国病毒,1031143,国际新闻-中美关系,,回应,,,
2020年11月09日11点数据,江苏省考,160548,软新闻-休闲,,,,,
2020年06月21日23点数据,北京协和建成核酸采样方舱,346015,政绩类-爱国节日成就,,,,,
2019年12月06日11点数据,2019年沙雕新闻,132605,软新闻-休闲,,,,,
2020年03月03日23点数据,刘真,718484,软新闻-娱乐圈,,,,,
2020年12月21日11点数据,福奇告诉孩子圣诞老人已打过疫苗,602818,国际新闻-国际新闻（与中国无关）,1,,,,
2020年12月19日11点数据,2020你的圣诞定制款,1389155,软新闻-休闲,,,,,
2020年02月11日23点数据,宅在家里很焦虑怎么办,315286,软新闻-休闲,,,,,
2020年03月27日23点数据,鹿晗黄子韬同框搞怪,745048,软新闻-娱乐圈,,,,,
2020年06月26日11点数据,北京昌平区出现首例确诊,717056,社会热点-趋势,,,,,
2020年06月13日11点数据,弗洛伊德,506633,软新闻-娱乐圈,,,,,
2020年05月03日23点数据,郑州40.8度追平当地5月高温纪录,444796,社会热点-趋势,,,,,
2020年01月05日23点数据,卢靖姗旁观韩庚拍吻戏,1927404,软新闻-娱乐圈,,,,,
2020年02月27日11点数据,湖北彻查刑释确诊人员离汉抵京,610893,社会热点-社会热点,,,,,
2020年04月06日11点数据,意大利疫情趋缓,328885,国际新闻-国际新闻（与中国无关）,1,,,,
2020年10月07日11点数据,白宇撞脸熊出没,130782,软新闻-娱乐圈,,,,,
2020年04月03日11点数据,神州租车暴跌,384856,社会热点-经济,,,,,
2020年08月31日11点数据,谢嘉怡香港小姐冠军,156361,软新闻-娱乐圈,,,,,
2019年11月26日23点数据,新人用汉服照登记结婚被拒,627180,社会热点-社会热点,,,,,
2020年02月05日11点数据,戳爷 布布,1015960,软新闻-娱乐圈,,,,,
2020年07月15日11点数据,iG处罚南风,188699,软新闻-娱乐圈,,,,,
2020年10月09日11点数据,网购生鲜冰袋处理成难题,486637,社会热点-社会热点,,,,,
2020年09月23日11点数据,左脚变形跳舞女孩手术成功,137312,社会热点-社会热点,,,,,
2020年11月03日11点数据,美国单日新增新冠确诊超8.1万例,158825,国际新闻-国际新闻（与中国无关）,,,,,
2020年05月18日23点数据,美股,463531,国际新闻-国际新闻（与中国无关）,,,,,
2020年07月10日11点数据,2岁连体双胞胎在意大利成功分离,1796831,国际新闻-国际新闻（与中国无关）,,,,,
2019年11月19日11点数据,黄晓明主持金鸡奖开幕式,158827,软新闻-娱乐圈,,,,,
2019年12月07日23点数据,关晓彤哭戏,835341,软新闻-娱乐圈,,,,,
2020年12月28日11点数据,饮料巨头打响冬季热饮战,331550,社会热点-社会热点,,,,,
2020年04月09日23点数据,青春有你排名,1653216,软新闻-娱乐圈,,,,,
2019年11月22日23点数据,婴儿灭霸,294937,软新闻-娱乐圈,,,,,
2020年02月09日23点数据,物业不让医务人员进小区被责令纠正,605152,社会热点-社会热点,,,,,
2019年12月16日11点数据,国足不敌韩国,74877,软新闻-娱乐圈,,,,,
2020年08月02日23点数据,长歌行预告,171222,软新闻-娱乐圈,,,,,
2020年05月08日11点数据,因演技而被重新认识的演员,285934,软新闻-娱乐圈,,,,,
2020年07月23日23点数据,高考分数线,228876,软新闻-休闲,,,,,
2020年05月22日11点数据,为什么2020没提出全年经济增速目标,1829306,社会热点-趋势,,,,,
2019年11月28日23点数据,潜在抑郁症有哪些表现,640810,软新闻-休闲,,,,,
2020年06月06日11点数据,我国近视人数已超6亿,489357,社会热点-趋势,,,,,
2020年08月07日23点数据,任嘉伦吃播,379456,软新闻-娱乐圈,,,,,
2020年07月29日11点数据,成都14岁女生坠亡案嫌疑人被批捕,101384,社会热点-社会热点,,,,,
2020年06月27日11点数据,许飞写的姐姐们,527469,软新闻-娱乐圈,,,,,
2020年07月02日23点数据,字节跳动副总裁再吐槽腾讯,666010,软新闻-娱乐圈,,,,,
2019年12月14日11点数据,分手后舍不得对方怎么办,354132,软新闻-休闲,,,,,
2020年04月18日11点数据,大量中国雇员滞留马尔代夫,552249,社会热点-社会热点,,,,,
2020年04月29日23点数据,星空芋泥奶茶,510725,软新闻-休闲,,,,,
2020年01月19日23点数据,想见你,188457,软新闻-休闲,,,,,
2020年08月17日11点数据,四川局地特大暴雨,143763,软新闻-休闲,,,,,
2019年12月14日23点数据,误杀,641629,软新闻-娱乐圈,,,,,
2020年04月19日23点数据,腊月红刺杀商细蕊,319836,软新闻-娱乐圈,,,,,
2019年12月31日23点数据,假唱,2223511,软新闻-娱乐圈,,,,,
2020年03月25日11点数据,白鹿春日元气妆,1761727,软新闻-休闲,,,,,
2020年05月14日23点数据,允许符合要求的美国大麦进口,359579,国际新闻-中美关系,,,,,
2020年06月24日23点数据,童话与现实的距离,210542,软新闻-休闲,,,,,
2020年12月17日23点数据,杨紫错说酒醉的蝴蝶,822047,软新闻-娱乐圈,,,,,
2020年08月04日11点数据,罗霈颖去世,2363018,软新闻-娱乐圈,,,,,
2020年12月26日23点数据,刑法最新修改内容,571740,社会政策-政府政策,,,,,
2020年05月06日23点数据,小学生世界名画仿拍秀,146045,软新闻-休闲,,,,,
2020年06月06日23点数据,刘梦否认来创3蹭流量,354607,软新闻-娱乐圈,,,,,
2020年01月05日23点数据,让你难忘的电视剧台词,88302,软新闻-休闲,,,,,
2020年09月17日11点数据,詹姆斯连续16年入选最佳阵容,144404,软新闻-娱乐圈,,,,,
2020年04月06日23点数据,瓜迪奥拉母亲因新冠去世,646519,国际新闻-国际新闻（与中国无关）,,,,,
2020年04月29日11点数据,BBC揭美猪肉加工厂超800人感染内情,173759,社会热点-社会热点,,,,,
2020年03月18日11点数据,碟中谍7剧组复工,219603,软新闻-娱乐圈,,,,,
2020年12月20日11点数据,于朦胧和杜淳掰手腕全程保持微笑,485453,软新闻-娱乐圈,,,,,
2020年09月29日23点数据,击剑世界冠军体能测试出局,667524,软新闻-娱乐圈,,,,,
2020年02月19日11点数据,朴振英腹肌 车银优腹肌,932493,软新闻-娱乐圈,,,,,
2020年03月23日23点数据,边伯贤为N号房事件发声,312583,社会热点-丑闻,,,,,
2019年12月20日11点数据,庆祝澳门回归祖国20周年大会,897265,政绩类-爱国节日成就,,,,,
2019年12月14日23点数据,锦衣之下定档,383809,软新闻-娱乐圈,,,,,
2020年01月20日23点数据,浙江发现5例武汉来浙并有发热等症状患者,130695,社会热点-趋势,,,,,
2020年10月20日11点数据,特朗普称福奇博士是灾难,897477,国际新闻-国际新闻（与中国无关）,,,,,
2020年10月22日23点数据,鹿晗关晓彤情侣帽,388545,软新闻-娱乐圈,,,,,
2020年06月25日11点数据,美国新冠肺炎确诊超237万,118814,国际新闻-国际新闻（与中国无关）,,,,,
2020年10月24日23点数据,黄旭老婆,992698,软新闻-娱乐圈,,,,,
2019年11月21日11点数据,90后老师的心态都是这样,135579,软新闻-休闲,,,,,
2020年12月15日11点数据,彭于晏意志力有多强,593034,软新闻-娱乐圈,,,,,
2020年06月08日11点数据,何洛洛坐塌蛋糕,246401,软新闻-娱乐圈,,,,,
2020年12月23日11点数据,英雄联盟,248291,软新闻-娱乐圈,,,,,
2020年12月31日23点数据,成都首发病例或接触隔离点垃圾感染,745543,社会热点-社会热点,1,,,,
2020年06月23日11点数据,养老金中央调剂超7000亿,143365,社会热点-趋势,,,,,
2020年09月07日23点数据,袁隆平号召更多年轻人从事现代农业,342081,政绩类-模范,,,,,
2020年09月26日11点数据,当武警特战队员偶遇藏族小学生,149811,社会热点-社会热点,,,,,
2020年10月15日23点数据,58分钟生死通话,360958,社会热点-社会热点,,,,,
2020年10月09日23点数据,中餐厅,248682,软新闻-娱乐圈,,,,,
2020年10月30日11点数据,小KK怀孕,179475,软新闻-娱乐圈,,,,,
2020年02月24日11点数据,天文学泰斗韩天芑感染新冠肺炎,600359,社会热点-社会热点,,,,,
2020年10月30日11点数据,八组,228638,软新闻-休闲,,,,,
2020年05月18日11点数据,离婚的人为什么越来越多了,645147,软新闻-休闲,,,,,
2020年04月23日23点数据,创3学员亮相海报,275697,软新闻-娱乐圈,,,,,
2020年06月20日11点数据,北京新增确诊22例,753483,社会热点-趋势,,,,,
2020年02月22日11点数据,派大星短裤,425016,软新闻-休闲,,,,,
2020年12月31日11点数据,你会从事新兴职业吗,231344,软新闻-休闲,,,,,
2020年01月17日23点数据,火箭少女要嗨森歌词,909149,软新闻-娱乐圈,,,,,
2020年10月03日11点数据,赵薇 所有女演员都很难出头,3796155,软新闻-娱乐圈,,,,,
2020年06月20日23点数据,这是切到番茄的大动脉吗,474704,软新闻-休闲,,,,,
2020年11月15日23点数据,最帅电竞选手,770233,软新闻-娱乐圈,,,,,
2020年09月15日23点数据,iPhone12,559190,软新闻-休闲,,,,,
2020年06月09日11点数据,今年208家房企破产,98391,社会热点-经济,,,,,
2020年12月13日11点数据,北京新增2例境外输入确诊病例,210079,社会热点-趋势,1,,,,
2020年03月20日23点数据,王子健向朱闪闪求婚,616948,软新闻-娱乐圈,,,,,
2020年03月31日23点数据,许可馨,2241580,软新闻-娱乐圈,,,,,
2020年02月08日11点数据,湖北以外地区新增病例连降四天,1080166,社会热点-趋势,1,,,,
2020年12月17日23点数据,周翡为四十八寨报仇,263036,软新闻-娱乐圈,,,,,
2020年12月16日23点数据,对未来对象的三大要求,404196,软新闻-休闲,,,,,
2020年07月05日11点数据,35岁C罗创尤文59年新纪录,589380,软新闻-娱乐圈,,,,,
2020年10月29日11点数据,G2签约NiKo,256625,软新闻-娱乐圈,,,,,
