"ï..story_date","year","month","day","Time","headline","topic.label","first_time_appear_eventbased","official.view","Response","Renmin.Daily","Renmin.Daily.Content","Notes","gtop","offvoice"
"11/8/2019",2019,11,8,"E","1. ç¬¬ä¸ƒæ¬¡å…¨å›½äººå£æ™®æŸ¥å¼€å§‹","Social affairs",1,0,0,0,"","","Social issues",0
"11/8/2019",2019,11,8,"E","2. æ™ºåˆ©å¸‚é•¿ä¸ºèº²è®°è€…æé—®å½“è¡—ç‹‚å¥”","Social affairs",1,0,0,0,"","","Social issues",0
"11/8/2019",2019,11,8,"E","3. ç¾å›½å‘éŸ©å›½ç´¢è¦328äº¿ä¿æŠ¤è´¹","International affairs (non-China)",1,0,0,0,"","","International news",0
"11/9/2019",2019,11,9,"M","1. 15åœ°ç‹¬ç”Ÿå­å¥³æœ‰æŠ¤ç†å‡","Social affairs - local policy ",1,0,0,0,"","","Social policy",0
"11/9/2019",2019,11,9,"M","2. å¥³å¸‚é•¿è¢«æŠ—è®®è€…æ³¼æ²¹æ¼†å‰ªå¤´å‘","Social scandal",1,0,0,0,"","","Social issues",0
"11/9/2019",2019,11,9,"M","3. è­¦æ–¹é€šæŠ¥9å²ç”·å­©è¢«æ‰“æ­»","Crime & court",1,0,0,1,"2","","Crime & court",1
"11/9/2019",2019,11,9,"M","4. è‹±è­¦æ–¹å…¬å¸ƒ39åè´§è½¦é‡éš¾è€…ä¿¡æ¯","International news (non-China)",1,0,0,0,"","","International news",0
"11/9/2019",2019,11,9,"M","5. é•¿æ²™9å²ç”·ç«¥é‡å®³ç›®å‡»è€…å›åº”","Crime & court",1,0,1,0,"","","Crime & court",0
"11/9/2019",2019,11,9,"M","6. å æ¥¼å¥³æ•™å¸ˆç”Ÿå‰é•¿å½•éŸ³æ›å…‰","Crime & court",1,0,0,0,"","","Crime & court",0
"11/9/2019",2019,11,9,"E","1. æ¾³é—¨å¤§å­¦å­¦ä½é¢æˆå…¸ç¤¼å¸ˆç”Ÿé«˜å”±å›½æ­Œ","Patriotic acts/festivals",1,0,0,1,"1","","Flattering news",1
"11/9/2019",2019,11,9,"E","2. ç™¾ä¸‡é¦™æ¸¯å¸‚æ°‘å‚ä¸åé»‘æš´å¤§è”ç½²","Hong Kong",1,0,0,0,"","","International news",0
"11/9/2019",2019,11,9,"E","3. è‹±å›½è´§è½¦æƒ¨æ¡ˆé‡éš¾è€…æœ€å°15å²","International affairs (non-China)",0,0,0,0,"","","International news",0
"11/9/2019",2019,11,9,"E","4. é¦™æ¸¯åå¯¹æ´¾è®®å‘˜æœ±å‡¯è¿ªè¢«æ•","Hong Kong",1,0,0,0,"","","International news",0
"11/10/2019",2019,11,10,"M","1. å¤®è§†ä¸»æ’­è°ˆç²¾ç¥é—®é¢˜ä¸æ˜¯å…ç½ªç¬¦","Crime & court",1,1,0,0,"","","Crime & court",1
"11/10/2019",2019,11,10,"M","2. 9å²ç”·å­©é‡å®³æ¡ˆå«ŒçŠ¯è¢«çˆ¶æ¯åœè¯","Crime & court",0,0,0,0,"","","Crime & court",0
"11/10/2019",2019,11,10,"M","3. åˆ3åé¦™æ¸¯ç«‹æ³•ä¼šè®®å‘˜è¢«æ•","Hong Kong",0,0,0,0,"","","International news",0
"11/10/2019",2019,11,10,"M","4. ç™¾ä¸‡é¦™æ¸¯å¸‚æ°‘å‚ä¸åé»‘æš´å¤§è”ç½²","Hong Kong",1,0,0,0,"","","International news",0
"11/10/2019",2019,11,10,"M","5. è‹±å›½è´§è½¦æƒ¨æ¡ˆé‡éš¾è€…æœ€å°15å²","International news (non-China)",0,0,0,0,"","","International news",0
"11/10/2019",2019,11,10,"M","6. è½°ç‚¸æœºé£è¡Œå‘˜å¤®è§†éœ¸æ°”å¼€è®²","Role model",1,0,0,0,"","","Flattering news",0
"11/10/2019",2019,11,10,"E","1. å¤§åº†äº§å¦‡æ­»äº¡åˆæ­¥è°ƒæŸ¥æƒ…å†µ","Crime & court",1,0,0,0,"","","Crime & court",0
"11/10/2019",2019,11,10,"E","2. è‘£æ˜ç è®©åˆ©30äº¿æ‰“å‡»ä½åŠ£","Social affairs - consumer rights",1,0,0,0,"","","Social issues",0
"11/10/2019",2019,11,10,"E","3. å‰æ—æ··å‡åœŸç½è½¦ä¸é¢åŒ…è½¦ç›¸æ’","Crime & court",1,0,0,0,"","","Crime & court",0
"11/10/2019",2019,11,10,"E","4. é¦™æ¸¯ä¸­è”åŠè‡´åœ¨æ¸¯å†…åœ°ç”Ÿå…¬å¼€ä¿¡","Hong Kong",1,0,0,0,"","","International news",0
"11/10/2019",2019,11,10,"E","5. è­¦æ–¹å‘è¢«è¯¯è®¤å«–å¨¼è€äººé“æ­‰","Hong Kong",1,0,0,0,"","","International news",0
"11/10/2019",2019,11,10,"E","6. ä¼Šæœ—å‘ç°æ–°æ²¹ç”°","International news (non-China)",1,0,0,0,"","","International news",0
"11/10/2019",2019,11,10,"E","7. ç¬¬äºŒå±Šè¿›åšä¼šç´¯è®¡æ„å‘æˆäº¤711.3äº¿ç¾å…ƒ","Social affairs - economics",1,0,0,0,"","","Social issues",0
"11/10/2019",2019,11,10,"E","8. 10æ¬¾Appæ¶‰å«Œè¶…èŒƒå›´é‡‡é›†ä¸ªäººéšç§","Social affairs - consumer rights",1,0,0,0,"","","Social issues",0
"11/10/2019",2019,11,10,"E","9. æ¸¯ç§‘å¤§å£°æ˜","Hong Kong",1,0,0,0,"","","International news",0
"11/11/2019",2019,11,11,"M","1. é¦™æ¸¯ç‰¹åŒºæ”¿åºœå°±æš´å¾’ç ´åè¡Œä¸ºå‘å£°","Hong Kong",1,0,0,0,"","","International news",0
"11/11/2019",2019,11,11,"M","2. äººæ°‘ç©ºå†›æˆç«‹70å‘¨å¹´","Patriotic acts/festivals",1,0,0,0,"","","Flattering news",0
"11/11/2019",2019,11,11,"M","3. é¦™æ¸¯ä¸­è”åŠè‡´åœ¨æ¸¯å†…åœ°ç”Ÿå…¬å¼€ä¿¡","Hong Kong",0,0,0,1,"","","International news",1
"11/11/2019",2019,11,11,"M","4. 31çœä»½æˆ·ç±åˆ¶åº¦æ”¹é©è¿›å…¥å…³é”®æœŸ","Social affairs",1,0,0,0,"","","Social issues",0
"11/11/2019",2019,11,11,"M","5. ç»åˆ©ç»´äºšæ€»ç»Ÿå®£å¸ƒè¾èŒ","International affairs (non-China)",1,0,0,0,"","","International news",0
"11/11/2019",2019,11,11,"E","1. å¤–äº¤éƒ¨åŠç¾æ–¹åˆ«é«˜ä¼°è‡ªå·±çš„é€ è°£èƒ½åŠ›","International affairs (China-US)",1,1,0,0,"","","International news",1
"11/11/2019",2019,11,11,"E","2. é¦™æ¸¯æš´å¾’æŠ¢æªè‡´è­¦æ–¹å¼€æª","Hong Kong",1,0,0,0,"","","International news",0
"11/11/2019",2019,11,11,"E","3. å…­éƒ¨é—¨çº¦è°ˆç½‘çº¦è½¦é¡ºé£è½¦å¹³å°","Government acts",1,0,0,0,"","","Social policy",0
"11/11/2019",2019,11,11,"E","4. æµ™å¤§å¥³ç”Ÿè¢«å®³æ¡ˆç»´æŒåŸåˆ¤","Crime & court",1,0,0,0,"","","Crime & court",0
"11/11/2019",2019,11,11,"E","5. éŸ©å›½é‡å¯ä¸–è¶Šå·è°ƒæŸ¥","International affairs (non-China)",1,0,0,0,"","","International news",0
"11/11/2019",2019,11,11,"E","6. è¿‡å¹´å‰çš„ç»æµçŠ¶å†µ","Social affairs - economics",1,0,0,0,"","","Social issues",0
"11/11/2019",2019,11,11,"E","7. æ°‘èˆªå±€å›åº”å¥³ä¹˜å®¢è¿›é©¾é©¶èˆ±","Social scandal",1,0,1,0,"","","Social issues",0
"11/12/2019",2019,11,12,"M","1. å¤§åº†æ­»äº¡äº§å¦‡æ¯äº²å›åº”è´¨ç–‘","Crime & court",0,0,1,0,"","","Crime & court",0
"11/12/2019",2019,11,12,"M","2. éŸ©åª’æ›ç¦å²›æ ¸è®¾æ–½å‘ç°41å¤„è£‚ç¼","International affairs (non-China)",1,0,0,0,"","","International news",0
"11/12/2019",2019,11,12,"M","3. çå­å²›çš„æ‰‡è´åˆåŒå’è·‘äº†","Social scandal",1,0,0,0,"","","Social issues",0
"11/12/2019",2019,11,12,"M","4. å¤–äº¤éƒ¨åŠç¾æ–¹åˆ«é«˜ä¼°è‡ªå·±çš„é€ è°£èƒ½åŠ›","International affairs (China-US)",1,0,0,0,"","","International news",0
"11/12/2019",2019,11,12,"M","5. äº¬é˜¿å°¼çºµç«æ¡ˆå«Œç–‘äººæ€äººæ„å›¾æ˜ç¡®","Crime & court",1,0,0,0,"","","Crime & court",0
"11/12/2019",2019,11,12,"M","6. æµ™æ±Ÿé«˜é€Ÿåæ’ä¸ç³»å®‰å…¨å¸¦å°†è¢«ç½š","Social affairs",1,0,0,0,"","","Social issues",0
"11/12/2019",2019,11,12,"E","1. é•¿æ²™è¢«æ‰“æ­»ç”·ç«¥é—ä½“ç«åŒ–","Crime & court",0,0,0,0,"","","Crime & court",0
"11/12/2019",2019,11,12,"E","2. ä¸œèˆªå›åº”èˆªç­ä¸‡ç±³é«˜ç©ºé€Ÿé™","Social scandal",0,0,1,0,"","","Social issues",0
"11/12/2019",2019,11,12,"E","3. é¦™æ¸¯ä¸­å¤§","Hong Kong",1,0,0,0,"","","International news",0
"11/12/2019",2019,11,12,"E","4. å¤–äº¤éƒ¨æ‰¹ç¾è‹±æ˜¯éä¸åˆ†","International affairs (China-US)",1,1,0,0,"","","International news",1
"11/12/2019",2019,11,12,"E","5. æ¾³é—¨åˆå‘å¤§çº¢åŒ…","Social affairs",1,0,0,0,"","","Social issues",0
"11/12/2019",2019,11,12,"E","6. çå­å²›è‘£äº‹é•¿ç§°æ‰‡è´æ˜¯åˆšæ­»çš„","Social scandal",0,0,1,0,"","","Social issues",0
"11/13/2019",2019,11,13,"M","1. æ‚‰å°¼é¢ä¸´ç¾éš¾çº§ç«ç¾é£é™©","International news (non-China)",1,0,0,0,"","","International news",0
"11/13/2019",2019,11,13,"M","2. æ¸¯ä¸­å¤§","Hong Kong",0,0,0,0,"","","International news",0
"11/13/2019",2019,11,13,"M","3. å†…åœ°ç”Ÿæ•‘æ´","Hong Kong",1,0,0,0,"","","International news",0
"11/13/2019",2019,11,13,"M","4. æ¸¯é“é­ç ´å7æ¡çº¿ä¸¥é‡å»¶è¯¯","Hong Kong",1,0,0,0,"","","International news",0
"11/13/2019",2019,11,13,"M","5. é»˜æ²™ä¸œåŸƒåšæ‹‰ç—…æ¯’ç–«è‹—è·æ‰¹ä¸Šå¸‚","International news (non-China)",1,0,0,0,"","","International news",0
"11/13/2019",2019,11,13,"M","6. å¾·å›½ä¹‹å£° é‡‡è®¿","Hong Kong",1,0,0,0,"","","International news",0
"11/13/2019",2019,11,13,"M","7. é˜³æ¾„æ¹–è¶…åƒå®¶å†œå®¶ä¹æ— ç…§ç»è¥","Social scandal",1,0,0,0,"","","Social issues",0
"11/13/2019",2019,11,13,"E","1. é¦™æ¸¯å¤šé—´å¤§å­¦å®£å¸ƒä½™ä¸‹å­¦æœŸææ—©ç»“æŸ","Hong Kong",1,0,0,0,"","","International news",0
"11/13/2019",2019,11,13,"E","2. é¦™æ¸¯å¤§å­¦æ¯•ä¸šå…¸ç¤¼æ¯•ä¸šç”Ÿé«˜å”±å›½æ­Œ","Hong Kong",1,0,0,0,"","","International news",0
"11/13/2019",2019,11,13,"E","3. é¦™æ¸¯å…ƒæœ—å¸‚æ°‘åˆåŠ›é©±èµ¶æš´å¾’","Hong Kong",1,0,0,0,"","","International news",0
"11/13/2019",2019,11,13,"E","4. çœŸå®ç¼‰æ¯’ç°åœºæœ‰å¤šå±é™©","Role model",1,0,0,0,"","","Flattering news",0
"11/13/2019",2019,11,13,"E","5. æ¸¯è­¦æ‹…å¿ƒçˆ±å¿ƒå¸‚æ°‘è¢«èµ·åº•","Hong Kong",1,0,0,0,"","","International news",0
"11/13/2019",2019,11,13,"E","6. é¦™æ¸¯è­¦æ–¹æ˜¨å¤©å…±æ‹˜æ•142äºº","Hong Kong",1,0,0,0,"","","International news",0
"11/13/2019",2019,11,13,"E","7. 3åæ°‘è­¦æ‰§è¡Œå…¬åŠ¡æ—¶é‡è½¦ç¥¸æ®‰èŒ","Role model",1,0,0,0,"","","Flattering news",0
"11/13/2019",2019,11,13,"E","8. é•¿æ²™è¢«æ‰“æ­»ç”·ç«¥å®¶å±ä¸‰é—®","Crime & court",0,0,1,0,"","","Crime & court",0
"11/14/2019",2019,11,14,"M","1. å¤©æ´¥ç†å·¥æœ‰å­¦ç”Ÿæ„ŸæŸ“è¯ºå¦‚ç—…æ¯’","Social affairs",1,0,0,0,"","","Social issues",0
"11/14/2019",2019,11,14,"M","2. ç¥ç§˜äººè´©å­æ¢…å§¨æ¡ˆæœ€æ–°è¿›å±•","Crime & court",1,0,0,0,"","","Crime & court",0
"11/14/2019",2019,11,14,"M","3. é¦™æ¸¯å¤§å­¦æ¯•ä¸šå…¸ç¤¼æ¯•ä¸šç”Ÿé«˜å”±å›½æ­Œ","Hong Kong",0,0,0,0,"","","International news",0
"11/14/2019",2019,11,14,"M","4. éŸ©æ…°å®‰å¦‡å¯¹æ—¥æœ¬æ”¿åºœç´¢èµ”æ¡ˆé¦–å¼€åº­","International affairs (non-China)",1,0,0,0,"","","International news",0
"11/14/2019",2019,11,14,"M","5. ä¸­å›½ä¹°å®¶è½¬æˆ˜æ³°å›½ç‚’æˆ¿","International news (China related)",1,0,0,0,"","","International news",0
"11/14/2019",2019,11,14,"M","6. ææ–™é€ å‡4äººåŒ—äº¬æˆ·ç±è¢«æ³¨é”€","Social scandal",1,0,0,0,"","","Social issues",0
"11/14/2019",2019,11,14,"M","7. æ¸¯è­¦æ‹…å¿ƒçˆ±å¿ƒå¸‚æ°‘è¢«èµ·åº•","Hong Kong",0,0,0,0,"","","International news",0
"11/14/2019",2019,11,14,"M","8. é¦™æ¸¯å…ƒæœ—å¸‚æ°‘åˆåŠ›é©±èµ¶æš´å¾’","Hong Kong",0,0,0,0,"","","International news",0
"11/14/2019",2019,11,14,"M","9. æ— é”¡åœ°é“2å·çº¿ç«£å·¥å†³ç®—å¤šè®¡è¿‘6äº¿","Social affairs",1,0,0,0,"","","Social issues",0
"11/14/2019",2019,11,14,"M","10. å®˜æ–¹å›åº”ç”·ç«¥å äº•èº«äº¡äº‹ä»¶","Crime & court",1,0,1,0,"","","Crime & court",0
"11/14/2019",2019,11,14,"E","1. èµ·åº•é¦™æ¸¯ä¹±å±€çš„å¹•åé»‘é‡‘","Hong Kong",1,0,0,0,"","","International news",0
"11/14/2019",2019,11,14,"E","2. å…¬å®‰éƒ¨ æš—ç½‘ä¸æ˜¯æ³•å¤–ä¹‹åœ°","Crime & court",1,1,0,1,"1","","Crime & court",1
"11/14/2019",2019,11,14,"E","3. æ¢…å§¨æ¡ˆæ‰¾å›å„¿ç«¥çˆ¶äº²å·²è‡ªæ€","Crime & court",0,0,0,0,"","","Crime & court",0
"11/14/2019",2019,11,14,"E","4. è€äººçœ‹åˆ°ç‰ºç‰²æ¶ˆé˜²å‘˜ç…§ç‰‡å¤±å£°ç—›å“­","Role model",1,0,0,1,"1","","Flattering news",1
"11/14/2019",2019,11,14,"E","5. å°†å·¥ä¸šé…’ç²¾å…‘å…¥å©šå®´é…’è‡´5æ­»","Social scandal",1,0,0,1,"1","","Social issues",1
"11/14/2019",2019,11,14,"E","6. ç¥ç§˜äººè´©å­æ¢…å§¨ç‰¹å¾","Crime & court",0,0,0,0,"","","Crime & court",0
"11/14/2019",2019,11,14,"E","7. é¦™æ¸¯å°†åœ¨å‘¨æœ«å®æ–½å®µç¦ç³»è°£è¨€","Hong Kong",1,0,0,0,"","","International news",0
"11/14/2019",2019,11,14,"E","8. é¦™æ¸¯å¿…é¡»æ­¢æš´åˆ¶ä¹±æ¢å¤ç§©åº","Hong Kong",1,0,0,1,"2","16-Nov","International news",1
"11/15/2019",2019,11,15,"M","1. ç–‘è¢«æš´å¾’å‡»ä¸­å¤´éƒ¨çš„é¦™æ¸¯ç”·å­æ­»äº¡","Hong Kong",1,0,0,1,"1","#è€¿çˆ½ç”¨å››ä¸ªä¸è¦è­¦å‘Šè‹±å›½#","International news",1
"11/15/2019",2019,11,15,"M","2. é¦™æ¸¯å¾‹æ”¿å¸å¸é•¿åœ¨ä¼¦æ•¦é‡è¢­","Hong Kong",1,0,0,1,"2","","International news",1
"11/15/2019",2019,11,15,"M","3. ç¾å›½ä»Šå¹´å‘ç”Ÿ85èµ·æ ¡å›­æªå‡»äº‹ä»¶","International news (non-China)",1,0,0,0,"","","International news",0
"11/15/2019",2019,11,15,"M","4. é™ˆæ–¹å®‰ç”Ÿè¢«é¦™æ¸¯å¸‚æ°‘å½“è¡—æ€’éª‚","Hong Kong",1,0,0,0,"","","International news",0
"11/15/2019",2019,11,15,"M","5. èšŒåŸ å¤§ç«","Social affairs - disaster",1,0,0,0,"","","Social issues",0
"11/15/2019",2019,11,15,"M","6. èµ·åº•é¦™æ¸¯ä¹±å±€çš„å¹•åé»‘é‡‘","Hong Kong",0,0,0,0,"","","International news",0
"11/15/2019",2019,11,15,"M","7. å­™æ¨æŠµè¾¾ç‘å£«å¬è¯ä¼šç°åœº","Social affairs - celebrity",1,0,0,0,"","","Soft news",0
"11/15/2019",2019,11,15,"M","9. ä¸­å›½æŠ—ç™Œæ–°è¯åœ¨ç¾è·æ‰¹ä¸Šå¸‚","International news (China related)",1,0,0,0,"","","International news",0
"11/16/2019",2019,11,16,"M","1. é¦™æ¸¯ç»æµçŠ¶å†µæ€¥é€Ÿæ¶åŒ–","Hong Kong",1,0,0,0,"","","International news",0
"11/16/2019",2019,11,16,"M","2. å­™æ¨å›åº”ä¸æ£€æµ‹å®˜å‘ç”Ÿå†²çª","Social affairs - celebrity",0,0,1,0,"","","Soft news",0
"11/16/2019",2019,11,16,"M","3. é¦™æ¸¯å¸‚æ°‘è‡ªå‘æ‚¼å¿µé‡å®³æ¸…æ´å·¥è€ä¼¯","Hong Kong",1,0,0,1,"1","","International news",1
"11/16/2019",2019,11,16,"M","4. é€¾å…«æˆå¹´è½»äººç”¨ä¿¡è´·äº§å“","Social affairs - trends",1,0,0,0,"","","Soft news",0
"11/16/2019",2019,11,16,"M","5. æ¸¯è­¦æŒ‡å¤šé—´å¤§å­¦è¢«æ”¹é€ æˆç½ªæ¶åŸºåœ°","Hong Kong",1,0,0,0,"","","International news",0
"11/16/2019",2019,11,16,"M","6. è‹±å›½å¤šæ‰€å¤§å­¦å¬å›åœ¨æ¸¯äº¤æ¢ç”Ÿ","Hong Kong",1,0,0,0,"","","International news",0
"11/16/2019",2019,11,16,"M","7. æ„å¤§åˆ©æˆå…¨çƒé¦–ä¸ªå¼ºåˆ¶å¼€æ°”å€™è¯¾å›½å®¶","International news (non-China)",1,0,0,0,"","","International news",0
"11/16/2019",2019,11,16,"M","8. æ¾³å¤§åˆ©äºšæ—ç«å·²è‡´350åªè€ƒæ‹‰é‡éš¾","International news (non-China)",1,0,0,0,"","","International news",0
"11/16/2019",2019,11,16,"M","9. è‹±å›½å¥³ç”Ÿå‘æ˜é±¼çš®åšçš„å¯é™è§£å¡‘æ–™","International news (non-China)",1,0,0,0,"","","International news",0
"11/16/2019",2019,11,16,"E","1. å†…åœ°åŒè¡Œæ”¯æŒé¦™æ¸¯è­¦é˜Ÿçš„æ­Œ","Hong Kong",1,0,0,0,"","","International news",0
"11/16/2019",2019,11,16,"E","2. èŒ‚åé€šæŠ¥12å²æ™ºéšœå¥³å­©äºŒæ¬¡æ€€å­•","Social scandal",1,0,0,0,"","","Social issues",0
"11/16/2019",2019,11,16,"E","3. é¦™æ¸¯10å¹´æ¥é¦–æ¬¡ç»æµå¹´åº¦è´Ÿå¢é•¿","Hong Kong",0,0,0,0,"","","International news",0
"11/16/2019",2019,11,16,"E","4. è°¢è°¢ä½ é˜¿sirä¾ ","Hong Kong",1,0,0,0,"","","International news",0
"11/17/2019",2019,11,17,"M","1. å­™æ¨ ä¸ä¼šè¾“äº‰å–å°Šä¸¥è®¨å›å…¬é“","Social affairs - celebrity",0,0,0,0,"","","Soft news",0
"11/17/2019",2019,11,17,"M","2. é¦™æ¸¯10å¹´æ¥é¦–æ¬¡ç»æµå¹´åº¦è´Ÿå¢é•¿","Hong Kong",0,0,0,0,"","","International news",0
"11/17/2019",2019,11,17,"M","3. ç™»è®°åœ¨å†Œåœ¨ä¸–å—äº¬å¤§å± æ€å¹¸å­˜è€…åªå‰©80äºº","Social affairs",1,0,0,2,"1","","Social issues",1
"11/17/2019",2019,11,17,"M","4. æ±¶å·3.4çº§åœ°éœ‡","Social affairs - disaster",1,0,0,0,"","","Social issues",0
"11/17/2019",2019,11,17,"M","5. è°¢è°¢ä½ é˜¿sirä¾ ","Hong Kong",0,0,0,0,"","","International news",0
"11/17/2019",2019,11,17,"M","6. å†…åœ°åŒè¡Œæ”¯æŒé¦™æ¸¯è­¦é˜Ÿçš„æ­Œ","Hong Kong",0,0,0,0,"","","International news",0
"11/17/2019",2019,11,17,"M","7. èŒ‚åé€šæŠ¥12å²æ™ºéšœå¥³å­©äºŒæ¬¡æ€€å­•","Social scandal",0,0,0,0,"","","Social issues",0
"11/17/2019",2019,11,17,"M","8. 46åŸå–œæåƒåœ¾åˆ†ç±»é‡ç‚¹åŸå¸‚","Social affairs - environment",0,0,0,0,"","","Soft news",0
"11/17/2019",2019,11,17,"M","9. çå­å²›å‘˜å·¥ç§°å¸Œæœ›å…¬å¸å€’é—­","Social scandal",0,0,0,0,"","","Social issues",0
"11/17/2019",2019,11,17,"M","10. è’å²›ç°çƒ‚å°¾åˆ«å¢…ç¾¤ä¼¼å¹½çµå¤å ¡","Social affairs",0,0,0,0,"","","Social issues",0
"11/17/2019",2019,11,17,"E","1. 2022å‰åå»ºæˆå¯è½½3äººä¸­å›½ç©ºé—´ç«™","Achievements",1,0,0,0,"","","Flattering news",0
"11/17/2019",2019,11,17,"E","2. è®°ä½æ¢…å§¨çš„é•¿ç›¸","Crime & court",0,0,0,0,"","","Crime & court",0
"11/17/2019",2019,11,17,"E","3. é¦™æ¸¯è­¦æ–¹é˜²çº¿æœ‰è­¦å‘˜è…¿éƒ¨ä¸­ç®­","Hong Kong",1,0,0,0,"","","International news",0
"11/17/2019",2019,11,17,"E","4. æˆ‘å›½éæ´²çŒªç˜Ÿç—…æ¯’æ”»å…³å–å¾—è¿›å±•","Achievements",1,0,0,0,"","","Flattering news",0
"11/17/2019",2019,11,17,"E","5. é¦™æ¸¯æš´å¾’è¢«å¤–å›½äººç—›éª‚","Hong Kong",1,0,0,0,"","","International news",0
"11/17/2019",2019,11,17,"E","6. æ¶ˆé˜²å‘˜è·ªåœ°ä¸ºç«ä¸­æ•‘å‡ºçš„å°çŒ«è¾“æ°§","Role model",1,0,0,0,"","","Flattering news",0
"11/17/2019",2019,11,17,"E","7. å…¨æ¸¯å­¦æ ¡18æ—¥ç»§ç»­åœè¯¾","Hong Kong",1,0,0,0,"","","International news",0
"11/17/2019",2019,11,17,"E","8. å½“ä»£90åç§Ÿæˆ¿ç°çŠ¶","Social affairs - trends",1,0,0,0,"","","Soft news",0
"11/18/2019",2019,11,18,"M","1. é¦™æ¸¯è¢«çƒ§è€ä¼¯éšæ—¶æœ‰ç”Ÿå‘½å±é™©","Hong Kong",0,0,0,0,"","","International news",0
"11/18/2019",2019,11,18,"M","2. 7å¤©è¿é”é…’åº—ä¸¤å¹´å…³åº—è¶…200å®¶","Social affairs",1,0,0,0,"","","Social issues",0
"11/18/2019",2019,11,18,"M","3. å—å¼€å¤§å­¦æ ¡é•¿æ›¹é›ªæ¶›å›åº”è®ºæ–‡é€ å‡","Social scandal",1,0,1,0,"","","Social issues",0
"11/18/2019",2019,11,18,"M","4. å›½äº§èˆªæ¯é©¶å…¥å°æ¹¾æµ·å³¡","Achievements",1,0,0,1,"1&2","#å¤–äº¤éƒ¨å›åº”æˆ‘å›½èˆªæ¯é€šè¿‡å°æ¹¾æµ·å³¡#","Flattering news",1
"11/18/2019",2019,11,18,"M","5. æ¶ˆé˜²å‘˜æ‰”ä¸‹è¢«ç»‘é˜Ÿé•¿ç´§æ€¥å‡ºè­¦","Role model",1,0,0,1,"1","","Flattering news",1
"11/18/2019",2019,11,18,"M","6. åŒ—äº¬ä¹çº§å¤§é£","Social affairs - environment",1,0,0,0,"","","Soft news",0
"11/18/2019",2019,11,18,"M","8. æˆ‘å›½å»ºæˆä¸–ç•Œé¦–ä¾‹åŸä½3Dæ‰“å°åŒå±‚å»ºç­‘","Achievements",1,0,0,1,"1","","Flattering news",1
"11/18/2019",2019,11,18,"M","9. å¤šåœ°æ”¿åºœæœºå…³å‘ç¤¾ä¼šå¼€æ”¾é£Ÿå ‚","Government acts",1,0,0,0,"","","Social policy",0
"11/18/2019",2019,11,18,"M","11. é’å¹´æ±½è½¦æ­£å¼ç ´äº§","Social affairs",1,0,0,0,"","","Social issues",0
"11/18/2019",2019,11,18,"M","12. æ€»å°å°é•¿æ‰¹è¥¿æ–¹åª’ä½“ä¸å°Šé‡äº‹å®","International affairs (China related)",1,1,0,0,"","","International news",1
"11/18/2019",2019,11,18,"E","1. é¦™æ¸¯è¢«çƒ§è€ä¼¯å¦»å­å›åº”","Hong Kong",0,0,1,0,"","","International news",0
"11/18/2019",2019,11,18,"E","2. å¤–äº¤éƒ¨ ä»»ä½•äººä¸è¦ä½ä¼°ä¸­å›½äººçš„å†³å¿ƒ","International affairs (China related)",1,1,0,0,"","","International news",1
"11/18/2019",2019,11,18,"E","3. é¦™æ¸¯ç†å·¥å¤§å­¦é™„è¿‘éƒ¨åˆ†æš´å¾’è¢«è­¦æ–¹æŠ“è·","Hong Kong",1,0,0,0,"","","International news",0
"11/18/2019",2019,11,18,"E","4. æ¸¯è­¦çªç„¶ç»™æš´å¾’æ”¾äº†ä¸‰é¦–æ­Œ","Hong Kong",1,0,0,0,"","","International news",0
"11/18/2019",2019,11,18,"E","5. æ¸¯è­¦ä¸€å“¥ä»»æœŸæœ€åä¸€å¤©","Hong Kong",1,0,0,0,"","","International news",0
"11/18/2019",2019,11,18,"E","6. è¢«æ‹å„¿ç«¥çˆ¶äº²å›åº”æ¢…å§¨å½©ç…§","Crime & court",0,0,1,0,"","","Crime & court",0
"11/18/2019",2019,11,18,"E","7. åœ°é“ç«™å¹¿æ’­æé†’ä¹˜å®¢åƒæ—©é¤","Social affairs",1,0,0,0,"","","Social issues",0
"11/19/2019",2019,11,19,"M","1. å›½åŠ¡é™¢ä»»å…é¦™æ¸¯ç‰¹åˆ«è¡Œæ”¿åŒºæ”¿åºœä¸»è¦å®˜å‘˜","Hong Kong",1,0,0,1,"1","","International news",1
"11/19/2019",2019,11,19,"M","2. ETCæ¬ è´¹è¶…30æ—¥å°†ä¸ŠæŠ¥ä¸ªäººå¾ä¿¡","Social affairs - local policy ",1,0,0,0,"","","Social policy",0
"11/19/2019",2019,11,19,"M","3. é¦™æ¸¯è­¦é˜Ÿæ–°ä¸€å“¥æ˜¯ä½•äººç‰©","Hong Kong",1,0,0,1,"1","#å›½åŠ¡é™¢ä»»å‘½é‚“ç‚³å¼ºä¸ºé¦™æ¸¯è­¦åŠ¡å¤„å¤„é•¿#","International news",1
"11/19/2019",2019,11,19,"M","4. æä¼¯è¢«çƒ§ä¼¤ç°åœºæœ‰2äººè¢«æ‹˜æ•","Hong Kong",0,0,0,0,"","","International news",0
"11/19/2019",2019,11,19,"M","5. å¡çº¸ç‰‡æ¶‰äº‹ç”·å­©ç–‘è¢«èµ¶å‡ºå­¦æ ¡","Social scandal",1,0,0,0,"","","Social issues",0
"11/19/2019",2019,11,19,"M","6. æ”¿åºœå·¥ä½œäººå‘˜é­é©¾è½¦å†²æ’è‡´2æ­»","Social scandal",1,0,0,0,"","","Social issues",0
"11/19/2019",2019,11,19,"M","7. å…¨å›½äººå¤§å¸¸å§”ä¼šæ³•å·¥å§”å‘è¨€äººå‘è¡¨è°ˆè¯","Government acts",1,0,0,0,"","","Social policy",0
"11/19/2019",2019,11,19,"M","8. å±±è¥¿ç…¤çŸ¿ç“¦æ–¯çˆ†ç‚¸15äººé‡éš¾","Social affairs - disaster",1,0,0,0,"","","Social issues",0
"",2019,11,19,"M","è‹±å›½ç§æ ¡è¶…å››æˆæµ·å¤–å­¦ç”Ÿæ˜¯ä¸­å›½äºº","Diaspora",1,0,0,0,"","","International news",0
"11/19/2019",2019,11,19,"M","9. æ•™è‚²éƒ¨å›åº”8æ‰€ä¸­åŒ»è¯å¤§å­¦æœªåˆ—å…¥åå½•","Government acts",1,1,1,0,"","","Social policy",1
"11/19/2019",2019,11,19,"M","10. å±±è¥¿é•¿æ²»è§„å®šå½©ç¤¼ä¸è¶…5ä¸‡","Social affairs - local policy ",1,0,0,0,"","","Social policy",0
"11/19/2019",2019,11,19,"E","1. å­™æ¨ æ„Ÿè°¢å°¿æ£€å®˜çš„è¯šå®å’Œå‹‡æ•¢","Social affairs - celebrity",0,0,0,0,"","","Soft news",0
"11/19/2019",2019,11,19,"E","2. å°åå˜´æ€’æ‰¹é¦™æ¸¯æš´å¾’","Hong Kong",1,0,0,0,"","","International news",0
"11/19/2019",2019,11,19,"E","3. é»„ä¹‹é”‹ç”³è¯·æ›´æ”¹ä¿é‡Šæ¡ä»¶è¢«æ‹’","Hong Kong",1,0,0,0,"","","International news",0
"11/19/2019",2019,11,19,"E","4. è‹±å›½è´§è½¦æ­»è€…å®¶å±ä»˜ä¸èµ·è¿å°¸è´¹","International news (non-China)",0,0,0,0,"","","International news",0
"11/19/2019",2019,11,19,"E","5. 600åä¸­å›½ç•™å­¦ç”ŸæŠ—è®®ä¹±æ¸¯åˆ†å­çªœè®¿çº½çº¦","Diaspora",1,0,0,0,"","","International news",0
"11/19/2019",2019,11,19,"E","6. æ¶ˆé˜²å‘˜å‡ºè­¦å½’æ¥ä¸€æ­¥ä¸‰è¹¦è·¶","Crime & court",1,0,0,0,"","","Crime & court",0
"11/19/2019",2019,11,19,"E","é‡‘é¸¡å¥–ç›´æ’­","Leisure",1,0,0,1,"1","","Soft news",1
"11/19/2019",2019,11,19,"E","7. é¦™æ¸¯è­¦æ–¹äºæ¸¯ä¸­å¤§æ£€è·3900æšæ±½æ²¹å¼¹","Hong Kong",1,0,0,0,"","","International news",0
"11/19/2019",2019,11,19,"E","8. è¢«æš´å¾’ç ¸æ­»çš„æ¸…æ´å·¥ç½—ä¼¯å¤´ä¸ƒ","Hong Kong",0,0,0,0,"","","International news",0
"11/20/2019",2019,11,20,"M","1. é¦™æ¸¯è­¦æ–¹äºæ¸¯ä¸­å¤§æ£€è·3900æšæ±½æ²¹å¼¹","Hong Kong",1,0,0,0,"","","International news",0
"11/20/2019",2019,11,20,"M","2. æ¸¯è­¦ç«ä¸­æ‹å‡ºç…¤æ°”ç½","Hong Kong",1,0,0,0,"","","International news",0
"11/20/2019",2019,11,20,"M","3. åº·è¾‰å–Šè¯é¦™æ¸¯é«˜é™¢","Hong Kong",1,0,0,0,"","","International news",0
"11/20/2019",2019,11,20,"M","4. æ¸¯è‚¡","Hong Kong",1,0,0,0,"","","International news",0
"11/20/2019",2019,11,20,"M","5. é»‘è€å¤§å½“åº­æŒ‡è®¤ä¸»è¯‰æ£€å¯Ÿå®˜","Crime & court",1,0,0,0,"","","Crime & court",0
"11/20/2019",2019,11,20,"M","6. æ¸¯æ¾³åŠå›åº”ç¾å‚è®®é™¢é€šè¿‡æ¶‰æ¸¯æ³•æ¡ˆ","Hong Kong",1,1,1,0,"","","International news",1
"11/20/2019",2019,11,20,"M","7. 4.68äº¿ä¸ªäººä¿¡æ¯æ³„éœ²","Social scandal",1,0,0,0,"","","Social issues",0
"11/20/2019",2019,11,20,"M","8. ç¥ä¸œé€šæŠ¥å¤šäººä¸æœªæˆå¹´å¥³å­©å‘ç”Ÿå…³ç³»","Crime & court",1,0,0,0,"","","Crime & court",0
"11/20/2019",2019,11,20,"M","9. éŸ©ç¾ç¬¬11æ¬¡å†›è´¹åå•†ç ´è£‚","International affairs (non-China)",1,0,0,0,"","","International news",0
"11/20/2019",2019,11,20,"M","10. æ¶ˆé˜²å‘˜æ•‘ç«åæ— æ³•å¼¯è…°æ¡å¤´ç›”","Crime & court",1,0,0,0,"","","Crime & court",0
"11/20/2019",2019,11,20,"M","æ—…ç¾å¤§ç†ŠçŒ«è´è´å›å®¶","Leisure",1,0,0,1,"1","","Soft news",1
"11/20/2019",2019,11,20,"M","11. å–é£è¾Ÿè°·å…¬å¸è·æ”¿åºœè¡¥è´´","Government acts",1,0,0,0,"","","Social policy",0
"11/20/2019",2019,11,20,"E","1. åº·è¾‰å–Šè¯é¦™æ¸¯é«˜é™¢","Hong Kong",0,0,0,0,"","","International news",0
"11/20/2019",2019,11,20,"E","2. å­™æ¨è´¨ç–‘è¡€æ£€å®˜æ‰§ä¸šèµ„è´¨","Social affairs - celebrity",0,0,0,0,"","","Soft news",0
"11/20/2019",2019,11,20,"E","3. å¤–äº¤éƒ¨å¬è§ç¾é©»åä½¿é¦†è´Ÿè´£äºº","International affairs (China-US)",1,0,0,0,"","","International news",0
"11/20/2019",2019,11,20,"E","4. é’¢ç´æ›²æˆ‘çš„ç¥–å›½å“å½»é¦™æ¸¯å¤§ä¼šå ‚","Patriotic acts/festivals",1,0,0,0,"","","Flattering news",0
"11/20/2019",2019,11,20,"E","5. ä¸Šç™¾äº¿ç¾å…ƒæ¯”ç‰¹å¸å·²æ°¸ä¹…ä¸¢å¤±","Social affairs - economics",1,0,0,0,"","","Social issues",0
"11/21/2019",2019,11,21,"M","1. å¹´æ”¶å…¥12ä¸‡ä»¥ä¸‹å…é™¤æ±‡ç®—æ¸…ç¼´","Government acts",1,0,0,0,"","","Social policy",0
"11/21/2019",2019,11,21,"M","2. ç¾å›½å°†ä¸ºä¸­å›½ç•™å­¦ç”Ÿå¼€å¯ç»¿è‰²é€šé“","Diaspora",1,0,0,0,"","","International news",0
"11/21/2019",2019,11,21,"M","3. å°åº¦æ´‹è‘±ä»·æ ¼æš´æ¶¨100å€","International news (non-China)",1,0,0,0,"","","International news",0
"11/21/2019",2019,11,21,"M","4. 31çœä»½æœ€ä½å·¥èµ„è°ƒæ•´","Social affairs - economics",1,0,0,0,"","","Social issues",0
"11/21/2019",2019,11,21,"M","5. é¦™æ¸¯å¸‚æ°‘è‡ªå‘æ¸…ç†çº¢ç£¡éš§é“è·¯éšœ","Hong Kong",1,0,0,0,"","","International news",0
"11/21/2019",2019,11,21,"M","6. è¢éš†å¹³å›¢é˜Ÿé•¿æ±Ÿä¸­æ¸¸åŒå­£ç¨»äº§é‡æ–°é«˜","Achievements",1,0,0,1,"1","","Flattering news",1
"11/21/2019",2019,11,21,"M","7. ä¸Šç™¾äº¿ç¾å…ƒæ¯”ç‰¹å¸å·²æ°¸ä¹…ä¸¢å¤±","Social affairs - economics",0,0,0,0,"","","Social issues",0
"11/21/2019",2019,11,21,"M","8. æ¸¯è­¦è‹¦å£å©†å¿ƒåŠæš´å¾’","Hong Kong",1,0,0,0,"","","International news",0
"11/21/2019",2019,11,21,"M","9. é¦™æ¸¯ç†å·¥å¤§å­¦æ ¡å›­ä¸€ç‰‡ç‹¼è—‰","Hong Kong",1,0,0,0,"","","International news",0
"11/21/2019",2019,11,21,"M","10. è¥¿å¤ªå¹³æ´‹é“¶è¡Œé¢ä¸´330ä¸‡äº¿ç¾å…ƒç½šæ¬¾","Social affairs - economics",1,0,0,0,"","","Social issues",0
"11/21/2019",2019,11,21,"M","11. å¤§ä½¿æ‰¿è®¤ç‰¹æœ—æ™®ä¸ä¹Œå…‹å…°åˆ©ç›Šäº¤æ¢","International affairs (non-China)",1,0,0,0,"","","International news",0
"11/21/2019",2019,11,21,"M","12. åŒ»ç”Ÿé£æœºä¸Šç”¨å˜´å¸®è€äººå¸å°¿","Role model",1,0,0,0,"","","Flattering news",0
"11/21/2019",2019,11,21,"E","1. è‹±é©»é¦™æ¸¯æ€»é¢†é¦†é›‡å‘˜å«–å¨¼å®¡è®¯è§†é¢‘","Social scandal",1,0,0,1,"1","","Social issues",1
"11/21/2019",2019,11,21,"E","è¶…40%å…«å¹´çº§å­¦ç”Ÿä¸ºæ•°å­¦ç„¦è™‘","Social affairs - trends",1,0,0,1,"1","","Soft news",1
"11/21/2019",2019,11,21,"E","2. é¦™æ¸¯è¢«çƒ§æä¼¯å·²è¿›è¡Œä¸¤æ¬¡æ¤çš®æ‰‹æœ¯","Hong Kong",0,0,0,0,"","","International news",0
"11/21/2019",2019,11,21,"E","3. æˆéƒ½çƒ§è„‘å…¬äº¤ç«™åå·²ç®€åŒ–","Social affairs",1,0,0,0,"","","Social issues",0
"11/22/2019",2019,11,22,"M","å°é›ª","Leisure",1,0,0,1,"1","","Soft news",1
"11/22/2019",2019,11,22,"M","1. äººå¤§å¤±è”å¥³æ¯•ä¸šç”Ÿç¡®è®¤ç¦»ä¸–","Social affairs",1,0,0,0,"","","Social issues",0
"11/22/2019",2019,11,22,"M","2. é£æœºä¸Šå¯¼å°¿æ•‘äººåŒ»ç”Ÿè·å¥–10ä¸‡","Role model",0,0,0,0,"","","Flattering news",0
"11/22/2019",2019,11,22,"M","3. å—éèˆªç©ºå–æ¶ˆé¦™æ¸¯èˆªç­","Hong Kong",1,0,0,0,"","","International news",0
"11/22/2019",2019,11,22,"M","4. æ–°ä¸€çº¿åŸå¸‚å¤§å­¦ç”Ÿè½æˆ·æ”¿ç­–ä¸€è§ˆ","Social affairs - local policy ",1,0,0,0,"","","Social policy",0
"11/22/2019",2019,11,22,"M","5. çå­å²›å‘˜å·¥ç§°æ‰‡è´å¯èƒ½æ˜¯å‘›æ­»çš„","Social scandal",1,0,0,0,"","","Social issues",0
"11/22/2019",2019,11,22,"M","6. è‹±é©»é¦™æ¸¯æ€»é¢†é¦†é›‡å‘˜å«–å¨¼å®¡è®¯è§†é¢‘","Hong Kong",0,0,0,1,"1","","International news",1
"11/22/2019",2019,11,22,"M","7. è¥¿å®‰å’¸é˜³æœºåœºå†’å‡ºå¤§é‡çƒŸé›¾","Social affairs",1,0,0,0,"","","Social issues",0
"11/22/2019",2019,11,22,"M","8. å¯Œè´µé¸Ÿå°†ä»æ¸¯è‚¡é€€å¸‚","Social affairs - economics",1,0,0,0,"","","Social issues",0
"11/22/2019",2019,11,22,"M","9. ç”·å­ç¢°ç“·æ­¦è­¦å·¡é€»è½¦","Crime & court",1,0,0,0,"","","Crime & court",0
"11/22/2019",2019,11,22,"E","1. ç¦è’™é¢æ³•æš‚æ—¶æœ‰æ•ˆè‡³æœ¬æœˆ29æ—¥","Hong Kong",1,0,0,0,"","","International news",0
"11/22/2019",2019,11,22,"E","2. ç½—ä¼¯é—ä½“å°†è¢«å¸¦å›å†…åœ°å®‰è‘¬","Hong Kong",1,0,0,0,"","","International news",0
"11/22/2019",2019,11,22,"E","3. é¦™æ¸¯è¢«çƒ§æä¼¯é†’äº†","Hong Kong",1,0,0,0,"","","International news",0
"11/22/2019",2019,11,22,"E","4. é©»æ¸¯éƒ¨é˜Ÿæµ·å†›å®˜å…µçš„å¤œç”Ÿæ´»","Hong Kong",1,0,0,0,"","","International news",0
"11/22/2019",2019,11,22,"E","5. å…¨å›½é«˜é“è¿å¹´äºæŸ","Social affairs - economics",1,0,0,0,"","","Social issues",0
"11/22/2019",2019,11,22,"E","6. æ•™è‚²éƒ¨æ‹Ÿä¸ºæ•™å¸ˆæƒ©æˆ’æƒåˆ’çº¿","Government acts",1,0,0,1,"2","","Social policy",1
"11/22/2019",2019,11,22,"E","7. æŸ³å·é“¶è¡Œè¢«æ‹å–","Social affairs - economics",1,0,0,0,"","","Social issues",0
"11/23/2019",2019,11,23,"M","1. ç¦è’™é¢æ³•æš‚æ—¶æœ‰æ•ˆè‡³æœ¬æœˆ29æ—¥","Hong Kong",0,0,0,0,"","","International news",0
"11/23/2019",2019,11,23,"M","2. ä¸­å¤®æœºå…³é´é€‰é€‰è°ƒ318åå…¬åŠ¡å‘˜","Government acts",1,0,0,0,"","","Social policy",0
"11/23/2019",2019,11,23,"M","3. é©»æ¸¯éƒ¨é˜Ÿæµ·å†›å®˜å…µçš„å¤œç”Ÿæ´»","Hong Kong",0,0,0,0,"","","International news",0
"11/23/2019",2019,11,23,"M","4. æ•™è‚²éƒ¨æ‹Ÿä¸ºæ•™å¸ˆæƒ©æˆ’æƒåˆ’çº¿","Government acts",0,0,0,1,"2","","Social policy",1
"11/23/2019",2019,11,23,"M","5. æ²³å—å¤©ä»·å¢“ä¸€å¹³ç±³è¿‘9ä¸‡","Social affairs",1,0,0,0,"","","Social issues",0
"11/23/2019",2019,11,23,"M","6. åä¸ºå›åº”FCC","International affairs (China-US)",1,0,1,0,"","","International news",0
"11/23/2019",2019,11,23,"E","1. é¦™æ¸¯å¸‚æ°‘ç¾é¢†é¦†å‰é›†ä¼š","Hong Kong",1,0,0,0,"","","International news",0
"11/23/2019",2019,11,23,"E","2. çƒ§å›½æ——13å²å°‘å¥³è®¤ç½ªæ‚”è¿‡","Social scandal",1,0,0,0,"","","Social issues",0
"11/23/2019",2019,11,23,"E","3. é¦™æ¸¯æ”¿ç•Œå‘¼åå¸‚æ°‘ç”¨é€‰ç¥¨å‘æš´åŠ›è¯´ä¸","Hong Kong",0,0,0,1,"1","","International news",1
"11/23/2019",2019,11,23,"E","4. éƒ¨åˆ†èµ°ç§åšæœé»„æ›²éœ‰ç´ è¶…æ ‡","Social affairs - consumer rights",1,0,0,0,"","","Social issues",0
"11/23/2019",2019,11,23,"E","5. 140å®¶ç½‘åº—æŒ¤çˆ†å°åŒº","Social affairs - trends",1,0,0,0,"","","Soft news",0
"11/23/2019",2019,11,23,"E","6. 446å®¶æˆ¿ä¼å®£å¸ƒç ´äº§","Social affairs - economics",1,0,0,0," ","","Social issues",0
"11/23/2019",2019,11,23,"E","7. å°å°¼ç»™å­¦ç”Ÿå‘2000åªé¸¡æˆ’æ‰‹æœºç˜¾","International news (non-China)",1,0,0,0,"","","International news",0
"11/24/2019",2019,11,24,"M","1. å¤–åª’æŠ¥é“æ‰€è°“ä¸­å›½ç‰¹å·¥ç³»æ¶‰æ¡ˆåœ¨é€ƒäººå‘˜","International news (China related)",1,0,0,0,"","","International news",0
"11/24/2019",2019,11,24,"M","2. å­™æ¨æ¢å¤è®­ç»ƒå¤‡æˆ˜å¥¥è¿","Social affairs - celebrity",0,0,0,0,"","","Soft news",0
"11/24/2019",2019,11,24,"M","3. é•¿æ²™ä¸€å°åŒºå¡‘èƒ¶äººå·¥æ¹–å°†é“²é™¤","Social affairs",1,0,0,0,"","","Social issues",0
"11/24/2019",2019,11,24,"M","4. é‡åº†æ¥¼é¡¶åŠ æ²¹ç«™","Social affairs",1,0,0,0,"","","Social issues",0
"11/24/2019",2019,11,24,"M","5. çƒ§å›½æ——13å²å°‘å¥³è®¤ç½ªæ‚”è¿‡","Social scandal",0,0,0,0,"","","Social issues",0
"11/24/2019",2019,11,24,"M","6. é¦™æ¸¯æ”¿ç•Œå‘¼åå¸‚æ°‘ç”¨é€‰ç¥¨å‘æš´åŠ›è¯´ä¸","Hong Kong",0,0,0,1,"1","","International news",1
"11/24/2019",2019,11,24,"E","å¤®è§†ä¸»æ’­å€¡è®®ç»™äºˆåŒ»ç”Ÿæ›´å¤šç†è§£","Social affairs",1,1,0,0,"","","Social issues",1
"11/24/2019",2019,11,24,"E","æ¸¯è­¦æ–°ä¸€å“¥åœ¨å¤®è§†å‘å£°","Hong Kong",1,1,0,0,"","","International news",1
"11/24/2019",2019,11,24,"E","è¢«è£å‘˜å·¥å¦‚ä½•ä¿éšœåˆæ³•æƒç›Š","Social affairs - economics",1,0,0,0,"","","Social issues",0
"11/24/2019",2019,11,24,"E","37äº¿å…ƒç‰¹å¤§åšæœèµ°ç§æ¡ˆå‘Šç ´","Crime & court",1,0,0,0,"","","Crime & court",0
"11/25/2019",2019,11,25,"M","é‚“ç¨¼å…ˆå»ä¸–å‰å¯¹çˆ±äººè¯´çš„è¯","Role model",1,0,0,2,"1","","Flattering news",1
"11/25/2019",2019,11,25,"M","æ¸¯è­¦æ–°ä¸€å“¥åœ¨å¤®è§†å‘å£°","Hong Kong",0,1,0,0,"","","International news",1
"11/25/2019",2019,11,25,"M","å¤®è§†ä¸»æ’­å€¡è®®ç»™äºˆåŒ»ç”Ÿæ›´å¤šç†è§£","Social affairs",0,1,0,0,"","","Social issues",1
"11/25/2019",2019,11,25,"M","æ­å·å¤œç­è½¦æš–å“­ä¹˜å®¢","Social affairs",1,0,0,0,"","","Social issues",0
"11/25/2019",2019,11,25,"M","åˆè‚¥ä¸‹é›ª","Social affairs - environment",1,0,0,0,"","","Soft news",0
"11/25/2019",2019,11,25,"M","å¤§ç†åœ°éœ‡","Social affairs - disaster",1,0,0,0,"","","Social issues",0
"11/25/2019",2019,11,25,"M","å›½è€ƒå®é™…è€ƒå½•æ¯”40æ¯”1","Social affairs",1,0,0,2,"1","","Social issues",1
"43794",2019,11,25,"M","å—äº¬ä¸‹é›ª","Social affairs - environment",1,0,0,1,"2","","Soft news",1
"11/25/2019",2019,11,25,"E","è‹±å›½è´§è½¦å¸æœºæ‰¿è®¤å¸®ç§»æ°‘å·æ¸¡","International affairs (non-China)",0,0,0,0,"","","International news",0
"11/25/2019",2019,11,25,"E","æ•™å¸ˆå…¥èŒè¦35åé¢†å¯¼å¹²éƒ¨ç­¾å­—","Social affairs",1,0,0,0,"","","Social issues",0
"11/25/2019",2019,11,25,"E","ç‹æ¯…ä¸€å¥è¯å›åº”é¦™æ¸¯å±€åŠ¿","Hong Kong",1,1,1,0,"","","International news",1
"11/26/2019",2019,11,26,"M","å¯¼å°¿æ•‘äººåŒ»ç”Ÿæ10ä¸‡å¥–é‡‘","Social affairs",0,0,0,0,"","","Social issues",0
"11/26/2019",2019,11,26,"M","ç½‘æ˜“å‰ç¦»èŒå‘˜å·¥è°ˆç»©æ•ˆä¸è¾¾æ ‡è¢«è¾é€€","Social affairs - economics",1,0,0,0,"","","Social issues",0
"11/26/2019",2019,11,26,"M","å¤–äº¤éƒ¨å¬è§ç¾å›½é©»åå¤§ä½¿","International affairs (China-US)",1,1,0,0,"","","International news",1
"11/26/2019",2019,11,26,"M","ä¸¤ä»¶æµå¤±åœŸè€³å…¶æ–‡ç‰©å½’å›½","Social affairs",1,0,0,0,"","","Social issues",0
"11/26/2019",2019,11,26,"M","ç‹æ¯…ä¸€å¥è¯å›åº”é¦™æ¸¯å±€åŠ¿","Hong Kong",0,1,1,0,"","","International news",1
"11/26/2019",2019,11,26,"M","å¼ å®¶å£åŒ–å·¥å‚ç‡ƒçˆ†äº‹æ•…ä¸€å®¡å®£åˆ¤","Crime & court",1,0,0,0,"","","Crime & court",0
"11/26/2019",2019,11,26,"M","é©¬äº‘1äº¿ç¾å…ƒåŸ¹å…»éæ´²ä¼ä¸šå®¶","Social affairs",1,0,0,0,"","","Social issues",0
"11/26/2019",2019,11,26,"M","å¾·å›½çå®é¦†è¢«ç›—æŸå¤±æˆ–è¾¾10äº¿æ¬§","International news (non-China)",1,0,0,0,"","","International news",0
"11/26/2019",2019,11,26,"M","å¨å°¼æ–¯æ°´ç¾éœ€10äº¿ç¾å…ƒä¿®å¤","International news (non-China)",1,0,0,0,"","","International news",0
"11/26/2019",2019,11,26,"M","åŒ—äº¬å…¬å…±åœºæ‰€éšåœ°åç—°æœ€é«˜å¯ç½š500å…ƒ","Social affairs - local policy ",1,0,0,0,"","","Social policy",0
"11/26/2019",2019,11,26,"E","å‡ºç§Ÿæˆ¿å±‹ä¸ç™»è®°ä¿¡æ¯å°†è¢«è®¡å…¥ä¿¡ç”¨è®°å½•","Social affairs - local policy ",1,0,0,0,"","","Social policy",0
"11/26/2019",2019,11,26,"E","åˆ˜æ¬£ç§°é¦™æ¸¯é€šè¯†æ•™è‚²è¢«æ”¿æ²»åŒ–","Hong Kong",1,0,0,0,"","","International news",0
"11/26/2019",2019,11,26,"E","é¦™æ¸¯ç‰¹åŒºæ”¿åºœå°±ç¦è’™é¢æ³•è¿å®ªä¸Šè¯‰","Hong Kong",1,0,0,0,"","","International news",0
"11/26/2019",2019,11,26,"E","å›½å®¶å«å¥å§” ä¸çŒ®è¡€ä¸ä¼šå½±å“ä¸ªäººä¿¡ç”¨","Social affairs - local policy ",1,1,0,0,"","","Social policy",1
"11/26/2019",2019,11,26,"E","æ¹–å—æ“åœºåŸ‹å°¸æ¡ˆå·²æŸ¥æ¸…","Crime & court",0,0,0,1,"1&2","#äººæ°‘é”è¯„#ï¼šä»â€œæ“åœºåŸ‹å°¸æ¡ˆâ€ä¸­æ±²å–æ·±åˆ»æ•™è®­","Crime & court",1
"11/27/2019",2019,11,27,"M","äº‘å—é«˜é€Ÿéš§é“å£äº‹æ•…","Social affairs",1,0,0,0,"","","Social issues",0
"11/27/2019",2019,11,27,"M","å±±ä¸œè™å¾…å¹¼ç«¥ç»§æ¯è¢«åˆ‘æ‹˜","Crime & court",1,0,0,0,"","","Crime & court",0
"11/27/2019",2019,11,27,"M","å‡ºç§Ÿæˆ¿å±‹ä¸ç™»è®°ä¿¡æ¯å°†è¢«è®¡å…¥ä¿¡ç”¨è®°å½•","Social affairs - local policy ",0,0,0,0,"","","Social policy",0
"11/27/2019",2019,11,27,"M","é¦™æ¸¯ç‰¹åŒºæ”¿åºœå°±ç¦è’™é¢æ³•è¿å®ªä¸Šè¯‰","Hong Kong",0,0,0,0,"","","International news",0
"11/27/2019",2019,11,27,"M","å¹´å†…1884å®¶å½±è§†å…¬å¸å…³åœ","Social affairs - economics",1,0,0,0,"","","Social issues",0
"11/27/2019",2019,11,27,"M","500å¤šåº§ç‘å£«å†°å·å·²ç»æ¶ˆå¤±","International news (non-China)",1,0,0,0,"","","International news",0
"11/27/2019",2019,11,27,"M","å¸å°¿æ•‘äººåŒ»ç”Ÿå›å›½è¯¦è¿°äº‹å‘ç»è¿‡","Role model",0,0,0,0,"","","Flattering news",0
"11/27/2019",2019,11,27,"E","é¦™æ¸¯43åå…¬åŠ¡å‘˜æ¶‰éæ³•é›†ç»“è¢«æŸ¥","Hong Kong",1,0,0,0,"","","International news",0
"11/27/2019",2019,11,27,"E","å°åº¦14äº¿äººä»åœ¨ç”¨ç°é‡‘","International news (non-China)",1,0,0,0,"","","International news",0
"11/27/2019",2019,11,27,"E","è€¿çˆ½ ç¾å›½æ— æ³•åŒä¸­å›½ç›¸æå¹¶è®º","International affairs (China-US)",1,1,0,1,"1","","International news",1
"11/28/2019",2019,11,28,"M","é¦™æ¸¯è¶…5800äººæ¶‰å¨èƒå…¬å…±å®‰å…¨è¢«æ•","Hong Kong",1,0,0,0,"","","International news",0
"11/28/2019",2019,11,28,"M","å†…è’™å¤å››å­ç‹æ——ç¡®è¯Š1ä¾‹è…ºé¼ ç–«ç—…ä¾‹","Social affairs - disaster",1,0,0,0,"","","Social issues",0
"11/28/2019",2019,11,28,"M","å¤–äº¤éƒ¨å›åº”ç¾æ–¹ç­¾ç½²æ¶‰æ¸¯æ³•æ¡ˆ","International affairs (China-US)",1,1,1,1,"1","","International news",1
"11/28/2019",2019,11,28,"M","å…­æˆå¹´è½»äººå®³æ€•çœ‹ä½“æ£€æŠ¥å‘Š","Social affairs - trends",1,0,0,0,"","","Soft news",0
"11/28/2019",2019,11,28,"M","æ³°å±±å¸","Social affairs - economics",1,0,0,1,"1","","Social issues",1
"11/28/2019",2019,11,28,"M","2018å¹´ä¸­å›½å™¨å®˜æçŒ®æ•°ä¸–ç•Œç¬¬äºŒ","Social affairs - trends",1,0,0,0,"","","Soft news",0
"11/28/2019",2019,11,28,"M","èµ°ç§æ¡ˆåœ°é“è¿é€šé¦™æ¸¯æ·±åœ³","Crime & court",1,0,0,0,"","","Crime & court",0
"11/28/2019",2019,11,28,"M","æˆ‘å›½æˆåŠŸå‘å°„é«˜åˆ†12å·å«æ˜Ÿ","Achievements",1,0,0,0,"","","Flattering news",0
"11/28/2019",2019,11,28,"M","æˆ‘å›½æ¯å¹´å¿ƒæºæ€§çŒæ­»è€…55ä¸‡","Social affairs - trends",1,0,0,0,"","","Soft news",0
"11/28/2019",2019,11,28,"M","å­™æ¨äº‹ä»¶ç°åœºè§†é¢‘","Social affairs - celebrity",0,0,0,0,"","","Soft news",0
"11/28/2019",2019,11,28,"E","é£æœºå¸å°¿æ•‘äººåŒ»ç”Ÿè·å¥–æ„Ÿè¨€","Social affairs",9,0,0,0,"","","Social issues",0
"11/28/2019",2019,11,28,"E","è€¿çˆ½è°ˆååˆ¶ç¾æ¶‰æ¸¯æ³•æ¡ˆ","International affairs (China-US)",1,1,0,1,"1","","International news",1
"11/28/2019",2019,11,28,"E","é¦™æ¸¯è¶…5800äººæ¶‰å¨èƒå…¬å…±å®‰å…¨è¢«æ•","Hong Kong",0,0,0,0,"","","International news",0
"11/28/2019",2019,11,28,"E","é¦™æ¸¯ä¸­è”åŠé’ˆå¯¹ç¾æ¶‰æ¸¯æ³•æ¡ˆå‘è¡¨å£°æ˜","Hong Kong",1,1,0,1,"1","","International news",1
"11/28/2019",2019,11,28,"E","ä¼Šæ´›æ²³æ±‡å…¥é»„æ²³æˆé¸³é¸¯é”…","International news (non-China)",1,0,0,0,"","","International news",0
"11/28/2019",2019,11,28,"E","æ—¥æœ¬å¤§é˜ªå¼ºåˆ¶å…¬åŠ¡å‘˜ä¸‹ç­","International news (non-China)",1,0,0,0,"","","International news",0
"11/29/2019",2019,11,29,"M","2017å’Œ2019ç½‘ç»œæµè¡Œè¯­å¯¹æ¯”","Leisure",1,0,0,1,"1&2 ","äººæ°‘å¾®è¯„ï¼šæ€»æœ‰ä¸€å¥ç½‘ç»œæµè¡Œè¯­æ‰£åŠ¨å¿ƒå¼¦","Soft news",1
"11/29/2019",2019,11,29,"M","æ³°å±±å¸å¼€å§‹å…‘æ¢","Social affairs - economics",0,0,0,1,"1","","Social issues",1
"11/29/2019",2019,11,29,"M","é¦–æ‰¹æ«æ¡¥å¼å…¬å®‰æ´¾å‡ºæ‰€","Crime & court",1,0,0,0,"","","Crime & court",0
"11/29/2019",2019,11,29,"M","è€¿çˆ½è°ˆååˆ¶ç¾æ¶‰æ¸¯æ³•æ¡ˆ","International affairs (China-US)",0,1,0,0,"","","International news",1
"11/29/2019",2019,11,29,"M","é¦™æ¸¯ä¸­è”åŠé’ˆå¯¹ç¾æ¶‰æ¸¯æ³•æ¡ˆå‘è¡¨å£°æ˜","Hong Kong",0,1,0,0,"","","International news",1
"11/29/2019",2019,11,29,"M","ä¼Šæ´›æ²³æ±‡å…¥é»„æ²³æˆé¸³é¸¯é”…","Social affairs - environment",0,0,0,0,"","","Soft news",0
"11/29/2019",2019,11,29,"E","åˆé›ª","Social affairs - environment",0,0,0,1,"1","","Soft news",1
"11/29/2019",2019,11,29,"E","æ¢æŒ¯è‹±å»ºè®®ç¾å›½ä¼šè®®å‘˜è¯»è¯»åŸºæœ¬æ³•","International news (non-China)",1,0,0,0,"","","International news",0
"11/29/2019",2019,11,29,"E","å¤®è§†å†æ›åŒ»ç¾ä¹±è±¡","Social affairs",1,1,0,0,"","","Social issues",1
"11/29/2019",2019,11,29,"E","é¦™æ¸¯ç†å·¥å¤§å­¦æ­£å¼è§£å°","Hong Kong",1,0,0,0,"","","International news",0
"11/29/2019",2019,11,29,"E","èƒ½ä¸èƒ½ç»™ä¸ªç«‹é—å˜±åŠŸèƒ½","Social affairs",1,0,0,0,"","","Social issues",0
"11/29/2019",2019,11,29,"E","å¥³é€ƒçŠ¯åŠ³è£æè½ç½‘","Crime & court",1,1,0,1,"1","","Crime & court",1
"11/29/2019",2019,11,29,"E","ä¸­å›½ä¸€ç»´å’Œå£«å…µæ‰§è¡Œä»»åŠ¡æ—¶æŸ“ç—…ç‰ºç‰²","International news (China related)",1,0,0,0,"","","International news",0
"11/30/2019",2019,11,30,"M","0. æ°´æ»´ç­¹åŒ»é™¢æ‰«æ¥¼ç­¹æ¬¾æ¼æ´å¤š","Social scandal",1,0,0,0,"","","Social issues",0
"11/30/2019",2019,11,30,"M","1. å·´åŸºæ–¯å¦å°é•‡900å„¿ç«¥æŸ“è‰¾æ»‹","International news (non-China)",1,0,0,0,"","","International news",0
"11/30/2019",2019,11,30,"M","2. ä¼¦æ•¦æ¡¥ææ€–è¢­å‡»é€ æˆ3äººæ­»äº¡","International news (non-China)",1,0,0,0,"","","International news",0
"11/30/2019",2019,11,30,"M","3. é¦™æ¸¯èˆªç©ºåœé£éƒ¨åˆ†èˆªç­","Hong Kong",1,0,0,0,"","","International news",0
"11/30/2019",2019,11,30,"M","4. é£é›ªä¸­æœ€å¯çˆ±çš„äºº","Role model",1,0,0,0,"","","Flattering news",0
"11/30/2019",2019,11,30,"M","5. åˆ˜å…†ä½³ç§°ç¾æ’æ‰‹é¦™æ¸¯äº‹åŠ¡å¿…é€‚å¾—å…¶å","International affairs (China related)",1,0,0,0,"","","International news",0
"11/30/2019",2019,11,30,"M","6. æµ·å—çœé«˜é™¢å‰¯é™¢é•¿å¼ å®¶æ…§è¢«å…èŒ","Government acts",1,0,0,0,"","","Social policy",0
"11/30/2019",2019,11,30,"M","7. é¦™æ¸¯ç†å·¥å¤§å­¦æ­£å¼è§£å°","Hong Kong",0,0,0,0,"","","International news",0
"11/30/2019",2019,11,30,"M","8. ä¼¦æ•¦æ¡¥å“èµ·æªå£°","International news (non-China)",0,0,0,0,"","","International news",0
"11/30/2019",2019,11,30,"M","9. å¤®è§†å†æ›åŒ»ç¾ä¹±è±¡","Social affairs",0,1,0,0,"","","Social issues",1
"11/30/2019",2019,11,30,"M","10. å¥³é€ƒçŠ¯åŠ³è£æè½ç½‘","Crime & court",0,1,0,1,"1","","Crime & court",1
"11/30/2019",2019,11,30,"M","11. æœ‰äººåœ¨æœé›†è´©å–ä½ çš„è„¸","Social affairs",1,0,0,0,"","","Social issues",0
"11/30/2019",2019,11,30,"M","12. åŒ—äº¬åœ°é“ä¸€ä¹˜å®¢å¿ƒè„ç—…çªå‘å»ä¸–","Social affairs",1,0,0,0,"","","Social issues",0
"11/30/2019",2019,11,30,"M","13. èƒ½ä¸èƒ½ç»™ä¸ªç«‹é—å˜±åŠŸèƒ½","Social affairs",0,0,0,0,"","","Social issues",0
"11/30/2019",2019,11,30,"E","0. å°ç‹¬ç»„ç»‡éª¨å¹²åˆ†å­æå­Ÿå±…è¢«æ•","Social affairs",1,0,0,0,"","","Social issues",0
"11/30/2019",2019,11,30,"E","1. ä¼¦æ•¦æè¢­å‡¶æ‰‹ä¸ºåˆšé‡Šæ”¾ææ€–åˆ†å­","International news (non-China)",0,0,0,0,"","","International news",0
"11/30/2019",2019,11,30,"E","2. ä¸­å›½å­˜æ´»è‰¾æ»‹ç—…æ„ŸæŸ“è€…95.8ä¸‡","Social affairs - trends",1,0,0,0,"","","Soft news",0
"11/30/2019",2019,11,30,"E","3. é¦™æ¸¯èˆªç©ºåœé£éƒ¨åˆ†èˆªç­","Hong Kong",0,0,0,0,"","","International news",0
"12/1/2019",2019,12,1,"M","å¤®è§†æŠ¥é“é«˜ä»¥ç¿”å»ä¸–","Social affairs - celebrity",1,1,0,0,"","","Soft news",1
"12/1/2019",2019,12,1,"M","ISå®£ç§°å¯¹ä¼¦æ•¦æ¡¥æè¢­è´Ÿè´£","International news (non-China)",0,0,0,0,"","","International news",0
"12/1/2019",2019,12,1,"M","è­¦å¯Ÿè€—æ—¶4å¹´è¿½å›å›½å®¶å®è—","Role model",1,0,0,0,"","","Flattering news",0
"12/1/2019",2019,12,1,"M","æ­»äº¡è´§è½¦æ¡ˆæ­»è€…é—ä½“è¿å›è¶Šå—","International news (non-China)",0,0,0,0,"","","International news",0
"12/1/2019",2019,12,1,"M","é¦™æ¸¯è¢«çƒ§è€ä¼¯ä»æœªæ¸¡è¿‡å±é™©æœŸ","Hong Kong",0,0,0,0,"","","International news",0
"12/1/2019",2019,12,1,"M","æ°´æ³¥ä»·æ ¼å¤§å¹…ä¸Šæ¶¨","Social affairs - economics",1,0,0,0,"","","Social issues",0
"12/1/2019",2019,12,1,"M","å¹¿ä¸œé€‰è°ƒ","Government acts",1,0,0,0,"","","Social policy",0
"12/1/2019",2019,12,1,"M","é€€ä¼å†›äººè®²è¿°é›ªå±±ç”Ÿæ­»ç¬é—´","Role model",1,0,0,0,"","","Flattering news",0
"12/1/2019",2019,12,1,"M","ç‘å…¸ç¯ä¿å°‘å¥³å†™å…¥ä¸­å­¦æ•™æ","International news (non-China)",1,0,0,0,"","","International news",0
"12/1/2019",2019,12,1,"E","å›½åŠ¡é™¢ä»»å‘½æ¾³é—¨ç¬¬äº”å±Šæ”¿åºœä¸»è¦å®˜å‘˜","Government acts",1,1,0,0,"","","Social policy",1
"12/1/2019",2019,12,1,"E","å®¶é•¿æŠ•è¯‰å¹¼å„¿è¢«ä¿è‚²å‘˜æ‰é’ˆ","Social scandal",1,0,0,0,"","","Social issues",0
"12/1/2019",2019,12,1,"E","10å²ç”·å­©ä¸ºæ•‘çˆ¶1å¤©åƒ5é¡¿","Role model",1,0,0,0,"","","Flattering news",0
"12/1/2019",2019,12,1,"E","é•¿æ±Ÿä¸‰è§’æ´²åŒºåŸŸä¸€ä½“åŒ–å‘å±•è§„åˆ’çº²è¦","Social affairs - local policy ",1,0,0,0,"","","Social policy",0
"12/1/2019",2019,12,1,"E","äº‘å…‰ä¸­è¢«åŒå¼€","Social scandal",1,0,0,0,"","","Social issues",0
"12/1/2019",2019,12,1,"E","ä¸€ä¸ªæ‘ä¸¤ä¸‰ç™¾äººåšç›´æ’­çŸ­è§†é¢‘","Social affairs",1,0,0,0,"","","Social issues",0
"12/1/2019",2019,12,1,"E","ç”˜å—å¿åœ°éœ‡","Social affairs - disaster",1,0,0,0,"","","Social issues",0
"12/2/2019",2019,12,2,"M","å¤®è§†ä¸»æ’­è¯´æ´»å‘½ä¸èƒ½æ€»æŒ‡æœ›è¿æ°”","Social affairs - celebrity",0,1,0,0,"","","Soft news",1
"12/2/2019",2019,12,2,"M","å¤§è¿æµ·å…³é€€è¿3700ä½™å¨æ´‹åƒåœ¾","International affairs (China related)",1,0,0,0,"","","International news",0
"12/2/2019",2019,12,2,"M","å¾®ä¿¡å›åº”å‘åŸå›¾æ³„éœ²ä½ç½®ä¿¡æ¯","Social affairs - consumer rights",1,0,1,0,"","","Social issues",0
"12/2/2019",2019,12,2,"M","åä¸ºå‰å‘˜å·¥","Social affairs - economics",1,0,0,0,"","","Social issues",0
"12/2/2019",2019,12,2,"M","å¹¿å·åœ°é“å›åº”å¡«åŸ‹åå¡ŒåŒº","Social affairs",1,0,1,0,"","","Social issues",0
"12/2/2019",2019,12,2,"M","å†…è’™å¤æŸ¥è·å¤§é‡äººä½“æ¤å…¥ç±»åŒ»ç–—å™¨æ¢°","Social affairs",1,0,0,0,"","","Social issues",0
"12/2/2019",2019,12,2,"M","é•¿æ±Ÿä¸‰è§’æ´²åŒºåŸŸä¸€ä½“åŒ–å‘å±•è§„åˆ’çº²è¦","Social affairs - local policy ",0,1,0,0,"","","Social policy",1
"12/2/2019",2019,12,2,"M","å›½åŠ¡é™¢ä»»å‘½æ¾³é—¨ç¬¬äº”å±Šæ”¿åºœä¸»è¦å®˜å‘˜","Government acts",0,1,0,0,"","","Social policy",1
"12/2/2019",2019,12,2,"M","åäºŒæœˆçš„ç»æµçŠ¶å†µ","Social affairs - economics",1,0,0,0,"","","Social issues",0
"12/2/2019",2019,12,2,"E","æ³°å›½3Dæ–‘é©¬çº¿","International news (non-China)",1,0,0,0,"","","International news",0
"12/2/2019",2019,12,2,"E","æ¸¯åºœè­¦å‘Šé¦™æ¸¯èˆªç©º","Hong Kong",1,0,0,0,"","","International news",0
"12/2/2019",2019,12,2,"E","ä»Šæ™š12ç‚¹æ²¹ä»·è¦æ¶¨äº†","Social affairs - economics",1,0,0,0,"","","Social issues",0
"12/2/2019",2019,12,2,"E","è¿‘ä¸ƒæˆå­¦ç”Ÿæ¯å¤©è¯¾å¤–é˜…è¯»ä½äº1ä¸ªå°æ—¶","Social affairs - trends",1,0,0,1,"1","","Soft news",1
"12/2/2019",2019,12,2,"E","é•¿æ˜¥ä¸€åŒ»é™¢ä»æœ‰æ°´æ»´ç­¹äººå‘˜æ¨å¹¿","Social scandal",0,0,0,0,"","","Social issues",0
"12/2/2019",2019,12,2,"E","åä¸ºæ”¯æŒææ´ªå…ƒè¿ç”¨æ³•å¾‹æ­¦å™¨ç»´æƒ","Social affairs - economics",0,0,0,0,"","","Social issues",0
"12/2/2019",2019,12,2,"E","ä¸­æ–¹å®£å¸ƒåˆ¶è£ç¾éƒ¨åˆ†éæ”¿åºœç»„ç»‡","International affairs (China-US)",1,0,0,1,"1","","International news",1
"12/2/2019",2019,12,2,"E","è¢«å‰²é¢ˆæ¸¯è­¦é—®é¦™æ¸¯æ•™è‚²æ˜¯å¦å‡ºé—®é¢˜äº†","Hong Kong",1,0,0,0,"","","International news",0
"12/2/2019",2019,12,2,"E","å¤–å–å•†å®¶ç”¨æš—è¯­å‘æœªæˆå¹´äººå”®çƒŸ","Social scandal",1,0,0,0,"","","Social issues",0
"12/2/2019",2019,12,2,"E","æ ¼åŠ›ç”µå™¨ç­¾ç½²è‚¡ä»½è½¬è®©åè®®","Social affairs - economics",1,0,0,0,"","","Social issues",0
"12/2/2019",2019,12,2,"E","åä¸ºè¢«æ‹˜å‰å‘˜å·¥å¸Œæœ›åä¸ºé“æ­‰","Social affairs - economics",0,0,0,0,"","","Social issues",0
"12/3/2019",2019,12,3,"M","2020å…ƒæ—¦ç«è½¦ç¥¨å¼€å”®","Social affairs",1,0,0,0,"","","Social issues",0
"12/3/2019",2019,12,3,"M","ä¸Šæµ·è¿ªå£«å°¼ä¹å›­å¯ç”¨Xå…‰æœºå®‰æ£€","Social affairs",1,0,0,0,"","","Social issues",0
"12/3/2019",2019,12,3,"M","æ—¥æœ¬å…¬å¸ç¦æ­¢èˆ”æ‰‹æŒ‡ç¿»çº¸","International news (non-China)",1,0,0,0,"","","International news",0
"12/3/2019",2019,12,3,"M","6çœä»½æœˆæœ€ä½å·¥èµ„æ ‡å‡†è¶…2000å…ƒ","Social affairs - economics",1,0,0,0,"","","Social issues",0
"12/3/2019",2019,12,3,"M","å°åº¦æ¯’æ³¡æ²«æµ·æ»©","International news (non-China)",1,0,0,0,"","","International news",0
"12/3/2019",2019,12,3,"M","æš´é£é›†å›¢ç§°å…¬å¸ä»…å‰©10ä½™äºº","Social affairs - economics",1,0,0,0,"","","Social issues",0
"12/3/2019",2019,12,3,"M","æ²ˆé˜³å±…æ°‘æ¥¼å¤§ç«","Social affairs - disaster",1,0,0,2,"1&2","","Social issues",1
"12/3/2019",2019,12,3,"M","ç‰¹æœ—æ™®ç«é€‰å›¢é˜Ÿå°æ€å½­åšç¤¾","International news (non-China)",1,0,0,0,"","","International news",0
"12/3/2019",2019,12,3,"M","åŒ—äº¬å†¬å¥¥ä¼šå¿—æ„¿è€…æ‹›å‹Ÿ12æœˆ5æ—¥å¯åŠ¨","Social affairs",1,0,0,0,"","","Social issues",0
"12/3/2019",2019,12,3,"M","ææ´ªå…ƒå›åº”åä¸ºå£°æ˜","Social affairs - economics",1,0,1,0,"","","Social issues",0
"12/3/2019",2019,12,3,"M","é™¢å£«å°†10äº¿ä¸“åˆ©æ— å¿é€ç»™å†œæ°‘","Role model",1,0,0,0,"","","Flattering news",0
"12/3/2019",2019,12,3,"E","çŒªè‚‰ä»·æ ¼åˆé™äº†","Social affairs - economics",1,0,0,0,"","","Social issues",0
"12/3/2019",2019,12,3,"E","è®¸æ‘å°æŸ“å‚","Social affairs - disaster",1,0,0,0,"","","Social issues",0
"12/3/2019",2019,12,3,"E","ç°åœ¨çš„é¤é¥®ä¸šæœ‰å¤šåŠªåŠ›","Social affairs - economics",1,0,0,0,"","","Social issues",0
"12/3/2019",2019,12,3,"E","ä¸­ç–¾æ§æŠ¥å‘ŠæŠ«éœ²é¼ ç–«æ‚£è€…ç»†èŠ‚","Social affairs - disaster",1,1,0,0,"","","Social issues",1
"12/3/2019",2019,12,3,"E","6çœä»½æœˆæœ€ä½å·¥èµ„æ ‡å‡†è¶…2000å…ƒ","Social affairs - economics",1,0,0,0,"","","Social issues",0
"12/3/2019",2019,12,3,"E","ç‰¹åŒºæ”¿åºœé…åˆè·Ÿè¿›ååˆ¶ç¾å›½æªæ–½","Hong Kong",1,0,0,0,"","","International news",0
"12/3/2019",2019,12,3,"E","26å²å¥³æ•™å¸ˆå äº¡äº‹ä»¶å¤è®®ç»“æœ","Social affairs",0,0,0,0,"","","Social issues",0
"12/4/2019",2019,12,4,"M","äººæ°‘æ—¥æŠ¥æ‰¹å¼¹çª—å¹¿å‘Š","Social affairs",1,1,0,0,"","","Social issues",1
"12/4/2019",2019,12,4,"M","å¹¿å·åœ°é™·3åå¤±è”äººå‘˜èº«ä»½ç¡®è®¤","Social affairs - disaster",1,0,0,0,"","","Social issues",0
"12/4/2019",2019,12,4,"M","è¿‘ç™¾é¦™æ¸¯å¸‚æ°‘èµ´ç¾é¢†é¦†æŠ—è®®","Hong Kong",1,0,0,0,"","","International news",0
"12/4/2019",2019,12,4,"M","é©¬äº‘å‘¼åæ”¹å˜æ•™è‚²å‰å…ˆæ”¹é©è€ƒè¯•","Social affairs",1,0,0,0,"","","Social issues",0
"12/4/2019",2019,12,4,"M","å¤®è§†ä¸»æ’­å–Šè¯é¦™æ¸¯å­¦å­¦æ¾³é—¨","Hong Kong",1,1,0,0,"","","International news",1
"12/4/2019",2019,12,4,"M","æµ™æ±Ÿæµ·å®æ±¡æ°´ç½ä½“åå¡Œå·²è‡´7æ­»","Social affairs - disaster",1,0,0,0,"","","Social issues",0
"12/4/2019",2019,12,4,"M","ç¾å›½é«˜ä¸­ç”ŸæŒæ­¦å™¨ä¸æ ¡è­¦å¯¹å³™","International news (non-China)",1,0,0,0,"","","International news",0
"12/4/2019",2019,12,4,"M","ç¾ä¼—è®®é™¢å‘å¸ƒå¼¹åŠ¾ç‰¹æœ—æ™®è°ƒæŸ¥æŠ¥å‘Š","International news (non-China)",1,0,0,0,"","","International news",0
"12/4/2019",2019,12,4,"M","çç ä»·æ ¼è¿ç»­ä¸‰å¹´ä¸Šæ¶¨","Social affairs - economics",1,0,0,0,"","","Social issues",0
"12/4/2019",2019,12,4,"M","å¤®è§†ä¸»æ’­è¯´ç¾å›½ä¸€äº›ç»„ç»‡ä¸èƒ½æƒ¯","International affairs (China-US)",1,1,0,0,"","","International news",1
"12/4/2019",2019,12,4,"M","OECDæ•™è‚²ä¸»å¸­å¤¸ä¸­å›½å­¦ç”Ÿ","Role model",1,0,0,0,"","","Flattering news",0
"12/4/2019",2019,12,4,"M","æ—¥æœ¬ç«‹æ³•ç¦æ­¢å®¶é•¿ä½“ç½šå­©å­","International news (non-China)",1,0,0,0,"","","International news",0
"12/4/2019",2019,12,4,"E","å››å·å®£å¸ƒå…¨çœå–ç¼”P2P","Social affairs - local policy ",1,0,0,0,"","","Social policy",0
"12/4/2019",2019,12,4,"E","æ¹–å—æµé˜³çƒŸèŠ±å‚çˆ†ç‚¸","Social affairs - disaster",1,0,0,0,"","","Social issues",0
"12/4/2019",2019,12,4,"E","å†œæ‘å­¦æ ¡é£Ÿå ‚ä¸å¾—å¯¹å¤–æ‰¿åŒ…","Social affairs - local policy ",1,0,0,0,"","","Social policy",0
"12/4/2019",2019,12,4,"E","æˆéƒ½é“¶æ","Social affairs",1,0,0,0,"","","Social issues",0
"12/4/2019",2019,12,4,"E","ä¸œäº¬30å¹´å†…å‘ç”Ÿå¤§åœ°éœ‡å‡ ç‡è¾¾70%","International news (non-China)",1,0,0,0,"","","International news",0
"12/4/2019",2019,12,4,"E","æ­å·4000ä¸‡è±ªå®…è¢«æŸ¥å°","Social affairs",1,0,0,0,"","","Social issues",0
"12/4/2019",2019,12,4,"E","éŸ©å›½æŠ€æœ¯äººæ‰è¢«ä¸­å›½å…¬å¸æŒ–èµ°","Social affairs",1,0,0,0,"","","Social issues",0
"12/4/2019",2019,12,4,"E","å›½å®¶åæåŠå°±ç¾æ¶‰ç–†æ³•æ¡ˆç­”è®°è€…é—®","International affairs (China related)",1,1,0,0,"","","International news",1
"12/4/2019",2019,12,4,"E","è¢«é¡¶æ›¿å·¥ä½œ23å¹´æ°‘å·¥æ‹’ç»å’Œè§£","Social scandal",1,0,0,0,"","","Social issues",0
"12/4/2019",2019,12,4,"E","é¡¶æ›¿é€€ä¼å†›äººå·¥ä½œè€…å·²åœèŒ","Social scandal",1,0,0,0,"","","Social issues",0
"12/4/2019",2019,12,4,"E","å¤®è§†ä¸»æ’­å–Šè¯é¦™æ¸¯å­¦å­¦æ¾³é—¨","Hong Kong",0,1,0,0,"","","International news",1
"12/5/2019",2019,12,5,"M","å”å±±åœ°éœ‡ç”µè§†å¼¹å‡ºé¢„è­¦","Social affairs - disaster",1,0,0,1,"1","","Social issues",1
"12/5/2019",2019,12,5,"M","100æ¬¾è¿æ³•è¿è§„APPä¸‹æ¶æ•´æ”¹","Social affairs - consumer rights",1,0,0,0,"","","Social issues",0
"12/5/2019",2019,12,5,"M","å¹¿å·åœ°é™·å¤±è”è€…å®¶å±è®²è¿°","Social affairs - disaster",1,0,0,0,"","","Social issues",0
"12/5/2019",2019,12,5,"M","æ˜†æ˜ä¸‹é›ª","Social affairs - environment",1,0,0,1,"1","","Soft news",1
"12/5/2019",2019,12,5,"M","åŒ—äº¬éœ‡æ„Ÿ","Social affairs - disaster",0,0,0,0,"","","Social issues",0
"12/5/2019",2019,12,5,"M","å››å·å®œå®¾äº”ç²®æ¶²æœºåœºé€šèˆª","Social affairs",1,0,0,0,"","","Social issues",0
"12/5/2019",2019,12,5,"M","ç‰¹æœ—æ™®ç§°ç‰¹é²å¤šæ˜¯ä¸¤é¢æ´¾","International affairs (non-China)",1,0,0,0,"","","International news",0
"12/5/2019",2019,12,5,"M","å¤©æ´¥éœ‡æ„Ÿ","Social affairs - disaster",0,0,0,0,"","","Social issues",0
"12/5/2019",2019,12,5,"M","éŸ©å›½20å²å¹´é¾„æ®µ6æˆäººä¸æƒ³ç”Ÿå¨ƒ","International news (non-China)",1,0,0,0,"","","International news",0
"12/5/2019",2019,12,5,"M","æ´›é˜³20å²å¥³å­©å¤±è”","Crime & court",1,0,0,0,"","","Crime & court",0
"12/5/2019",2019,12,5,"M","äº‘å—è€äººæ–—èˆå¼æ–‡éª‚","Social affairs",1,0,0,0,"","","Social issues",0
"12/5/2019",2019,12,5,"E","æ°´æ»´ç­¹åˆ›å§‹äººè‡´æ­‰","Social scandal",0,0,1,0,"","","Social issues",0
"12/5/2019",2019,12,5,"E","2023å¹´åº•åŸºæœ¬å®Œæˆå›½å®¶æ–‡åŒ–å…¬å›­å»ºè®¾","Achievements",1,0,0,0,"","","Flattering news",0
"12/5/2019",2019,12,5,"E","å¤–äº¤éƒ¨è¯„ç¾å›½ä¸€å¹´580å®¶å†œåœºç ´äº§","International news (non-China)",1,1,0,0,"","","International news",1
"12/5/2019",2019,12,5,"E","å¤–äº¤éƒ¨å›åº”åŒ—çº¦å³°ä¼šæœªå°†ä¸­å›½å®šä¸ºå¨èƒ","International affairs (China related)",1,1,1,0,"","","International news",1
"12/5/2019",2019,12,5,"E","å­™æ¨äº‹ä»¶è§†é¢‘ç¬¬3æ³¢","Social affairs - celebrity",0,0,0,0,"","","Soft news",0
"12/6/2019",2019,12,6,"M","ç‰¹æœ—æ™®å›åº”æ€»ç»Ÿå¼¹åŠ¾æ¡æ¬¾","International news (non-China)",1,0,0,0,"","","International news",0
"12/6/2019",2019,12,6,"M","äººæ°‘æ—¥æŠ¥è¯„æ˜æ˜Ÿäººè®¾","Social affairs",1,1,0,0,"","","Social issues",1
"12/6/2019",2019,12,6,"M","æ¨ªåº—å½±è§†åŸºåœ°å¼€æœºç‡ä¸‹é™","Social affairs - economics",1,0,0,0,"","","Social issues",0
"12/6/2019",2019,12,6,"M","æ·±åœ³ä¸­å°å­¦èµ„æ–™æ¶‰æ€§åˆ«æ­§è§†","Social scandal",1,0,0,0,"","","Social issues",0
"12/6/2019",2019,12,6,"M","å¤–äº¤éƒ¨è¯„ç¾å›½ä¸€å¹´580å®¶å†œåœºç ´äº§","International news (non-China)",0,1,0,0,"","","International news",1
"12/6/2019",2019,12,6,"M","åŒ—äº¬å†¬å¥¥ä¼šå†¬æ®‹å¥¥ä¼šå¿—æ„¿è€…æ‹›å‹Ÿ","Social affairs",0,0,0,0,"","","Social issues",0
"12/6/2019",2019,12,6,"M","ä¸œäº¬å¥¥è¿åœ£ç«ä¼ é€’èµ·ç‚¹è¾å°„è¶…æ ‡","Social affairs",1,0,0,0,"","","Social issues",0
"12/6/2019",2019,12,6,"M","ç½‘ä¸Šçœ‹ç—…èƒ½ä¿¡å—","Social affairs",1,0,0,0,"","","Social issues",0
"12/6/2019",2019,12,6,"M","å¹å“¨äºº","Social affairs",1,0,0,0,"","","Social issues",0
"12/6/2019",2019,12,6,"M","å—äº¬ä¸€é«˜æ ¡è¢«æŒ‡å¼ºåˆ¶æ™¨è·‘","Social affairs",1,0,0,0,"","","Social issues",0
"12/6/2019",2019,12,6,"M","æ°´æ»´ç­¹åˆ›å§‹äººè‡´æ­‰","Social scandal",0,0,0,0,"","","Social issues",0
"12/6/2019",2019,12,6,"E","ä¸Šæµ·è¿ªå£«å°¼è°ƒæ•´ç¥¨ä»·","Social affairs",1,0,0,0,"","","Social issues",0
"12/6/2019",2019,12,6,"E","æ–°ç–†åæçºªå½•ç‰‡","Social affairs",1,1,0,0,"","","Social issues",1
"12/6/2019",2019,12,6,"E","ä¸€æ ¹é¦™è•‰å–12ä¸‡ç¾å…ƒ","Bizzare",1,0,0,0,"","","Soft news",0
"12/6/2019",2019,12,6,"E","å…°å·ä¸€ç ”ç©¶æ‰€å›åº”å¤šäººç–‘æŸ“äººç•œå…±æ‚£ç—…","Social affairs - disaster",1,0,1,0,"","","Social issues",0
"12/6/2019",2019,12,6,"E","ä¸Šè´¢æ•™æˆé’±é€¢èƒœ","Social scandal",1,0,0,0,"","","Social issues",0
"12/6/2019",2019,12,6,"E","å¹¿ä¸œä½›å±±å±±ç«","Social affairs - disaster",1,0,0,0,"","","Social issues",0
"12/6/2019",2019,12,6,"E","æ—¶é€Ÿ600å…¬é‡Œç£æ‚¬æµ®çœŸè½¦é¦–äº®ç›¸","Achievements",1,0,0,0,"","","Flattering news",0
"12/6/2019",2019,12,6,"E","é¦–åˆ—wifiå…¨è¦†ç›–å’Œè°å·åŠ¨è½¦ç»„ä¸Šçº¿è¿è¥","Achievements",1,0,0,0,"","","Flattering news",0
"12/6/2019",2019,12,6,"E","æ—¥æœ¬ä¸œäº¬æˆ¿ä»·æ”¶å…¥æ¯”è¾¾13.3å€","International news (non-China)",1,0,0,0,"","","International news",0
"12/6/2019",2019,12,6,"E","æ´›é˜³20å²å¤±è”å¥³å­©å·²é‡å®³","Crime & court",0,0,1,0,"","","Crime & court",0
"12/6/2019",2019,12,6,"E","ä¸­å›½æˆåŠŸç ”åˆ¶ä¸–ç•Œæœ€é«˜ç£åœºè¶…å¯¼ç£ä½“","Achievements",1,0,0,0,"","","Flattering news",0
"12/6/2019",2019,12,6,"E","æ²ˆé˜³å±…æ°‘æ¥¼å¤§ç«ç³»å› ä½æˆ·æ’æ’æ•…éšœ","Social affairs - disaster",1,0,0,0,"","","Social issues",0
"12/7/2019",2019,12,7,"M","é¦™æ¸¯è­¦åŠ¡å¤„å¤„é•¿é‚“ç‚³å¼ºå¤©å®‰é—¨çœ‹å‡æ——","Patriotic acts/festivals",1,0,0,0,"","","Flattering news",0
"12/7/2019",2019,12,7,"M","æ¶‰æ€§åˆ«æ­§è§†ä¸­å°å­¦èµ„æ–™è¢«å›æ”¶","Social scandal",0,0,1,0,"","","Social issues",0
"12/7/2019",2019,12,7,"M","ä¸Šæµ·è´¢ç»å¤§å­¦å›åº”ç–‘æ€§éªšæ‰°äº‹ä»¶","Social scandal",0,0,1,0,"","","Social issues",0
"12/7/2019",2019,12,7,"M","ä¸ºä»€ä¹ˆåŒ…é‚®åŒºä¼šä¸‹å¤§é›ª","Social affairs - environment",1,0,0,0,"","","Soft news",0
"12/7/2019",2019,12,7,"M","æ–°ç–†åæçºªå½•ç‰‡","Social affairs",0,1,0,0,"","","Social issues",1
"12/7/2019",2019,12,7,"M","ç¾å›½ä½›å·ä¸€æµ·å†›åŸºåœ°çªå‘æªå‡»æ¡ˆ","International news (non-China)",1,0,0,0,"","","International news",0
"12/7/2019",2019,12,7,"M","æ­¦æ±‰å–æ¶ˆå¹´åº¦è½æˆ·æ•°é‡é™åˆ¶","Social affairs - local policy ",1,0,0,0,"","","Social policy",0
"12/7/2019",2019,12,7,"M","ç™¾åç«ç®­å†›å¥³æ–°å…µå®£èª“å…¥åˆ—","Role model",1,0,0,0,"","","Flattering news",0
"12/7/2019",2019,12,7,"M","ç¥æœ¨è¢«å®³å°‘å¥³æ¯äº²æ¬²ç”³è¯·æŠ—è¯‰","Crime & court",1,0,0,0,"","","Crime & court",0
"12/7/2019",2019,12,7,"M","å°å· é›ª","Social affairs - environment",1,0,0,0,"","","Soft news",0
"12/7/2019",2019,12,7,"M","2019ä¸­å›½å†…åœ°ç¥¨æˆ¿ç ´600äº¿","Social affairs - trends",1,0,0,0,"","","Soft news",0
"12/7/2019",2019,12,7,"E","å¤±ä¿¡äººå‘˜å†’ååç«è½¦63æ¬¡","Social scandal",1,0,0,0,"","","Social issues",0
"12/7/2019",2019,12,7,"E","CGTNæ­éœ²æ–°ç–†æš´æå¹•åé»‘æ‰‹","Social affairs",0,1,0,0,"","","Social issues",1
"12/7/2019",2019,12,7,"E","ä¸Šè´¢ç–‘çŒ¥äºµå­¦ç”Ÿæ•™æˆå·²åœè¯¾","Social scandal",0,0,0,0,"","","Social issues",0
"12/7/2019",2019,12,7,"E","æ¨æ´ç¯ªåŒç¾å›½å›½åŠ¡å¿è“¬ä½©å¥¥é€šç”µè¯","International affairs (China-US)",1,1,0,0,"","","International news",1
"12/7/2019",2019,12,7,"E","æˆ‘å›½æˆåŠŸå‘å°„å‰æ—ä¸€å·é«˜åˆ†02Bå«æ˜Ÿ","Achievements",1,0,0,0,"","","Flattering news",0
"12/7/2019",2019,12,7,"E","CBAå¤–æ´å¥å›½æ­Œæœªè¡Œæ³¨ç›®ç¤¼è¢«ç½šæ¬¾","Social scandal",1,0,0,0,"","","Social issues",0
"12/8/2019",2019,12,8,"M","9å²ä¸­å›½å¥³å­©è”åˆå›½æ¼”è®²","Role model",1,0,0,0,"","","Flattering news",0
"12/8/2019",2019,12,8,"M","CGTNæ­éœ²æ–°ç–†æš´æå¹•åé»‘æ‰‹","Social affairs",0,1,0,0,"","","Social issues",1
"12/8/2019",2019,12,8,"M","äº‘å—ä¸€è´§è½¦ä¾§ç¿»7æ­»2ä¼¤","Social affairs - disaster",1,0,0,0,"","","Social issues",0
"12/8/2019",2019,12,8,"M","åŒ—äº¬é“è·¯å±€2å‘˜å·¥é­é«˜é“æ’è½§èº«äº¡","Social affairs - disaster",1,0,0,0,"","","Social issues",0
"12/8/2019",2019,12,8,"M","æ¨æ´ç¯ªåŒç¾å›½å›½åŠ¡å¿è“¬ä½©å¥¥é€šç”µè¯","International affairs (China-US)",1,1,0,0,"","","International news",1
"12/8/2019",2019,12,8,"M","é™•è¥¿æ¦†æ—è­¦æ–¹æ‚¬èµ5ä¸‡è¿½æŸ¥å«ŒçŠ¯","Crime & court",1,0,0,0,"","","Crime & court",0
"12/8/2019",2019,12,8,"E","æ•°åƒé¦™æ¸¯å¸‚æ°‘å‚ä¸çˆ±å›½æŠ¤æ¸¯é›†ä¼š","Hong Kong",0,0,0,0,"","","International news",0
"12/8/2019",2019,12,8,"E","ä¸–ç•Œæœ€å¤§å°é’å‚å‘å‡ºç ´äº§è­¦å‘Š","International news (non-China)",1,0,0,0,"","","International news",0
"12/8/2019",2019,12,8,"E","ç»´å¤šåˆ©äºšç€‘å¸ƒå‡ è¿‘å¹²æ¶¸","International news (non-China)",1,0,0,0,"","","International news",0
"12/8/2019",2019,12,8,"E","å—äº¬å°†æŠ•æ”¾1800å¨å‚¨å¤‡å†»çŒªè‚‰","Social affairs - economics",1,0,0,0,"","","Social issues",0
"12/8/2019",2019,12,8,"E","12ä¸‡ç¾å…ƒçš„é¦™è•‰å½“åœºè¢«åƒ","Bizzare",0,0,1,0,"","","Soft news",0
"12/8/2019",2019,12,8,"E","æ¸¯è­¦æ–°ä¸€å“¥è¯´æ­¢æš´åˆ¶ä¹±ä¼šåˆšæŸ”å¹¶æµ","Hong Kong",1,0,0,0,"","","International news",0
"12/8/2019",2019,12,8,"E","æœé²œè¿›è¡Œé‡å¤§è¯•éªŒ","International news (non-China)",1,0,0,0,"","","International news",0
"12/8/2019",2019,12,8,"E","è­¦æ–¹å›åº”14å²å­¦ç”Ÿä½“è‚²æ´»åŠ¨ä¸­æ­»äº¡","Crime & court",1,0,1,0,"","","Crime & court",0
"12/9/2019",2019,12,9,"M","ä¹˜å®¢æ”¶åˆ°å™©è€—èˆªç­ç´§æ€¥æ»‘å›","Social affairs",1,0,0,0,"","","Social issues",0
"12/9/2019",2019,12,9,"M","æ¹–å—è½½22äººæ—…æ¸¸å®¢è½¦ç¿»ä¸‹å±±è°·","Social affairs - disaster",1,0,0,0,"","","Social issues",0
"12/9/2019",2019,12,9,"M","é¦™æ¸¯ç‰¹åŒºæ”¿åºœå¼ºçƒˆè°´è´£çºµç«ç ´åæ³•é™¢","Hong Kong",1,0,0,0,"","","International news",0
"12/9/2019",2019,12,9,"M","ç‰¹æœ—æ™®æŠ±æ€¨å†²å•æ‰€è¦åå‡ æ¬¡","Bizzare",1,0,0,0,"","","Soft news",0
"12/9/2019",2019,12,9,"M","åŒ»ä¿çµé­‚ç ä»·æ‰‹å›åº”ä¸ºä½•ä¸€åˆ†åˆ†è¿˜ä»·","Social affairs",1,0,0,0,"","","Social issues",0
"12/9/2019",2019,12,9,"M","å¼¹çª—å¹¿å‘Šäº”åƒå—ä¹°ç™¾ä¸‡æ›å…‰","Social affairs - economics",1,0,0,0,"","","Social issues",0
"12/9/2019",2019,12,9,"M","ä¸­å›½èˆªå¤©çš„è¶…çº§2019","Achievements",1,0,0,0,"","","Flattering news",0
"12/9/2019",2019,12,9,"M","åä¸ºç»ˆç«¯æ˜å¹´å…¨çº¿æ­è½½é¸¿è’™ç³»ç»Ÿ","Social affairs - economics",1,0,0,0,"","","Social issues",0
"12/9/2019",2019,12,9,"M","æˆéƒ½å¤§é›¾","Social affairs - environment",1,0,0,0,"","","Soft news",0
"12/9/2019",2019,12,9,"M","ä¸­å›½é€Ÿæ»‘é¦–å¤ºç”·å­1500ç±³é‡‘ç‰Œ","Achievements",1,0,0,1,"1","","Flattering news",1
"12/9/2019",2019,12,9,"M","æ·±åœ³å†™å­—æ¥¼éƒ¨åˆ†ç§Ÿé‡‘è·Œè¶…å››æˆ","Social affairs - economics",1,0,0,0,"","","Social issues",0
"12/9/2019",2019,12,9,"E","ä¸Šè´¢å‰¯æ•™æˆè¢«å¼€é™¤","Social scandal",0,0,1,1,"1&2","","Social issues",1
"12/9/2019",2019,12,9,"E","ä¿„ç½—æ–¯é­å›½é™…ç¦èµ›4å¹´","International news (non-China)",1,0,0,0,"","","International news",0
"12/9/2019",2019,12,9,"E","æ•™è‚²éƒ¨å›åº”ä¸­å°å­¦ç¹ä½“å­—è¯†è¯»ææ¡ˆ","Social affairs",1,1,1,0,"","","Social issues",1
"12/9/2019",2019,12,9,"E","å¤®è§†æ­éŸ©å›½å¨±ä¹åœˆè‡ªæ€é­”å’’","Social scandal",1,1,0,0,"","","Social issues",1
"12/9/2019",2019,12,9,"E","è¯ºå¥–å¾—ä¸»ç§°é€ƒç¦»åœ°çƒä¸è´Ÿè´£ä»»","International affairs (non-China)",1,0,0,0,"","","International news",0
"12/9/2019",2019,12,9,"E","é©»é¦™æ¸¯éƒ¨é˜Ÿè€å…µå‘å†›æ——å‘Šåˆ«","Patriotic acts/festivals",1,0,0,0,"","","Flattering news",0
"12/9/2019",2019,12,9,"E","é¦™æ¸¯ç‰¹åŒºæ”¿åºœå¼ºçƒˆè°´è´£çºµç«ç ´åæ³•é™¢","Hong Kong",0,0,0,0,"","","International news",0
"12/9/2019",2019,12,9,"E","å°ç±³æ­£å¼è¿›å…¥æ—¥æœ¬","Social affairs - economics",1,0,0,0,"","","Social issues",0
"12/10/2019",2019,12,10,"M","ä¸¤åƒåªè€ƒæ‹‰æˆ–è¢«å±±ç«çƒ§æ­»","International news (non-China)",0,0,0,0,"","","International news",0
"12/10/2019",2019,12,10,"M","æœˆå…¥ä¸è¶³ä¸‡å…ƒåŸºæœ¬æ— éœ€ç¼´çº³ä¸ªç¨","Social affairs - economics",1,0,0,0,"","","Social issues",0
"12/10/2019",2019,12,10,"M","æ–°è¥¿å…°ç«å±±å–·å‘æœ‰ä¸­å›½å…¬æ°‘å—ä¼¤å¤±è¸ª","Diaspora",1,0,0,0,"","","International news",0
"12/10/2019",2019,12,10,"M","åŒ—äº¬å¤–å–ä¸å¾—ä¸»åŠ¨æä¾›ä¸€æ¬¡æ€§ç­·å­","Social affairs - local policy ",1,0,0,0,"","","Social policy",0
"12/10/2019",2019,12,10,"M","ä¸­å›½æ¯100æˆ·å®¶åº­æœ‰33è¾†æ±½è½¦","Social affairs - trends",1,0,0,0,"","","Soft news",0
"12/10/2019",2019,12,10,"M","æ·±åœ³å¥³å­è¢«ç”·å‹ä»å®¶æ‰“åˆ°æ¥¼é“","Social scandal",1,0,0,0,"","","Social issues",0
"12/10/2019",2019,12,10,"M","ä¸Šè´¢å‰¯æ•™æˆè¢«å¼€é™¤","Social scandal",0,0,1,0,"","","Social issues",0
"12/10/2019",2019,12,10,"M","ä¿„æ€»ç†æ‰¹å…´å¥‹å‰‚é—®é¢˜æ˜¯åä¿„é—¹å‰§","International affairs (non-China)",1,0,0,0,"","","International news",0
"12/10/2019",2019,12,10,"M","ä¿„è¿åŠ¨å‘˜åªèƒ½ä»¥ä¸­ç«‹èº«ä»½å‚èµ›","International affairs (non-China)",1,0,0,0,"","","International news",0
"12/10/2019",2019,12,10,"M","è€å¸ˆåœ°éœ‡é€†è¡Œå†²å›æ•™å®¤","Role model",1,0,0,0,"","","Flattering news",0
"12/10/2019",2019,12,10,"M","åå¤©èµ·æ˜¥è¿è½¦ç¥¨å¼€å”®","Social affairs",1,0,0,0,"","","Social issues",0
"12/10/2019",2019,12,10,"M","æ™®äº¬å›åº”ä¿„ç½—æ–¯è¢«ç¦èµ›","International affairs (non-China)",1,0,0,0,"","","International news",0
"12/10/2019",2019,12,10,"E","è¢éš†å¹³è·¯è¾¹å°åº—ç†å‘16å¹´","Role model",1,0,0,0,"","","Flattering news",0
"12/10/2019",2019,12,10,"E","æ—éƒ‘æœˆå¨¥å‘¨å…­å°†èµ´äº¬è¿°èŒ","Hong Kong",1,0,0,0,"","","International news",0
"12/10/2019",2019,12,10,"E","ä¸Šè´¢å¥³ç”Ÿå°†è¿½ç©¶å‰¯æ•™æˆåˆ‘äº‹è´£ä»»","Social scandal",0,0,1,0,"","","Social issues",0
"12/10/2019",2019,12,10,"E","é¦™æ¸¯å¤šæ‰€å¤§å­¦æš‚å®šæ˜å¹´1æœˆå¼€è¯¾","Hong Kong",1,0,0,0,"","","International news",0
"12/10/2019",2019,12,10,"E","æœ‹å‹åœˆå±è”½åŒäº‹ç½šæ¬¾100å…ƒ","Bizzare",1,0,0,0,"","","Soft news",0
"12/10/2019",2019,12,10,"E","ä¸­å›½é“¶è¡Œæ‰¿å¾·åˆ†è¡Œå› é¿é™é¢è¢«ç½š","Social affairs - local policy ",1,0,0,0,"","","Social policy",0
"12/10/2019",2019,12,10,"E","æ–°è¥¿å…°ç«å±±å–·å‘ä¸¤ä¸­å›½äººå—ä¼¤","Diaspora",0,0,0,0,"","","International news",0
"12/10/2019",2019,12,10,"E","æ±Ÿè‹çœå¼ å®¶æ¸¯å¸‚å–æ¶ˆé™å”®","Social affairs - local policy ",1,0,0,0,"","","Social policy",0
"12/10/2019",2019,12,10,"E","å¤®è§†è¯„æå­æŸ’ä¸ºä½•ç«éå…¨çƒ","Role model",1,1,0,0,"","","Flattering news",1
"12/10/2019",2019,12,10,"E","æ·±åœ³è­¦æ–¹é€šæŠ¥å¥³å­è¢«ç”·å‹æ®´æ‰“","Crime & court",0,0,0,1,"2","12/15: ä»Šæ—¥è¯´æ³•ï¼šå®‡èŠ½å›å¿†å®¶æš´è¿‡ç¨‹","Crime & court",1
"12/11/2019",2019,12,11,"M","å­™æ¨æ¡ˆå°†æ¨è¿Ÿå®£åˆ¤","Social affairs - celebrity",0,0,0,0,"","","Soft news",0
"12/11/2019",2019,12,11,"M","å°è…¿ä¸­ç®­æ¸¯è­¦æ„Ÿè°¢å†…åœ°æ°‘ä¼—æ”¯æ´","Hong Kong",1,0,0,0,"","","International news",0
"12/11/2019",2019,12,11,"M","ç¾å›½æ›å…‰é˜¿å¯Œæ±—æˆ˜äº‰æœºå¯†æ–‡ä»¶","International news (non-China)",1,0,0,0,"","","International news",0
"12/11/2019",2019,12,11,"M","é©»æ¾³é—¨éƒ¨é˜Ÿå®˜å…µå‡†æ—¶å‡èµ·äº”æ˜Ÿçº¢æ——","Patriotic acts/festivals",1,0,0,0,"","","Flattering news",0
"12/11/2019",2019,12,11,"M","ç½‘çº¢ä¹¦åº—è§„å®šæ‰“å¡å¿…ä¹°ä¸€æœ¬ä¹¦","Bizzare",1,0,0,0,"","","Soft news",0
"12/11/2019",2019,12,11,"M","éŸ©å›½äººæ•´ä½“èŠ±çš„æ¯”æŒ£çš„å¤š","International news (non-China)",1,0,0,0,"","","International news",0
"12/11/2019",2019,12,11,"M","ç¾å›½æ–°æ³½è¥¿æªå‡»äº‹ä»¶è‡´6æ­»","International news (non-China)",1,0,0,0,"","","International news",0
"12/11/2019",2019,12,11,"M","æœ‹å‹åœˆå±è”½åŒäº‹ç½šæ¬¾100å…ƒ","Bizzare",0,0,0,0,"","","Soft news",0
"12/11/2019",2019,12,11,"M","åˆå­¦æ ¼æ–—è¢«å®‰æ’ä¸å† å†›å¯¹æ‰“å¿ƒè„éª¤åœ","Social scandal",1,0,0,0,"","","Social issues",0
"12/11/2019",2019,12,11,"M","æ²³å—å·©ä¹‰ä¸‰è½®æ‘©æ‰˜è½¦å å´–äº‹æ•…","Social affairs",1,0,0,0,"","","Social issues",0
"12/11/2019",2019,12,11,"E","ä¸¾æŠ¥å¥³ç”Ÿå›åº”åŒ—å¤§æ•™æˆè¢«è§£è˜","Social scandal",1,0,1,0,"","","Social issues",0
"12/11/2019",2019,12,11,"E","æ®´æ‰“å¥³å‹ç”·å­ä¸ºå®å®‰åˆ†å±€æ°‘è­¦","Social scandal",0,0,1,0,"","","Social issues",0
"12/11/2019",2019,12,11,"E","ä¸€çº¿åŸå¸‚å¿«é€’å‘˜å¾…é‡è¶…ä¸‰å››çº¿å…¬åŠ¡å‘˜","Social affairs - trends",1,0,0,0,"","","Soft news",0
"12/11/2019",2019,12,11,"E","å›½å°åŠå›åº”å°æ¹¾å±…æ°‘å¯åœ¨å†…åœ°å‚åŠ ç¤¾ä¿","Social affairs",1,0,1,0,"","","Social issues",0
"12/11/2019",2019,12,11,"E","åŒ—å¤§è§£è˜ä¸å¤šäººå‘ç”Ÿä¸æ­£å½“å…³ç³»æ•™æˆ","Social scandal",0,0,1,0,"","","Social issues",0
"12/11/2019",2019,12,11,"E","æ¯”åˆ©æ—¶9å²ç¥ç«¥å°†ç›´æ¥è¯»åš","Bizzare",1,0,0,0,"","","Soft news",0
"12/11/2019",2019,12,11,"E","æ˜å¹´ä¸ªç¨ä¸“é¡¹é™„åŠ æ‰£é™¤é‡è¦æé†’","Social affairs - local policy ",1,0,0,0,"","","Social policy",0
"12/11/2019",2019,12,11,"E","æ•™è‚²éƒ¨å‘æ–‡è§„èŒƒæ™®é€šé«˜æ ¡ç‰¹æ®Šç±»å‹æ‹›ç”Ÿ","Social affairs - local policy ",1,0,0,0,"","","Social policy",0
"12/11/2019",2019,12,11,"E","ç¾å…¬å¸ç»™198åå‘˜å·¥å‘ä¸ƒåƒä¸‡å…ƒå¥–é‡‘","International news (non-China)",1,0,0,0,"","","International news",0
"12/11/2019",2019,12,11,"E","æµ·å—è­¦æ–¹æ‚¬èµ50ä¸‡æŠ“æ¶‰é»‘å¥³å¤´ç›®","Crime & court",1,0,0,0,"","","Crime & court",0
"12/11/2019",2019,12,11,"E","å¤®è§†åŠ¨ç”»çŠ¶å‘Šäº¬ä¸œå’Œå¤§å¤´å„¿å­å…¬å¸","Social affairs",1,0,0,0,"","","Social issues",0
"12/11/2019",2019,12,11,"E","æ±‡ä¸°å¸®ç¾å›½å¯Œäººé€ƒç¨è¢«ç½š1.92äº¿ç¾å…ƒ","International news (non-China)",1,0,0,0,"","","International news",0
"12/11/2019",2019,12,11,"E","æ²™ç‰¹é˜¿ç¾æˆå¸‚å€¼æœ€é«˜ä¸Šå¸‚å…¬å¸","International news (non-China)",1,0,0,0,"","","International news",0
"12/11/2019",2019,12,11,"E","å¾·å›½å°†é‡‡ç”¨åä¸ºè®¾å¤‡å»ºè®¾5Gç½‘ç»œ","International news (non-China)",1,0,0,0,"","","International news",0
"",2019,12,12,"M","è€å¸ˆå®¶è®¿é€”ä¸­é‡è½¦ç¥¸2æ­»2ä¼¤","Social affairs",1,0,0,1,"1","","Social issues",1
"12/12/2019",2019,12,12,"M","æ±‡æºæœæ±æˆ–å°†é€€å¸‚","Social affairs - economics",1,0,0,0,"","","Social issues",0
"12/12/2019",2019,12,12,"M","åŒˆç‰™åˆ©è¾±åè¿åŠ¨å‘˜å‘é“æ­‰ä¿¡","International affairs (China related)",1,0,0,0,"","","International news",0
"12/12/2019",2019,12,12,"M","ä¸­å­¦ç¦æ­¢ç½‘è´­å‘ç°å°±æ²¡æ”¶","Social affairs",1,0,0,0,"","","Social issues",0
"12/12/2019",2019,12,12,"M","æ˜å¹´ä¸ªç¨ä¸“é¡¹é™„åŠ æ‰£é™¤é‡è¦æé†’","Social affairs - local policy ",1,0,0,0,"","","Social policy",0
"12/12/2019",2019,12,12,"M","äººæ°‘æ—¥æŠ¥è¯„ä»£æ‹ä¹±è±¡","Social affairs",1,1,0,0,"","","Social issues",1
"12/12/2019",2019,12,12,"M","2020æ˜¥è¿éƒ¨åˆ†è½¦ç¥¨å¼€å”®æ—¥å·²å”®ç½„","Social affairs",1,0,0,0,"","","Social issues",0
"12/12/2019",2019,12,12,"M","å•†åŠ¡éƒ¨2019ç²¾å½©å›åº”","Social affairs",1,1,0,0,"","","Social issues",1
"12/12/2019",2019,12,12,"M","å“ˆå°”æ»¨è­¦æ–¹å†¬å­£å®æˆ˜æ¼”ç»ƒ","Crime & court",1,0,0,0,"","","Crime & court",0
"12/12/2019",2019,12,12,"E","å¤–äº¤éƒ¨ç§°æƒ³é»‘ä¸­å›½ä¹Ÿè¯·ç”¨ç‚¹è„‘å­","International affairs (China related)",1,1,0,0,"","","International news",1
"12/12/2019",2019,12,12,"E","é«˜æ ¡å¥–åŠ±ç”µæ¢¯æ•‘äººåŒå­¦59800å…ƒ","Role model",1,0,0,0,"","","Flattering news",0
"12/12/2019",2019,12,12,"E","æ¾³é—¨å¸‚æ°‘çœ¼ä¸­æœ€å¯çˆ±çš„äºº","Patriotic acts/festivals",1,0,0,0,"","","Flattering news",0
"12/12/2019",2019,12,12,"E","æºå·è½¬ç½‘è¢«è¦æ±‚äº¤1.8ä¸‡è¿çº¦é‡‘","Social scandal",1,0,0,0,"","","Social issues",0
"12/12/2019",2019,12,12,"E","è‹±å›½åœ°ä¸‹å†œåœºç»‘3000ç«¥å¥´","International news (non-China)",1,0,0,0,"","","International news",0
"12/12/2019",2019,12,12,"E","ä¹Œå…‹å…°è®®ä¼šæ‰“æ¶ååœºé¢","International news (non-China)",1,0,0,0,"","","International news",0
"12/12/2019",2019,12,12,"E","12306ç½‘è´­ç«è½¦ç¥¨ä¸šåŠ¡åŠç†æ—¶é—´å»¶é•¿","Social affairs",1,0,0,0,"","","Social issues",0
"12/12/2019",2019,12,12,"E","ä¸­å›½å½±è§†æ˜æ˜Ÿç¤¾ä¼šè´£ä»»ç ”ç©¶æŠ¥å‘Š","Social affairs",1,0,0,0,"","","Social issues",0
"12/12/2019",2019,12,12,"E","ä¸­å¤®å†›å§”ä¸¾è¡Œæ™‹å‡ä¸Šå°†å†›è¡”ä»ªå¼","Patriotic acts/festivals",1,0,0,0,"","","Flattering news",0
"12/13/2019",2019,12,13,"M","éŸ©å›½ç»“å©šäº”å¹´å†…å¤«å¦»å››æˆæ— å­å¥³","International news (non-China)",1,0,0,0,"","","International news",0
"12/13/2019",2019,12,13,"M","å¸æœºçªå‘å¿ƒæ¢—å¥³ä¹˜å®¢æ‹¦è­¦è½¦æ±‚åŠ©","Role model",1,0,0,0,"","","Flattering news",0
"12/13/2019",2019,12,13,"M","å—äº¬å…¨åŸé¸£ç¬›è‡´å“€","Patriotic acts/festivals",1,0,0,0,"","","Flattering news",0
"12/13/2019",2019,12,13,"M","å›½å®¶å…¬ç¥­æ—¥","Patriotic acts/festivals",1,0,0,1,"1","","Flattering news",1
"12/13/2019",2019,12,13,"M","å¦é—¨å•ååœ°é¢å‘ç”Ÿå¡Œé™·","Social affairs - disaster",1,0,0,0,"","","Social issues",0
"12/13/2019",2019,12,13,"M","æ³•å­¦æ¯•ä¸šç”Ÿå·è½¦ç»™æ°‘è­¦æ™®æ³•è¢«æ€¼","Crime & court",1,0,0,0,"","","Crime & court",0
"12/13/2019",2019,12,13,"M","90åå°ä¼™è·³æ°´æ•‘è½»ç”Ÿå§‘å¨˜é‡éš¾","Social affairs",1,0,0,0,"","","Social issues",0
"12/13/2019",2019,12,13,"M","ç™»è®°åœ¨å†Œåœ¨ä¸–å¹¸å­˜è€…ä»…å‰©78ä½","Social affairs - trends",1,0,0,0,"","","Soft news",0
"12/13/2019",2019,12,13,"M","ä¸­å¤®å®šè°ƒ2020å¹´æ¥¼å¸‚","Social affairs - economics",1,1,0,0,"","","Social issues",1
"12/13/2019",2019,12,13,"M","åˆä¸­ç”Ÿå› å‹åŠ›å¤§æ™•å€’åœ¨ç«™å°","Social affairs",1,0,0,0,"","","Social issues",0
"12/13/2019",2019,12,13,"M","ä¹˜å®¢ä¸‡ç±³é«˜ç©ºçªå‘ç™«ç—«è¢«åŒ»ç”Ÿæ•‘æ²»","Social affairs",1,0,0,0,"","","Social issues",0
"12/13/2019",2019,12,13,"M","é¦–ç›¸çº¦ç¿°é€Šèµ¢å¾—è‹±å›½å¤§é€‰","International news (non-China)",1,0,0,0,"","","International news",0
"12/13/2019",2019,12,13,"M","å€™è¡¥è´­ç¥¨å…‘ç°ç‡è¾¾74%","Social affairs - trends",1,0,0,0,"","","Soft news",0
"12/13/2019",2019,12,13,"M","72å²è€å…µå¾’æ­¥ä¸‡é‡Œå¯»å¦»","Bizzare",1,0,0,0,"","","Soft news",0
"12/13/2019",2019,12,13,"M","å—äº¬å¤§å± æ€é‡éš¾åŒèƒä¸›è‘¬åœ°ç”µå­åœ°å›¾","Social affairs",1,0,0,0,"","","Social issues",0
"12/13/2019",2019,12,13,"E","æœµæœµå·²æˆåŠŸè½¬é™¢","Social affairs",1,0,0,1,"1","","Social issues",1
"12/13/2019",2019,12,13,"E","æ•…å®«è€ƒå¤æœ€æ–°å‘ç°","Social affairs",1,0,0,0,"","","Social issues",0
"12/13/2019",2019,12,13,"E","æ—¥æœ¬å°†5Gå®šä¸ºå›½å®¶æˆ˜ç•¥","International news (non-China)",1,0,0,0,"","","International news",0
"12/13/2019",2019,12,13,"E","é¦™æ¸¯å¸‚æ°‘è¯·æ„¿æ”¯æŒè­¦å¯ŸåŠ è–ª","Hong Kong",1,0,0,0,"","","International news",0
"12/13/2019",2019,12,13,"E","å†œæ°‘å·¥æ€•å¼„è„å…¬äº¤ååœ°ä¸Š","Social affairs",1,0,0,0,"","","Social issues",0
"12/13/2019",2019,12,13,"E","æ—¥å†›æ…°å®‰å¦‡åˆ¶åº¦å—å®³è€…é™ˆç¾è‹±å»ä¸–","International news (non-China)",1,0,0,0,"","","International news",0
"12/13/2019",2019,12,13,"E","82å¹´å‰çš„å—äº¬","Social affairs",1,0,0,0,"","","Social issues",0
"12/13/2019",2019,12,13,"E","13å²å°‘å¥³çƒ§å›½æ——è¢«åˆ¤12ä¸ªæœˆæ„ŸåŒ–ä»¤","Social scandal",0,0,0,0,"","","Social issues",0
"12/13/2019",2019,12,13,"E","2025å¹´5Gæ¸—é€ç‡è¾¾48%","Social affairs - trends",1,0,0,0,"","","Soft news",0
"12/13/2019",2019,12,13,"E","ç¦å¸ƒæ–¯2019å…¨çƒæœ€å…·å½±å“åŠ›å¥³æ€§","International news (non-China)",1,0,0,0,"","","International news",0
"12/14/2019",2019,12,14,"M","æ•…å®«è€ƒå¤æœ€æ–°å‘ç°","Social affairs",0,0,0,0,"","","Social issues",0
"12/14/2019",2019,12,14,"M","æ—¥æœ¬å°†5Gå®šä¸ºå›½å®¶æˆ˜ç•¥","International news (non-China)",1,0,0,0,"","","International news",0
"12/14/2019",2019,12,14,"M","é¦™æ¸¯å¸‚æ°‘è¯·æ„¿æ”¯æŒè­¦å¯ŸåŠ è–ª","Hong Kong",1,0,0,0,"","","International news",0
"12/14/2019",2019,12,14,"M","å†œæ°‘å·¥æ€•å¼„è„å…¬äº¤ååœ°ä¸Š","Social affairs",1,0,0,0,"","","Social issues",0
"12/14/2019",2019,12,14,"M","æ—¥å†›æ…°å®‰å¦‡åˆ¶åº¦å—å®³è€…é™ˆç¾è‹±å»ä¸–","International news (non-China)",1,0,0,0,"","","International news",0
"12/14/2019",2019,12,14,"M","82å¹´å‰çš„å—äº¬","Social affairs",1,0,0,0,"","","Social issues",0
"12/14/2019",2019,12,14,"E","äººæ°‘æ—¥æŠ¥æ‰¹è§†é¢‘ç½‘ç«™å¥—è·¯","Social affairs",1,1,0,1,"2","","Social issues",1
"12/14/2019",2019,12,14,"E","é¦™æ¸¯5äººæ¶‰å«Œç½—ä¼¯å‡¶æ€æ¡ˆè¢«æ‹˜æ•","Hong Kong",1,0,0,0,"","","International news",0
"12/14/2019",2019,12,14,"E","90åæ•‘äººé‡éš¾è¢«è¿½æˆè§ä¹‰å‹‡ä¸ºç§°å·","Role model",1,0,0,0,"","","Flattering news",0
"12/14/2019",2019,12,14,"E","éŸ©å›½å•èº«å®¶åº­å ä¸‰æˆ","International news (non-China)",1,0,0,0,"","","International news",0
"12/14/2019",2019,12,14,"E","è¿‘å…­æˆ90åæœ‰å®è´¨æ€§è´Ÿå€º","Social affairs - trends",1,0,0,0,"","","Soft news",0
"12/14/2019",2019,12,14,"E","äº‘å—çœé«˜é™¢åŸé™¢é•¿å› å­™å°æœæ¡ˆè¢«å¤„åˆ†","Government acts",1,0,0,0,"","","Social policy",0
"12/14/2019",2019,12,14,"E","ç©ºå†›ä¸¾è¡Œæ™‹å‡å°†å®˜å†›è¡”ä»ªå¼","Patriotic acts/festivals",1,0,0,0,"","","Flattering news",0
"12/14/2019",2019,12,14,"E","ä¸€ä¸ªæ‰‹æœºappç³»ç»Ÿç–‘è‡´æ•°åäººè‡ªæ€","Crime & court",1,0,0,0,"","","Crime & court",0
"12/15/2019",2019,12,15,"M","æ—¥æœ¬å¥³é«˜ä¸­ç”Ÿé æé‡‘é±¼è€ƒä¸Šå¤§å­¦","Bizzare",1,0,0,0,"","","Soft news",0
"12/15/2019",2019,12,15,"M","æµ™æ±Ÿå«è§†ä»£è¡¨å‡ºå¸­é«˜ä»¥ç¿”è¿½æ‚¼ä¼š","Social affairs - celebrity",0,0,1,0,"","","Soft news",0
"12/15/2019",2019,12,15,"M","è”åˆå›½ç§˜ä¹¦é•¿ æ°”å€™å˜åŒ–æˆ–å¼•å‘ç»æµç¾éš¾","International affairs (non-China)",1,0,0,0,"","","International news",0
"12/15/2019",2019,12,15,"M","ç«‹é™¶å®›æœºåœºè¿ç¦ç‰©å“åšæˆåœ£è¯æ ‘","International news (non-China)",1,0,0,0,"","","International news",0
"12/15/2019",2019,12,15,"M","å®œå®¾äº‹æ•…14åå¤±è”äººå‘˜ä½ç½®ç¡®è®¤","Social affairs - disaster",1,0,0,0,"","","Social issues",0
"12/15/2019",2019,12,15,"M","ä¸­å›½èˆªå¤©2020å¹´ç¡¬æ ¸é¢„å‘Š","Achievements",1,0,0,0,"","","Flattering news",0
"12/15/2019",2019,12,15,"M","é¦™æ¸¯5äººæ¶‰å«Œç½—ä¼¯å‡¶æ€æ¡ˆè¢«æ‹˜æ•","Hong Kong",0,0,0,0,"","","International news",0
"12/15/2019",2019,12,15,"M","å¤§çˆ·è¢«éª—ååå¥—è·¯ä¿å¥å“","Bizzare",1,0,0,0,"","","Soft news",0
"12/15/2019",2019,12,15,"M","å°å­¦å®¶é•¿ç¾¤èŠå–é…’é­å¥³å®¶é•¿æ€¼","Bizzare",1,0,0,0,"","","Soft news",0
"12/15/2019",2019,12,15,"M","åŒ—äº¬ç­‰åœ°å±€åœ°ç§¯é›ªå°†è¶…7å˜ç±³","Social affairs - environment",1,0,0,0,"","","Soft news",0
"12/15/2019",2019,12,15,"M","é€¾å…«æˆèŒåœºå¥³æ€§æœ‰è¿‡ç„¦è™‘æŠ‘éƒ","Social affairs - trends",1,0,0,0,"","","Soft news",0
"12/15/2019",2019,12,15,"E","æ­¦æ±‰å¤§å­¦æ¸…é€€92åå›½é™…å­¦ç”Ÿ","Social affairs",1,0,0,0,"","","Social issues",0
"12/15/2019",2019,12,15,"E","å‘¨ä¸€æ•…å®«é—­é¦†","Social affairs",1,0,0,0,"","","Social issues",0
"12/15/2019",2019,12,15,"E","å­™å°æœæ¯äº²è·åˆ‘20å¹´ç»§çˆ¶è·åˆ‘19å¹´","Crime & court",0,0,0,2,"1","","Crime & court",1
"12/15/2019",2019,12,15,"E","åŒ—äº¬æš´é›ªè“è‰²é¢„è­¦","Social affairs - environment",1,0,0,0,"","","Soft news",0
"12/15/2019",2019,12,15,"E","å†›äº‹ç»å¯†816åœ°ä¸‹æ ¸å·¥ç¨‹é‡è§ä¸–äºº","Social affairs",1,0,0,0,"","","Social issues",0
"12/15/2019",2019,12,15,"E","33å²æ´è—å¹²éƒ¨å·¥ä½œå²—ä½ç¦»ä¸–","Role model",1,0,0,0,"","","Flattering news",0
"12/15/2019",2019,12,15,"E","æƒ…ä¾£æ”¾çƒŸèŠ±æ‹ç…§å¼•å‘å±±ç«","Social affairs",1,0,0,0,"","","Social issues",0
"12/15/2019",2019,12,15,"E","é©»é¦™æ¸¯éƒ¨é˜Ÿæ­¦è£…ç›´å‡æœºç‰¹æŠ€é£è¡Œ","Patriotic acts/festivals",1,0,0,0,"","","Flattering news",0
"12/15/2019",2019,12,15,"E","æ¶‰å­™å°æœæ¡ˆ19äººè·åˆ‘","Crime & court",0,0,0,2,"1","","Crime & court",1
"12/15/2019",2019,12,15,"E","æš‚ä¸å¯¹åŸäº§ç¾å›½éƒ¨åˆ†è¿›å£å•†å“åŠ å¾å…³ç¨","Social affairs - economics",1,0,0,0,"","","Social issues",0
"12/15/2019",2019,12,15,"E","ç—…æ¯’å­¦å®¶ç”°æ³¢é™¢å£«é€ä¸–","Role model",1,0,0,0,"","","Flattering news",0
"12/15/2019",2019,12,15,"E","é…’é©¾é‡æŸ¥æå‡º1.8ä¸‡å¹´åé©¾ç…§","Bizzare",1,0,0,0,"","","Soft news",0
"12/15/2019",2019,12,15,"E","è°·æ­Œåœ°çƒé¦–æ¬¡æŠ«éœ²æ‹æ‘„èŒƒå›´","International news (non-China)",1,0,0,0,"","","International news",0
"12/16/2019",2019,12,16,"M","åŒ—äº¬ä¸‹é›ª","Social affairs - environment",1,0,0,1,"2","","Soft news",1
"12/16/2019",2019,12,16,"M","æ•™å¸ˆä¸¥é‡è¿è§„ç»ˆèº«ç¦æ•™","Government acts",1,0,0,1,"1","","Social policy",1
"12/16/2019",2019,12,16,"M","ä¸Šæµ·ä¸€ç”·å­æŒåˆ€ç äººè­¦æ–¹å¼€æª","Crime & court",1,0,0,0,"","","Crime & court",0
"12/16/2019",2019,12,16,"M","æ±Ÿè‹å®ç°å¸‚å¸‚é€šåŠ¨è½¦","Social affairs - local policy ",1,0,0,0,"","","Social policy",0
"12/16/2019",2019,12,16,"M","2019å¹´æˆ‘å›½å‡è´«äººå£å°†è¶…1000ä¸‡","Social affairs - trends",1,0,0,0,"","","Soft news",0
"12/16/2019",2019,12,16,"M","æ­¦æ±‰å¤§å­¦æ¸…é€€92åå›½é™…å­¦ç”Ÿ","Social affairs",0,0,0,0,"","","Social issues",0
"12/16/2019",2019,12,16,"M","å†›äº‹ç»å¯†816åœ°ä¸‹æ ¸å·¥ç¨‹é‡è§ä¸–äºº","Social affairs",0,0,0,0,"","","Social issues",0
"12/16/2019",2019,12,16,"M","è­¦æ–¹æ‚¬èµ30ä¸‡é€šç¼‰Bçº§é€ƒçŠ¯","Crime & court",1,0,0,0,"","","Crime & court",0
"12/16/2019",2019,12,16,"M","å­™å°æœæ¯äº²è·åˆ‘20å¹´ç»§çˆ¶è·åˆ‘19å¹´","Crime & court",0,0,0,2,"1","","Crime & court",1
"12/16/2019",2019,12,16,"M","82å²é£è¡Œå‘˜å¥¶å¥¶å¿†é›„å¿æ•‘ç¾","Role model",1,0,0,0,"","","Flattering news",0
"12/16/2019",2019,12,16,"E","æ—éƒ‘æœˆå¨¥","Hong Kong",1,0,0,1,"1","","International news",1
"12/16/2019",2019,12,16,"E","å¤®è§†å‘å¸ƒæ–°ç‰ˆä¸ƒå­ä¹‹æ­ŒMV","Patriotic acts/festivals",1,1,0,1,"2","","Flattering news",1
"12/16/2019",2019,12,16,"E","ä¸æ³•åˆ†å­å¬äº†å‘æŠ–çš„äº¤å“ä¹","Leisure",1,0,0,1,"1","","Soft news",1
"12/16/2019",2019,12,16,"E","å°æ¹¾åœ°éœ‡","Social affairs - environment",1,0,0,0,"","","Soft news",0
"12/16/2019",2019,12,16,"E","NASAå°†é€é¦–ä½å¥³å®‡èˆªå‘˜ç™»æœˆ","International news (non-China)",1,0,0,0,"","","International news",0
"12/16/2019",2019,12,16,"E","å¹¿å·åŒ–å·¥å‚ç«ç¾","Social affairs - disaster",1,0,0,0,"","","Social issues",0
"12/17/2019",2019,12,17,"M","45å²èƒ½è¢«å¦ˆå¦ˆæ‰“æ˜¯å¾ˆå¹¸ç¦çš„","Social affairs",1,0,0,2,"1","","Social issues",1
"12/17/2019",2019,12,17,"M","å®˜æ–¹è‡´æ­‰ç«è½¦ç«™æ‰¶æ¢¯é•¿æœŸæœªä½¿ç”¨","Social affairs",1,1,0,0,"","","Social issues",1
"12/17/2019",2019,12,17,"M","ä¸­å›½æ­¦è­¦ç¬¬ä¸€æ¡å¾®åšçš„è¯„è®º","Role model",1,1,0,0,"","","Flattering news",1
"12/17/2019",2019,12,17,"M","å•äººå®¶åº­å°†æˆéŸ©å›½ä¸»æµ","International news (non-China)",1,0,0,0,"","","International news",0
"12/17/2019",2019,12,17,"M","å›½å†…é¦–å®¶åƒäº¿é…’ä¼","Social affairs - economics",1,0,0,0,"","","Social issues",0
"12/17/2019",2019,12,17,"M","å¤®è§†å‘å¸ƒæ–°ç‰ˆä¸ƒå­ä¹‹æ­ŒMV","Patriotic acts/festivals",0,1,0,1,"2","","Flattering news",1
"12/17/2019",2019,12,17,"M","è´µå·å‘ç”Ÿç…¤çŸ¿äº‹æ•…14äººæ­»äº¡","Social affairs - disaster",1,0,0,0,"","","Social issues",0
"12/17/2019",2019,12,17,"M","æ³¢éŸ³æš‚æ—¶åœäº§737MAX","International news (non-China)",1,0,0,0,"","","International news",0
"12/17/2019",2019,12,17,"E","999çš®ç‚å¹³åœ¨åæ§½å¤§ä¼šè¿æ³•æ¤å…¥å¹¿å‘Š","Social affairs - consumer rights",1,0,0,0,"","","Social issues",0
"12/17/2019",2019,12,17,"E","æ‹¼å¤šå¤šè¢«æ›å”®å–å‡æ´‹é…’","Social affairs - consumer rights",1,0,0,0,"","","Social issues",0
"12/17/2019",2019,12,17,"E","æ€¡å£è“®æŠŠæ€¡å£è²å‘Šäº†","Social affairs - consumer rights",1,0,0,0,"","","Social issues",0
"12/17/2019",2019,12,17,"E","çˆ±å¥‡è‰ºå›åº”è¶…å‰ç‚¹æ’­äº‰è®®","Social affairs - consumer rights",1,0,1,0,"","","Social issues",0
"12/17/2019",2019,12,17,"E","æˆ‘å›½é¦–è‰˜å›½äº§èˆªç©ºæ¯èˆ°äº¤ä»˜æµ·å†›","Achievements",1,0,0,0,"","","Flattering news",0
"12/17/2019",2019,12,17,"E","ä¸­å›½æ•°å­—ä¸€çº¿åŸå¸‚å‡ºç‚‰","Social affairs - trends",1,0,0,0,"","","Soft news",0
"12/17/2019",2019,12,17,"E","å’–å•¡å¯èƒ½æˆå¥¢ä¾ˆå“","Social affairs - trends",1,0,0,0,"","","Soft news",0
"12/17/2019",2019,12,17,"E","åŒ»é™¢è‡´æ­‰å¹¼å„¿è¾“æ¶²ç®¡ä¸­æœ‰è™«","Social scandal",1,0,0,0,"","","Social issues",0
"12/17/2019",2019,12,17,"E","æ¬§æ´²ä¹°å®¶æ”¶åˆ°ä¸­å›½é€ MacPro","International news (China related)",1,0,0,0,"","","International news",0
"12/17/2019",2019,12,17,"E","ä¹Œå…‹å…°äººæŠŠä¸€åŠé’±ç”¨åœ¨åƒå–ä¸Š","International news (non-China)",1,0,0,0,"","","International news",0
"12/17/2019",2019,12,17,"E","æ²¡æœ‰æš´åŠ›çš„é¦™æ¸¯æ˜¯ä»€ä¹ˆæ ·","Hong Kong",1,0,0,0,"","","International news",0
"12/18/2019",2019,12,18,"M","è…¾è®¯çˆ±å¥‡è‰ºä¿®æ”¹è¶…å‰ç‚¹æ’­è§„åˆ™","Social affairs - consumer rights",0,0,1,0,"","","Social issues",0
"12/18/2019",2019,12,18,"M","4ä¸‡å¨ä¸­å¤®å‚¨å¤‡å†»çŒªè‚‰å°†æŠ•æ”¾","Social affairs - economics",1,0,0,0,"","","Social issues",0
"12/18/2019",2019,12,18,"M","å››å·èµ„ä¸­5.2çº§åœ°éœ‡","Social affairs - disaster",1,0,0,0,"","","Social issues",0
"12/18/2019",2019,12,18,"M","341ä¸‡äººæŠ¥å2020å¹´ç ”è€ƒ","Social affairs - trends",1,0,0,0,"","","Soft news",0
"12/18/2019",2019,12,18,"M","åŒ—äº¬æ¾³é—¨å¤§å­¦ç”Ÿéš”ç©ºåˆå”±ä¸ƒå­ä¹‹æ­Œ","Patriotic acts/festivals",1,0,0,1,"1","","Flattering news",1
"12/18/2019",2019,12,18,"M","æ—¥æœ¬æ€§åˆ«å¹³ç­‰æ’åè·Œè‡³å†å²æœ€ä½","International news (non-China)",1,0,0,0,"","","International news",0
"12/18/2019",2019,12,18,"M","ä¸‰æ˜Ÿæ‰‹æœºå½»åº•é€€å‡ºä¸­å›½åˆ¶é€ ","International news (China related)",1,0,0,0,"","","International news",0
"12/18/2019",2019,12,18,"M","AirPods Proç¾å›½å…¨ç½‘è„±é”€","International news (non-China)",1,0,0,0,"","","International news",0
"12/18/2019",2019,12,18,"M","æ‹¼å¤šå¤šå›åº”å•†å®¶å”®å‡é…’","Social affairs - consumer rights",1,0,1,0,"","","Social issues",0
"12/18/2019",2019,12,18,"M","å››å·ç…¤çŸ¿äº‹æ•…è¢«å›°13äººå…¨éƒ¨æ•‘å‡º","Social affairs - disaster",0,0,1,1,"1","","Social issues",1
"12/18/2019",2019,12,18,"M","æœ‰è™«è¾“æ¶²ç®¡æ¶‰äº‹å‚å®¶æ›¾å¤šæ¬¡è¿æ³•","Social affairs - consumer rights",0,0,1,0,"","","Social issues",0
"12/18/2019",2019,12,18,"M","æ—¥æœ¬å…¬å¸å…è®¸æ¯å‘¨ä¼‘å‡4å¤©","International news (non-China)",1,0,0,0,"","","International news",0
"12/18/2019",2019,12,18,"M","ä»Šå¹´å¹³å‡æ¯äººèŠ±44å…ƒçœ‹ç”µå½±","Social affairs - trends",1,0,0,0,"","","Soft news",0
"12/18/2019",2019,12,18,"M","ç¾å›½34%å®¶åº­ç§Ÿæˆ¿","International news (non-China)",1,0,0,0,"","","International news",0
"12/18/2019",2019,12,18,"E","è…¾è®¯å› è¶…å‰ç‚¹æ’­è¢«èµ·è¯‰","Social affairs - consumer rights",0,0,0,0,"","","Social issues",0
"12/18/2019",2019,12,18,"E","7ä¸ªæœˆå¤§å©´å„¿å°±ä»»ç¾å›½åèª‰å¸‚é•¿","International news (non-China)",1,0,0,0,"","","International news",0
"12/18/2019",2019,12,18,"E","äºŒç»´ç ä¹‹çˆ¶é¦–è°ˆä¸­å›½ä½¿ç”¨è¶…æ—¥æœ¬","International news (non-China)",1,0,0,0,"","","International news",0
"12/18/2019",2019,12,18,"E","æ²ˆé˜³å¸‚å…¬å®‰å±€å›åº”åœ¨æ ¡å¤§å­¦ç”Ÿè¢«ä¼¤å®³","Social affairs",1,0,1,0,"","","Social issues",0
"12/18/2019",2019,12,18,"E","å¤–äº¤éƒ¨å›åº”ç¾æˆç«‹å¤ªç©ºéƒ¨é˜Ÿ","International affairs (non-China)",1,0,0,0,"","","International news",0
"12/18/2019",2019,12,18,"E","æµ™å·¥å¤§å±å³°æ ¡åŒºå­¦ç”Ÿå®¿èˆç€ç«","Social scandal",1,0,0,0,"","","Social issues",0
"12/18/2019",2019,12,18,"E","å¼ æœé˜³è°ˆè§†é¢‘ä¼šå‘˜åŠ ä»·","Social affairs - consumer rights",0,0,1,0,"","","Social issues",0
"12/18/2019",2019,12,18,"E","è´§è½¦è¿½å°¾è½¿è½¦å¯¼è‡´5æ­»1ä¼¤","Social affairs - disaster",1,0,0,0,"","","Social issues",0
"12/18/2019",2019,12,18,"E","13åè¢«å›°çŸ¿å·¥é ä¸€ç›’å‰©é¥­æ’‘åˆ°è·æ•‘","Social affairs - disaster",0,0,0,0,"","","Social issues",0
"12/19/2019",2019,12,19,"M","åœ°éœ‡æ—¶å¹¼å„¿å›­è€å¸ˆæŠ“èµ·å¨ƒå°±è·‘","Role model",0,0,0,0,"","","Flattering news",0
"12/19/2019",2019,12,19,"M","æ¼ æ²³å†»æ¢¨å˜é“é”¤","Social affairs - environment",1,0,0,0,"","","Soft news",0
"12/19/2019",2019,12,19,"M","å­¦éœ¸å¯å®¤6äººè·15ä¸ªåæ ¡offer","Role model",1,0,0,0,"","","Flattering news",0
"12/19/2019",2019,12,19,"M","éŸ©å›½å›½åŠ¡æ€»ç†ç§˜ä¹¦å®¤çªé­æœæŸ¥","International news (non-China)",1,0,0,0,"","","International news",0
"12/19/2019",2019,12,19,"M","é¦™æ¸¯å–æ¶ˆè·¨å¹´çƒŸèŠ±æ±‡æ¼”","Hong Kong",1,0,0,0,"","","International news",0
"12/19/2019",2019,12,19,"M","å†œå†å°å¹´ç«è½¦ç¥¨","Social affairs - trends",1,0,0,0,"","","Soft news",0
"12/19/2019",2019,12,19,"M","ç¾ä¼—è®®é™¢å†³å®šå¼¹åŠ¾ç‰¹æœ—æ™®","International news (non-China)",1,0,0,1,"1","","International news",1
"12/19/2019",2019,12,19,"M","3åè‹±å›½å¥³è®®å‘˜å¸¦å®å®å®£èª“å…¥èŒ","International news (non-China)",1,0,0,0,"","","International news",0
"12/19/2019",2019,12,19,"M","å¤®è¡Œ14å¤©æœŸé€†å›è´­åˆ©ç‡ä¸‹é™","Social affairs - economics",1,0,0,0,"","","Social issues",0
"12/19/2019",2019,12,19,"M","æ–°èƒ½æºè½¦é€€å½¹ç”µæ± è¾¾20ä¸‡å¨","Social affairs - trends",1,0,0,0,"","","Soft news",0
"12/19/2019",2019,12,19,"M","æ˜å¹´èµ·é¥²æ–™ç¦æ­¢æ·»åŠ æŠ—ç”Ÿç´ ","Social affairs - local policy ",1,0,0,0,"","","Social policy",0
"12/19/2019",2019,12,19,"E","åœ°éœ‡ç¬é—´ä¸ˆå¤«ä¸€æŠŠæ‹‰å›æ€€å­•å¦»å­","Role model",0,0,0,0,"","","Flattering news",0
"12/19/2019",2019,12,19,"E","åº†ç¥æ¾³é—¨å›å½’ç¥–å›½20å‘¨å¹´æ–‡è‰ºæ™šä¼š","Patriotic acts/festivals",1,0,0,1,"1","","Flattering news",1
"12/19/2019",2019,12,19,"E","é¦™æ¦­ä¸½èˆå¤§è¡—æ‹Ÿ2.5äº¿æ¬§å…ƒç¿»ä¿®","International news (non-China)",1,0,0,0,"","","International news",0
"12/19/2019",2019,12,19,"E","ç‰¹æœ—æ™®å›åº”é­å¼¹åŠ¾","International news (non-China)",1,0,1,0,"","","International news",0
"12/19/2019",2019,12,19,"E","å¾·å›½åå¯¹å°†åä¸ºæ’é™¤åœ¨5Gå»ºè®¾ä¹‹å¤–","International news (non-China)",1,0,0,0,"","","International news",0
"12/19/2019",2019,12,19,"E","77åé©»æ¾³é—¨éƒ¨é˜Ÿå®˜å…µæ‘†å‡ºè²èŠ±å›¾æ¡ˆ","Patriotic acts/festivals",1,0,0,0,"","","Flattering news",0
"12/19/2019",2019,12,19,"E","æ²ˆé˜³é“è·¯å¼€è¡Œé›ªå›½åˆ—è½¦","Social affairs",1,0,0,0,"","","Social issues",0
"12/20/2019",2019,12,20,"M","åº†ç¥æ¾³é—¨å›å½’ç¥–å›½20å‘¨å¹´å¤§ä¼š","Patriotic acts/festivals",0,0,0,0,"","","Flattering news",0
"12/20/2019",2019,12,20,"M","æ»´æ»´é¡ºé£è½¦å°†åœ¨åŒ—äº¬ç­‰5åŸå¸‚è¯•è¿è¥","Social affairs - economics",1,0,0,0,"","","Social issues",0
"12/20/2019",2019,12,20,"M","æ³•é™¢ç›´æ’­å‚¬è€èµ–è¿˜é’±","Social affairs",1,0,0,0,"","","Social issues",0
"12/20/2019",2019,12,20,"M","æ¾³é—¨é‡‘è²èŠ±å¹¿åœºå‡æ——ä»ªå¼","Patriotic acts/festivals",0,0,0,1,"1","","Flattering news",1
"12/20/2019",2019,12,20,"M","ä¸æ‰«é—¨å‰åƒåœ¾è·ç™¾æ–¤é‡åƒåœ¾æ¡¶","Social affairs - local policy ",1,0,0,0,"","","Social policy",0
"12/20/2019",2019,12,20,"M","è‹±å›½å‘æ˜æ–°æ¬¾é©¬æ¡¶ç¼©çŸ­å‘˜å·¥å¦‚å•æ—¶é—´","International news (non-China)",1,0,0,0,"","","International news",0
"12/20/2019",2019,12,20,"M","åŒ—äº¬å¤–å–åƒåœ¾åˆ†ç±»","Social affairs - local policy ",1,0,0,0,"","","Social policy",0
"12/20/2019",2019,12,20,"M","çå­å²›å›åº”å¤–æ¥è´è´¨ç–‘","Social affairs - consumer rights",1,0,1,0,"","","Social issues",0
"12/20/2019",2019,12,20,"M","å…¨çƒç”·æ€§å¸çƒŸè€…æ•°é‡é¦–æ¬¡ä¸‹é™","International news (non-China)",1,0,0,0,"","","International news",0
"12/20/2019",2019,12,20,"M","æ‰‹æœºèƒ½è¯»å–ç”µå­æŠ¤ç…§äº†","Social affairs - local policy ",1,0,0,0,"","","Social policy",0
"12/20/2019",2019,12,20,"M","12é¡¹èµ„æ ¼è€ƒè¯•æŠ¥åå¯æ— è¯æ˜åŠç†","Social affairs - local policy ",1,0,0,0,"","","Social policy",0
"12/20/2019",2019,12,20,"E","é¦™æ¸¯å·²æœ‰80åæ•™å¸ˆè¢«æ•","Hong Kong",1,0,0,0,"","","International news",0
"12/20/2019",2019,12,20,"E","ç›¸äº²ä¸­æœ€å—æ¬¢è¿çš„å¥³ç”ŸèŒä¸š","Social affairs - trends",1,0,0,0,"","","Soft news",0
"12/20/2019",2019,12,20,"E","å…µé©¬ä¿‘å‘å†…æµ‡æ°´","Social scandal",1,0,0,0,"","","Social issues",0
"12/20/2019",2019,12,20,"E","æœªè¾¾åˆ‘è´£å¹´é¾„æœªæˆå¹´äººä¸èƒ½ä¸€æ”¾äº†ä¹‹","Crime & court",1,0,0,0,"","","Crime & court",0
"12/20/2019",2019,12,20,"E","ä¸æ”¾è¿‡ä»»ä½•ä¸€ä¸ªä¾µå®³æœªæˆå¹´äººçŠ¯ç½ªæ¡ˆä»¶","Crime & court",1,0,0,0,"","","Crime & court",0
"12/20/2019",2019,12,20,"E","é…’é¬¼é…’è¢«ä¸¾æŠ¥éæ³•æ·»åŠ ç”œèœœç´ ","Social affairs - consumer rights",1,0,0,0,"","","Social issues",0
"12/20/2019",2019,12,20,"E","2.67äº¿Facebookç”¨æˆ·ä¿¡æ¯è¢«å…¬å¼€","International news (non-China)",1,0,0,0,"","","International news",0
"12/20/2019",2019,12,20,"E","17æ¬¾APPè‡ªåŠ¨ç»­è´¹ä¸é€šçŸ¥","Social affairs - consumer rights",1,0,0,0,"","","Social issues",0
"12/20/2019",2019,12,20,"E","ç¤¾ä¿å¡æŒå¡äººæ•°è¶…13äº¿","Social affairs - trends",1,0,0,0,"","","Soft news",0
"12/20/2019",2019,12,20,"E","è¿‘å…­æˆå¿«é€’å°å“¥æ›¾è‡ªè¡Œèµ”ä»˜","Social affairs - trends",1,0,0,0,"","","Soft news",0
"12/21/2019",2019,12,21,"M","æ˜å¹´å°†åˆ¶å®šä¸ªäººä¿¡æ¯ä¿æŠ¤æ³•","Social affairs - local policy ",1,0,0,0,"","","Social policy",0
"12/21/2019",2019,12,21,"M","æ¾³æ´²äººç»™çŒ«å¤´é¹°æµ‡æ°´é™æ¸©","International news (non-China)",1,0,0,0,"","","International news",0
"12/21/2019",2019,12,21,"M","å·´é»åœ£æ¯é™¢ä»Šå¹´ä¸åº†ç¥åœ£è¯èŠ‚","International news (non-China)",1,0,0,0,"","","International news",0
"12/21/2019",2019,12,21,"M","é¦™æ¸¯å·²æœ‰80åæ•™å¸ˆè¢«æ•","Hong Kong",0,0,0,0,"","","International news",0
"12/21/2019",2019,12,21,"M","ä¸æ”¾è¿‡ä»»ä½•ä¸€ä¸ªä¾µå®³æœªæˆå¹´äººçŠ¯ç½ªæ¡ˆä»¶","Crime & court",0,0,0,0,"","","Crime & court",0
"12/21/2019",2019,12,21,"M","æ°”å€™å˜åŒ–è‡´æ‰€ç½—é—¨11å²›æ¶ˆå¤±","International news (non-China)",1,0,0,0,"","","International news",0
"12/21/2019",2019,12,21,"M","æ°”æ³¡å±éšœé˜»æŒ¡æµ·æ´‹åƒåœ¾","International news (non-China)",1,0,0,0,"","","International news",0
"12/21/2019",2019,12,21,"M","ä¿„å†›ç”¨3Dæ‰“å°æœºä¿®æˆ˜æ–—æœº","International news (non-China)",1,0,0,0,"","","International news",0
"12/21/2019",2019,12,21,"E","22å²å¥³å­©å»ä¸–æçŒ®å™¨å®˜è®©3äººæ–°ç”Ÿ","Role model",1,0,0,0,"","","Flattering news",0
"12/21/2019",2019,12,21,"E","éŸ©å›½æ›å¹½çµæ•´å®¹æ•°ç™¾äººä¸§å‘½","International news (non-China)",1,0,0,0,"","","International news",0
"12/21/2019",2019,12,21,"E","æ¾³é—¨å­©å­è¯´è¦å°†ä¸­å›½å›½ç²¹ä¼ ä¸‹å»","Patriotic acts/festivals",1,0,0,0,"","","Flattering news",0
"12/21/2019",2019,12,21,"E","90åå‡ºçº³å‘˜819æ¬¡æŒªç”¨å…¬æ¬¾","Social scandal",1,0,0,0,"","","Social issues",0
"12/21/2019",2019,12,21,"E","å½“æ°‘æ—ä¹å™¨é‡ä¸Šä¸ƒå­ä¹‹æ­Œ","Patriotic acts/festivals",1,0,0,0,"","","Flattering news",0
"12/21/2019",2019,12,21,"E","æ˜å¹´å°†åˆ¶å®šä¸ªäººä¿¡æ¯ä¿æŠ¤æ³•","Social affairs - local policy ",0,0,0,0,"","","Social policy",0
"12/21/2019",2019,12,21,"E","å‰æ—å æ±Ÿå¤§å®¢è½¦äº‹å‘ç›‘æ§","Social affairs - disaster",1,0,0,1,"1","","Social issues",1
"12/21/2019",2019,12,21,"E","2023å¹´å…¨çƒäººå£å°†è¾¾80äº¿","International news (non-China)",1,0,0,0,"","","International news",0
"12/21/2019",2019,12,21,"E","æ‘å¹²éƒ¨é»˜è®¸ä¸´æ±¾è´«å›°æˆ·çƒ§ç…¤","Role model",1,0,0,0,"","","Flattering news",0
"12/22/2019",2019,12,22,"M","æ–°å…¥ä¼æ¶ˆé˜²å‘˜é€¼çœŸç«åœºè®­ç»ƒ","Crime & court",1,0,0,0,"","","Crime & court",0
"12/22/2019",2019,12,22,"M","è€äººé­ä¸‰è¿æ’äº‹æ•…ä¸¤è‚‡äº‹è€…è½ç½‘","Crime & court",0,0,1,0,"","","Crime & court",0
"12/22/2019",2019,12,22,"M","å¹¿ä¸œä¸­å±±ä¸€å°åŒºç«ç¾è‡´6æ­»","Social affairs - disaster",1,0,0,0,"","","Social issues",0
"12/22/2019",2019,12,22,"M","å½“æ°‘æ—ä¹å™¨é‡ä¸Šä¸ƒå­ä¹‹æ­Œ","Patriotic acts/festivals",1,0,0,0,"","","Flattering news",0
"12/22/2019",2019,12,22,"M","æ¾³é—¨å­©å­è¯´è¦å°†ä¸­å›½å›½ç²¹ä¼ ä¸‹å»","Patriotic acts/festivals",1,0,0,1,"2","","Flattering news",1
"12/22/2019",2019,12,22,"M","BBCæ€»ç»“ä¸­å›½80åäº”å¤§ç‰¹å¾","International affairs (China related)",1,0,0,0,"","","International news",0
"12/22/2019",2019,12,22,"M","ç¾å›½è½½äººé£èˆ¹é¦–é£å¤±è´¥","International news (non-China)",1,0,0,0,"","","International news",0
"12/22/2019",2019,12,22,"M","ä¸–ç•Œæœ€å¤§å°é’å‚æ¿’ä¸´ç ´äº§","International news (non-China)",1,0,0,0,"","","International news",0
"12/22/2019",2019,12,22,"M","è‚¥èƒ–è€…æ¯å¹´é¢å¤–æ’å‡º7äº¿å¨äºŒæ°§åŒ–ç¢³","Social affairs - trends",1,0,0,0,"","","Soft news",0
"12/22/2019",2019,12,22,"M","é•¿å®‰ç¦ç‰¹30å²å·¥ç¨‹å¸ˆå äº¡","Bizzare",1,0,0,0,"","","Soft news",0
"12/22/2019",2019,12,22,"E","å¾®åšå›åº”å…³é—­åˆ˜é‘«è´¦å·","Social scandal",1,0,1,0,"","","Social issues",0
"12/22/2019",2019,12,22,"E","å¤®è§†æ›å…‰å¥èº«æˆ¿åŠå¡é™·é˜±","Social affairs - consumer rights",1,1,0,0,"","","Social issues",1
"12/22/2019",2019,12,22,"E","ä¸€é€šéªšæ‰°ç”µè¯æœ€é«˜å¯ç½šæ¬¾7ä¸‡å…ƒ","International news (non-China)",1,0,0,0,"","","International news",0
"12/22/2019",2019,12,22,"E","è¿åƒ12ä¸ªåŒ…å­æ¶ˆé˜²å‘˜å› ç—…ç¦»èŒ","Role model",1,0,0,0,"","","Flattering news",0
"12/22/2019",2019,12,22,"E","å¤–å–å‘˜ç–‘å› å·®è¯„æŒåˆ€ä¼¤äºº","Crime & court",1,0,0,0,"","","Crime & court",0
"12/22/2019",2019,12,22,"E","ç¾å›¢å¦è®¤ä¼¤äººå¤–å–å‘˜å› å·®è¯„è¡Œå‡¶","Crime & court",0,0,1,0,"","","Crime & court",0
"12/22/2019",2019,12,22,"E","å¤å·´æ—¶éš”43å¹´é‡æ–°æ‹¥æœ‰æ€»ç†","International news (non-China)",1,0,0,0,"","","International news",0
"12/22/2019",2019,12,22,"E","è­¦æ–¹é€šæŠ¥å¤–å–å°å“¥æŒåˆ€ä¼¤äºº","Crime & court",0,0,1,0,"","","Crime & court",0
"12/22/2019",2019,12,22,"E","ç‰¹ç§å…µç©ºä¸­ä¼é™é­é‡å¤šç§é™©æƒ…","Role model",1,0,0,0,"","","Flattering news",0
"12/23/2019",2019,12,23,"M","æˆ‘å›½äº”åˆ†ä¹‹ä¸€å†°å·æ¶ˆè","Social affairs - environment",1,0,0,0,"","","Soft news",0
"12/23/2019",2019,12,23,"M","ä¸€é€šéªšæ‰°ç”µè¯æœ€é«˜å¯ç½šæ¬¾7ä¸‡å…ƒ","International news (non-China)",1,0,0,0,"","","International news",0
"12/23/2019",2019,12,23,"M","å½“å¤–å†›çœ‹åˆ°ä¸­å›½å†›äººçš„æ‰‹","Role model",1,0,0,0,"","","Flattering news",0
"12/23/2019",2019,12,23,"M","è­¦æ–¹é€šæŠ¥æ²ˆå¤§ç ”ç©¶ç”Ÿåœ¨æ ¡è¢«åˆºæ¡ˆ","Crime & court",1,1,0,0,"","","Crime & court",1
"12/23/2019",2019,12,23,"M","ä¸œäº¬å¥¥è¿æ°‘å®¿ä»·æ ¼ä¸Šæ¶¨è‡³23å€","International news (non-China)",1,0,0,0,"","","International news",0
"12/23/2019",2019,12,23,"M","éŸ©å›½æœ‰æˆ¿è¶…10å¥—äººæ•°åˆ›æ–°é«˜","International news (non-China)",1,0,0,0,"","","International news",0
"12/23/2019",2019,12,23,"M","æ¾³ç çƒŸèŠ±æ±‡æ¼”","Patriotic acts/festivals",1,0,0,0,"","","Flattering news",0
"12/23/2019",2019,12,23,"M","è­¦æ–¹é€šæŠ¥å¤–å–å°å“¥æŒåˆ€ä¼¤äºº","Crime & court",0,1,0,0,"","","Crime & court",1
"12/23/2019",2019,12,23,"M","å¾®åšå›åº”å…³é—­åˆ˜é‘«è´¦å·","Social scandal",0,0,1,0,"","","Social issues",0
"12/23/2019",2019,12,23,"M","åŠ è“¬é¦–éƒ½4åä¸­å›½èˆ¹å‘˜è¢«ç»‘æ¶","Diaspora",1,0,0,0,"","","International news",0
"12/23/2019",2019,12,23,"M","å¤©æ´¥è“Ÿå·3.3çº§åœ°éœ‡","Social affairs - disaster",1,0,0,0,"","","Social issues",0
"12/23/2019",2019,12,23,"M","é¦–æ‰¹èµ´é»ç»´å’Œå¥³æ‰«é›·æ‰‹","Role model",1,0,0,0,"","","Flattering news",0
"12/23/2019",2019,12,23,"E","2019å¹´èµ´éŸ©ä¸­å›½æ¸¸å®¢åˆ›æ–°é«˜","Social affairs - trends",1,0,0,0,"","","Soft news",0
"12/23/2019",2019,12,23,"E","æµé˜³èŠ±ç‚®å‚çˆ†ç‚¸ç’æŠ¥æ­»äº¡äººæ•°","Social affairs - disaster",0,0,1,0,"","","Social issues",0
"12/23/2019",2019,12,23,"E","æ–‡åœ¨å¯…è¡¨ç¤ºé¦™æ¸¯æ–°ç–†éƒ½æ˜¯ä¸­å›½å†…æ”¿","International affairs (China related)",1,0,0,0,"","","International news",0
"12/23/2019",2019,12,23,"E","æ—¥æœ¬æ¬²å°†æ ¸æ±¡æ°´æ’å…¥å¤§æ°”æˆ–å¤§æµ·","International news (non-China)",1,0,0,0,"","","International news",0
"12/23/2019",2019,12,23,"E","iphonexç”µæ± åŠ£åŒ–æé†’","Social affairs - consumer rights",1,0,0,0,"","","Social issues",0
"12/23/2019",2019,12,23,"E","ç™»è®°åœ¨å†Œåœ¨ä¸–å¹¸å­˜è€…åªå‰©77äºº","Social affairs - trends",1,0,0,0,"","","Soft news",0
"12/23/2019",2019,12,23,"E","è¥¿è—æ‰€æœ‰å¿åŒºå…¨éƒ¨è„±è´«æ‘˜å¸½","Achievements",1,0,0,0,"","","Flattering news",0
"12/23/2019",2019,12,23,"E","æ³¢éŸ³é£èˆ¹ä»»åŠ¡å¤±è´¥æå‰è¿”å›åœ°çƒ","International news (non-China)",1,0,0,0,"","","International news",0
"12/23/2019",2019,12,23,"E","æ³¢éŸ³CEOè¾èŒ","International news (non-China)",1,0,0,0,"","","International news",0
"12/24/2019",2019,12,24,"M","è€¿çˆ½å°´å°¬ä¸å¤±ç¤¼è²Œçš„å¾®ç¬‘","International affairs (China related)",1,1,0,0,"","","International news",1
"12/24/2019",2019,12,24,"M","é¦™æ¸¯è‡ª6æœˆèµ·å‘ç”Ÿé€¾4000å®—èµ·åº•ä¸ªæ¡ˆ","Hong Kong",1,0,0,0,"","","International news",0
"12/24/2019",2019,12,24,"M","äº¬éƒ½åŠ¨ç”»ç«ç¾7åˆ†é’Ÿåæ— äººé€ƒå‡º","International news (non-China)",1,0,0,0,"","","International news",0
"12/24/2019",2019,12,24,"M","ä¸‰æˆéŸ©å›½äººé«˜å­¦å†ä½å°±ä¸š","International news (non-China)",1,0,0,0,"","","International news",0
"12/24/2019",2019,12,24,"M","è¯¥ä¸è¯¥å–æ¶ˆå¤–å–å°å“¥å·®è¯„åˆ¶åº¦","Social affairs - consumer rights",1,0,0,0,"","","Social issues",0
"12/24/2019",2019,12,24,"M","æ–‡åœ¨å¯…è¡¨ç¤ºé¦™æ¸¯æ–°ç–†éƒ½æ˜¯ä¸­å›½å†…æ”¿","International affairs (China related)",0,1,1,0,"","","International news",1
"12/24/2019",2019,12,24,"M","ç¾å›½å‘ç°3.85äº¿å¹´å‰æ£®æ—åŒ–çŸ³","International news (non-China)",1,0,0,0,"","","International news",0
"12/24/2019",2019,12,24,"M","è¾¹é˜²å®˜å…µåŒ–é›ªæ°´ç…®é¥ºå­ä¸ºæˆ˜å‹åº†ç”Ÿ","Role model",1,0,0,0,"","","Flattering news",0
"12/24/2019",2019,12,24,"M","æŒ–63ç±³åœ°é“æŠ¢é“¶è¡Œ","Bizzare",1,0,0,0,"","","Soft news",0
"12/24/2019",2019,12,24,"M","æ³°å›½æ€å¦»éª—ä¿æ¡ˆä»Šæ—¥å®£åˆ¤","Crime & court",1,0,0,0,"","","Crime & court",0
"12/24/2019",2019,12,24,"M","ä½å»ºéƒ¨ æ˜å¹´æˆ¿åœ°äº§å¸‚åœºç¨³å­—å½“å¤´","Social affairs - economics",1,1,0,0,"","","Social issues",1
"12/24/2019",2019,12,24,"E","ä¸Šæµ·å¤§ç»Ÿè·¯ç«ç¾","Social affairs - disaster",1,0,0,0,"","","Social issues",0
"12/24/2019",2019,12,24,"E","è€¿çˆ½å°´å°¬ä¸å¤±ç¤¼è²Œçš„å¾®ç¬‘","International affairs (China related)",0,1,0,0,"","","International news",1
"12/24/2019",2019,12,24,"E","ç¾å›¢é¥¿äº†ä¹ˆç­‰ç­¾äº¤é€šå®‰å…¨å®ˆæ³•æ‰¿è¯ºä¹¦","Social affairs - local policy ",1,0,0,0,"","","Social policy",0
"12/24/2019",2019,12,24,"E","è´­è½¦äº”å¹´åçš„æ–°è½¦ä¸»å¹³å‡èƒ–20æ–¤","Social affairs - trends",1,0,0,0,"","","Soft news",0
"12/24/2019",2019,12,24,"E","é¦™æ¸¯è‡ª6æœˆèµ·å‘ç”Ÿé€¾4000å®—èµ·åº•ä¸ªæ¡ˆ","Hong Kong",0,0,0,0,"","","International news",0
"12/24/2019",2019,12,24,"E","ä¸¤å²¸2020æ˜¥èŠ‚èˆªç­åŠ ç­æ€»é‡ä¸é™","Social affairs",1,0,0,0,"","","Social issues",0
"12/24/2019",2019,12,24,"E","è¿‘äº”æˆå¤§å­¦ç”Ÿæ¯å¤©è¯»ä¹¦ä¸è¶³åŠå°æ—¶","Social affairs - trends",1,0,0,0,"","","Soft news",0
"12/24/2019",2019,12,24,"E","å°å­¦æ¨ä¸Šå­¦æ‰“å¡APPè¢«å«åœ","Social affairs - local policy ",1,0,0,0,"","","Social policy",0
"12/25/2019",2019,12,25,"M","å›½åŠ¡é™¢ è§„èŒƒä¼ä¸šè£å‘˜è¡Œä¸º","Social affairs - local policy ",1,1,0,0,"","","Social policy",1
"12/25/2019",2019,12,25,"M","å®‰å€è¯´ä¸­æ—¥éŸ©å¹¶éé­èœ€å´","International affairs (China related)",1,0,0,0,"","","International news",0
"12/25/2019",2019,12,25,"M","å¢æ£®å ¡å°†æˆé¦–ä¸ªå…¬äº¤å…¨å…è´¹å›½å®¶","International news (non-China)",1,0,0,0,"","","International news",0
"12/25/2019",2019,12,25,"M","ä¿å¥å“å…¬å¸è€æ€»æ¼”è®²æ—¶èº«äº¡","Social affairs",1,0,0,0,"","","Social issues",0
"12/25/2019",2019,12,25,"M","åœŸè±ªå…¬å¸æ˜¥èŠ‚æ”¾å‡19å¤©","Bizzare",1,0,0,0,"","","Soft news",0
"12/25/2019",2019,12,25,"M","æ¹–å—ä¸€å•†åœºæŠ›æ°”çƒ2äººå—ä¼¤","Bizzare",1,0,0,0,"","","Soft news",0
"12/25/2019",2019,12,25,"M","è€¿çˆ½å°´å°¬ä¸å¤±ç¤¼è²Œçš„å¾®ç¬‘","International affairs (China related)",1,0,0,0,"","","International news",0
"12/25/2019",2019,12,25,"M","ä¸Šæµ·å¤§ç»Ÿè·¯ç«ç¾","Social affairs - disaster",1,0,0,0,"","","Social issues",0
"12/25/2019",2019,12,25,"M","æµ™æ±Ÿä¸€é«˜æ ¡è¢«åœ°äº§å•†ä¹°ä¸‹","Social affairs",1,0,0,0,"","","Social issues",0
"12/25/2019",2019,12,25,"M","å°åº¦å‘ç”Ÿæ´‹è‘±å±æœº","International news (non-China)",1,0,0,0,"","","International news",0
"12/25/2019",2019,12,25,"M","å°åº¦ä¸€æ¶é£æœºè¢«å¡åœ¨æ¡¥ä¸‹","International news (non-China)",1,0,0,0,"","","International news",0
"12/25/2019",2019,12,25,"M","å¹¿ä¸œç»Ÿä¸€äººèº«æŸå®³èµ”å¿æ ‡å‡†","Social affairs - local policy ",1,0,0,0,"","","Social policy",0
"12/25/2019",2019,12,25,"E","æå°é¾™å¥³å„¿èµ·è¯‰çœŸåŠŸå¤«é¤é¥®","Social affairs - economics",1,0,0,0,"","","Social issues",0
"12/25/2019",2019,12,25,"E","å®‰å€æ™‹ä¸‰æ¥å—æ°´å‡ç›Šä¸“è®¿","International affairs (China related)",1,0,0,0,"","","International news",0
"12/25/2019",2019,12,25,"E","95åå…¨èŒå¦ˆå¦ˆå æ¯”å…«æˆ","Social affairs - trends",1,0,0,0,"","","Soft news",0
"12/25/2019",2019,12,25,"E","iPhone XRæˆQ3æœ€ç•…é”€æ™ºèƒ½æœº","Social affairs - trends",1,0,0,0,"","","Soft news",0
"12/25/2019",2019,12,25,"E","300ä¸‡ä»¥ä¸‹å¸¸ä½äººå£åŸå¸‚å–æ¶ˆè½æˆ·é™åˆ¶","Social affairs - local policy ",1,0,0,0,"","","Social policy",0
"12/25/2019",2019,12,25,"E","å…¬å®‰éƒ¨å¯¹30äººå‘å‡ºAçº§é€šç¼‰ä»¤","Crime & court",1,0,0,0,"","","Crime & court",0
"12/25/2019",2019,12,25,"E","äºšé©¬é€Šä¸€æ¡è™šå‡å¥½è¯„116å…ƒ","International news (non-China)",1,0,0,0,"","","International news",0
"12/25/2019",2019,12,25,"E","æ¸©å·æœ¬ç§‘ç”Ÿä¹°æˆ¿æ‰“7æŠ˜ç§Ÿæˆ¿3æŠ˜","Social affairs - local policy ",1,0,0,0,"","","Social policy",0
"12/25/2019",2019,12,25,"E","å¹¿ä¸œç«ç¾å¤«å¦»ä¿©ä¸ºçŸ¥åä¼ä¸šå®¶","Social affairs - disaster",1,0,1,0,"","","Social issues",0
"12/25/2019",2019,12,25,"M","ç‹æ€èªæ‰¿æ‹…ç†ŠçŒ«äº’å¨±20äº¿æŸå¤±","Social affairs - celebrity",1,0,0,0,"","","Soft news",0
"12/26/2019",2019,12,26,"M","è”é€š5Gèµ‹èƒ½æ™ºæ…§å†¬å¥¥","Achievements",1,0,0,0,"","","Flattering news",0
"12/26/2019",2019,12,26,"M","å·´é»åœ£æ¯é™¢ä¸€åŠæ¦‚ç‡æ— æ³•æŒ½æ•‘","International news (non-China)",1,0,0,0,"","","International news",0
"12/26/2019",2019,12,26,"M","300ä¸‡ä»¥ä¸‹å¸¸ä½äººå£åŸå¸‚å–æ¶ˆè½æˆ·é™åˆ¶","Social affairs - local policy ",0,0,0,0,"","","Social policy",0
"12/26/2019",2019,12,26,"M","çœŸåŠŸå¤«å›åº”è¢«è¯‰ä¾µæƒ","Social affairs - economics",1,0,1,0,"","","Social issues",0
"12/26/2019",2019,12,26,"M","ä¿„ç½—æ–¯æˆåŠŸä¸å…¨çƒäº’è”ç½‘æ–­å¼€","International news (non-China)",1,0,0,0,"","","International news",0
"12/26/2019",2019,12,26,"M","24å²è¾…è­¦æ‰§å‹¤ä¸­è¢«æ’ç‰ºç‰²","Role model",1,0,0,0,"","","Flattering news",0
"12/26/2019",2019,12,26,"M","ç”˜è‚ƒä¸€ä¼ä¸šé“¶è¡Œè´¦å·è¢«å†»ç»“æ— æ³•è§£å°","Social affairs",1,0,0,0,"","","Social issues",0
"12/26/2019",2019,12,26,"M","è­¦ç¤ºç‰Œæå“å¸æœºåŠç†ETC","Social affairs",1,0,0,0,"","","Social issues",0
"12/26/2019",2019,12,26,"M","å®‰å€æ™‹ä¸‰æ¥å—æ°´å‡ç›Šä¸“è®¿","International affairs (China related)",0,0,0,0,"","","International news",0
"12/26/2019",2019,12,26,"M","ä¸‰æˆéŸ©å›½é’å°‘å¹´æ²¡æœ‰å‹‡æ°”ç”Ÿæ´»","International news (non-China)",1,0,0,0,"","","International news",0
"12/26/2019",2019,12,26,"M","æ ¸æ¡ƒä»·æ ¼åˆ›æ–°ä½","Social affairs - trends",1,0,0,0,"","","Soft news",0
"12/26/2019",2019,12,26,"M","95åå…¨èŒå¦ˆå¦ˆå æ¯”å…«æˆ","Social affairs - trends",0,0,0,0,"","","Soft news",0
"12/26/2019",2019,12,26,"M","æ¶ˆé˜²å‘˜ç”¨èº«ä½“æŒ¡ä½è½çŸ³","Role model",1,0,0,0,"","","Flattering news",0
"12/26/2019",2019,12,26,"E","çœŸåŠŸå¤«ä¸ä¸æå°é¾™å¥³å„¿åº­å¤–å’Œè§£","Social affairs - economics",0,0,1,0,"","","Social issues",0
